outbreakId,reportId,diseaseName,diseaseType,startDate,endDate,status,totalOutbreaks,totalCases,locationName,species,animalCategoryLabel,isClusterLabel,latitude,longitude,animalCategory,isCluster,geometry,date
140928,4247,H5N1 (HPAI non. Plt),,21/09/2024,31/12/2024,Resolved,1,,Tulare County,Euphagus cyanocephalus,Wild,No,36.329,-119.315,wild,FALSE,POINT (-119.3115234375 36.3328280873792),2024-09-21
112351,4247,H5N1 (HPAI non. Plt),,6/12/2022,31/12/2022,Resolved,1,,Pershing County,Centrocercus urophasianus,Wild,No,40.181,-118.476,wild,FALSE,POINT (-118.4765625 40.17887331434699),2022-12-06
106714,4247,H5N1 (HPAI non. Plt),,3/08/2022,31/12/2022,Resolved,1,,North Slope Borough,Rissa tridactyla,Wild,No,71.248,-156.77,wild,FALSE,POINT (-156.77490234375 71.24788765673645),2022-08-03
124638,4247,H5N1 (HPAI non. Plt),,19/07/2023,31/12/2023,Resolved,1,,North Slope Borough,Ardenna tenuirostris,Wild,No,71.292,-156.783,wild,FALSE,POINT (-156.785888671875 71.29374720578107),2023-07-19
143545,4247,H5N1 (HPAI non. Plt),,5/11/2024,,Continuing,1,8,Honolulu County,"Anas platyrhynchos, Birds, Cairina moschata",Domestic and wild,No,21.306,-157.86,both,FALSE,POINT (-157.862548828125 21.309846141087192),2024-11-05
143683,4247,H5N1 (HPAI non. Plt),,7/11/2024,,Continuing,1,,Honolulu County,Birds,Domestic,No,21.306,-157.861,domestic,FALSE,POINT (-157.862548828125 21.309846141087192),2024-11-07
144026,4247,H5N1 (HPAI non. Plt),,1/11/2024,31/12/2024,Resolved,1,1,Honolulu County,Anatidae (incognita),Wild,No,21.307,-157.857,wild,FALSE,POINT (-157.8515625 21.309846141087192),2024-11-01
148262,4247,H5N1 (HPAI non. Plt),,31/12/2024,,Continuing,1,,Brazoria County,Birds,Domestic,No,29.168,-95.431,domestic,FALSE,POINT (-95.42724609375 29.171348850951503),2024-12-31
108963,4247,empty strain - H5N1 (HPAI non. Plt),,7/10/2022,31/12/2022,Resolved,1,1,Chambers County,"Plegadis falcinellus, Sterna forsteri",Wild,No,29.769,-94.685,wild,FALSE,POINT (-94.68017578125 29.76437737516312),2022-10-07
116579,4247,H5N1 (HPAI non. Plt),,11/10/2022,31/12/2022,Resolved,1,,Chambers County,Ajaia ajaja,Wild,No,29.773,-94.687,wild,FALSE,POINT (-94.691162109375 29.773913869992242),2022-10-11
108428,4247,H5N1 (HPAI non. Plt),,19/10/2022,31/12/2022,Resolved,1,,Cameron and Jefferson Davis Parish,Anas discors,Wild,No,29.795,-93.326,wild,FALSE,POINT (-93.328857421875 29.792984135470505),2022-10-19
146548,4247,H5N1 (HPAI non. Plt),,6/12/2024,,Continuing,1,,Jefferson Davis Parish,Birds,Domestic,No,30.218,-92.641,domestic,FALSE,POINT (-92.63671875 30.221101852485987),2024-12-06
151596,4247,H5N1 (HPAI non. Plt),,1/02/2025,,Continuing,1,,Calcasieu Parish,Birds,Domestic,No,30.237,-93.363,domestic,FALSE,POINT (-93.36181640625 30.240086360983426),2025-02-01
127941,4247,H5N1 (HPAI non. Plt),,8/11/2023,1/04/2024,Resolved,1,,Grimes County,Birds,Domestic,No,30.489,-95.997,domestic,FALSE,POINT (-95.99853515625 30.486550842588485),2023-11-08
148261,4247,H5N1 (HPAI non. Plt),,2/01/2025,,Continuing,1,,Burnet County,Birds,Domestic,No,30.757,-98.227,domestic,FALSE,POINT (-98.228759765625 30.76071890894447),2025-01-02
108970,4247,H5N1 (HPAI non. Plt),,13/10/2022,31/12/2022,Resolved,1,,Catahoula Parish,Balearica regulorum,Wild,No,31.772,-91.824,wild,FALSE,POINT (-91.82373046875 31.77487761850739),2022-10-13
127276,4247,H5N1 (HPAI non. Plt),,24/10/2023,31/12/2023,Resolved,1,,Pima County,"Cyanocorax chrysops, Eudocimus ruber, Sarcoramphus papa",Wild,No,32.222,-111.974,wild,FALSE,POINT (-111.97265625 32.222095840502334),2023-10-24
127577,4247,H5N1 (HPAI non. Plt),,27/10/2023,2/04/2024,Resolved,1,,Ellis County,Birds,Domestic,No,32.385,-96.846,domestic,FALSE,POINT (-96.844482421875 32.38923910985902),2023-10-27
145442,4247,H5N1 (HPAI non. Plt),,7/12/2024,,Continuing,1,,Bossier Parish,Birds,Domestic,No,32.68,-93.744,domestic,FALSE,POINT (-93.746337890625 32.676372772089834),2024-12-07
109559,4247,H5N1 (HPAI non. Plt),,9/11/2022,31/12/2022,Resolved,1,,San Diego County,"Ardeidae (incognita), Egretta thula, Plegadis chihi",Wild,No,32.717,-117.166,wild,FALSE,POINT (-117.169189453125 32.71335535317755),2022-11-09
107127,4247,H5N1 (HPAI non. Plt),,16/09/2022,1/03/2023,Resolved,1,,Dallas County,Birds,Domestic,No,32.756,-96.796,domestic,FALSE,POINT (-96.800537109375 32.759562025650126),2022-09-16
108971,4247,H5N1 (HPAI non. Plt),,25/10/2022,31/12/2022,Resolved,1,,Tarrant County,Phoenicopterus minor,Wild,No,32.756,-97.319,wild,FALSE,POINT (-97.31689453125 32.759562025650126),2022-10-25
152601,4247,H5N1 (HPAI non. Plt),,1/01/2025,,Continuing,1,,Graham County,Birds,Domestic,No,32.833,-109.717,domestic,FALSE,POINT (-109.720458984375 32.833442846649504),2025-01-01
112082,4247,H5N1 (HPAI non. Plt),,15/12/2022,31/12/2022,Resolved,1,,San Diego County,Branta bernicla,Wild,No,32.841,-117.121,wild,FALSE,POINT (-117.125244140625 32.84267363195431),2022-12-15
106827,4247,clade 2.3.4.4.b - H5N1 (HPAI) - Eurasian,,10/09/2022,31/12/2022,Resolved,1,,Issaquena County,Anas discors,Wild,No,32.902,-91.053,wild,FALSE,POINT (-91.0546875 32.89803818160523),2022-09-10
108637,4247,H5N1 (HPAI non. Plt),,17/10/2022,17/02/2023,Resolved,1,,Rockwall County,Birds,Domestic,No,32.916,-96.433,domestic,FALSE,POINT (-96.43798828125 32.91648534731439),2022-10-17
151594,4247,H5N1 (HPAI non. Plt),,31/01/2025,,Continuing,1,,Pinal County,Birds,Domestic,No,32.977,-111.517,domestic,FALSE,POINT (-111.522216796875 32.98102014898147),2025-01-31
110194,4247,H5N1 (HPAI non. Plt),,29/11/2022,6/04/2023,Resolved,1,,Denton County,Birds,Domestic,No,33.045,-97.021,domestic,FALSE,POINT (-97.020263671875 33.045507814909996),2022-11-29
145482,4247,H5N1 (HPAI non. Plt),,2/12/2024,,Continuing,1,,Lafayette County,Birds,Domestic,No,33.358,-93.577,domestic,FALSE,POINT (-93.58154296875 33.35806161277887),2024-12-02
111058,4247,H5N1 (HPAI non. Plt),,4/11/2022,31/12/2022,Resolved,1,,Maricopa County,Pelecanus crispus,Wild,No,33.451,-112.074,wild,FALSE,POINT (-112.071533203125 33.44977658311845),2022-11-04
145326,4247,H5N1 (HPAI non. Plt),,19/11/2024,,Continuing,1,,Maricopa County,Birds,Domestic,No,33.447,-112.075,domestic,FALSE,POINT (-112.071533203125 33.44977658311845),2024-11-19
109557,4247,H5N1 (HPAI non. Plt),,14/11/2022,31/12/2022,Resolved,1,,Maricopa County,Rhea americana,Wild,No,33.462,-112.108,wild,FALSE,POINT (-112.1044921875 33.45894275368764),2022-11-14
104356,4247,H5N1 (HPAI non. Plt),,7/06/2022,30/06/2022,Resolved,1,,Maricopa County,Nannopterum brasilianum,Wild,No,33.465,-112.11,wild,FALSE,POINT (-112.115478515625 33.46810795527897),2022-06-07
108250,4247,H5N1 (HPAI non. Plt),,3/10/2022,31/12/2022,Resolved,1,,Orange County,Nycticorax nycticorax,Wild,No,33.593,-117.76,wild,FALSE,POINT (-117.762451171875 33.596318961132695),2022-10-03
145903,4247,H5N1 (HPAI non. Plt),,20/11/2024,,Continuing,1,,Riverside County,Birds,Domestic,No,33.714,-116.22,domestic,FALSE,POINT (-116.224365234375 33.715201644740844),2024-11-20
126592,4247,H5N1 (HPAI non. Plt),,11/10/2023,19/02/2024,Resolved,1,,Carter County,Birds,Domestic,No,34.172,-97.13,domestic,FALSE,POINT (-97.130126953125 34.17090836352574),2023-10-11
116479,4247,H5N1 (HPAI non. Plt),,12/03/2023,24/07/2023,Resolved,1,,Hale County,Birds,Domestic,No,34.181,-101.703,domestic,FALSE,POINT (-101.700439453125 34.17999758688083),2023-03-12
135061,4247,H5N1 (HPAI non. Plt),,9/05/2024,30/06/2024,Resolved,1,,Roosevelt County,"Piranga rubra, Streptopelia decaocto, Zenaida macroura",Wild,No,34.191,-103.337,wild,FALSE,POINT (-103.33740234375 34.189085831172406),2024-05-09
109923,4247,H5N1 (HPAI non. Plt),,26/11/2022,4/04/2023,Resolved,1,,Arkansas County,Birds,Domestic,No,34.279,-91.339,domestic,FALSE,POINT (-91.34033203125 34.279914398549934),2022-11-26
108589,4247,H5N1 (HPAI non. Plt),,29/10/2022,17/03/2023,Resolved,1,,Yavapai County,Birds,Domestic,No,34.541,-112.47,domestic,FALSE,POINT (-112.467041015625 34.542762387234845),2022-10-29
108588,4247,H5N1 (HPAI non. Plt),,25/10/2022,17/03/2023,Resolved,1,,Yavapai County,Birds,Domestic,No,34.548,-112.45,domestic,FALSE,POINT (-112.445068359375 34.551811369170494),2022-10-25
108962,4247,H5N1 (HPAI non. Plt),,24/10/2022,31/12/2022,Resolved,1,,Pulaski County,Branta canadensis,Wild,No,34.748,-92.276,wild,FALSE,POINT (-92.274169921875 34.7506398050501),2022-10-24
133451,4247,empty strain - H5N1 (HPAI non. Plt),,13/03/2024,25/07/2024,Resolved,1,,Deaf Smith County,Birds,Domestic,No,34.812,-102.398,domestic,FALSE,POINT (-102.392578125 34.813803317113155),2024-03-13
129066,4247,H5N1 (HPAI non. Plt),,10/12/2023,14/04/2024,Resolved,1,,Scott County,Birds,Domestic,No,34.901,-94.093,domestic,FALSE,POINT (-94.097900390625 34.903952965590065),2023-12-10
127151,4247,H5N1 (HPAI non. Plt),,28/10/2023,29/02/2024,Resolved,1,,Grady County,Birds,Domestic,No,35.053,-97.937,domestic,FALSE,POINT (-97.93212890625 35.05698043137265),2023-10-28
110399,4247,H5N1 (HPAI non. Plt),,22/10/2022,31/12/2022,Resolved,1,,Bernalillo County,Branta canadensis,Wild,No,35.083,-106.653,wild,FALSE,POINT (-106.6552734375 35.083955579276434),2022-10-22
117755,4247,H5N1 (HPAI non. Plt),,7/04/2023,30/06/2023,Resolved,1,,San Luis Obispo County,Urile penicillatus,Wild,No,35.12,-120.612,wild,FALSE,POINT (-120.60791015625 35.11990857099681),2023-04-07
107411,4247,H5N1 (HPAI non. Plt),,1/10/2022,3/02/2023,Resolved,1,,Bernalillo County,Birds,Domestic,No,35.145,-106.677,domestic,FALSE,POINT (-106.67724609375 35.1468629067563),2022-10-01
117276,4247,H5N1 (HPAI non. Plt),,20/03/2023,30/06/2023,Resolved,1,,Coconino County,Gymnogyps californianus,Wild,No,35.199,-111.646,wild,FALSE,POINT (-111.64306640625 35.200744801724014),2023-03-20
108166,4247,empty strain - H5N1 (HPAI non. Plt),,15/10/2022,20/02/2023,Resolved,1,,Cleveland County,Birds,Domestic,No,35.233,-97.424,domestic,FALSE,POINT (-97.4267578125 35.23664622093196),2022-10-15
147232,4247,H5N1 (HPAI non. Plt),,5/12/2024,,Continuing,1,,Pope County,Birds,Domestic,No,35.278,-93.134,domestic,FALSE,POINT (-93.131103515625 35.281500657891186),2024-12-05
111062,4247,H5N1 (HPAI non. Plt),,16/11/2022,31/12/2022,Resolved,1,,San Luis Obispo County,"Fulmarus glacialis, Larus philadelphia",Wild,No,35.29,-120.659,wild,FALSE,POINT (-120.662841796875 35.29046856590878),2022-11-16
108636,4247,H5N1 (HPAI non. Plt),,13/10/2022,3/03/2023,Resolved,1,,Pope County,Birds,Domestic,No,35.306,-93.139,domestic,FALSE,POINT (-93.14208984375 35.308401401691626),2022-10-13
129606,4247,H5N1 (HPAI non. Plt),,8/12/2023,17/05/2024,Resolved,1,,Carson County,Birds,Domestic,No,35.346,-101.382,domestic,FALSE,POINT (-101.3818359375 35.34425514918409),2023-12-08
145324,4247,H5N1 (HPAI non. Plt),,17/11/2024,,Continuing,1,,Roger Mills County,Birds,Domestic,No,35.613,-99.671,domestic,FALSE,POINT (-99.66796875 35.612650818756705),2024-11-17
146551,4247,H5N1 (HPAI non. Plt),,13/12/2024,,Continuing,1,,Jackson County,Birds,Domestic,No,35.616,-91.286,domestic,FALSE,POINT (-91.285400390625 35.612650818756705),2024-12-13
146552,4247,H5N1 (HPAI non. Plt),,15/12/2024,,Continuing,1,,Craighead County,Birds,Domestic,No,35.817,-90.757,domestic,FALSE,POINT (-90.758056640625 35.81781315869661),2024-12-15
147231,4247,H5N1 (HPAI non. Plt),,5/12/2024,,Continuing,1,,Craighead County,Birds,Domestic,No,35.838,-90.71,domestic,FALSE,POINT (-90.714111328125 35.8356283888737),2024-12-05
133088,4247,H5N1 (HPAI non. Plt),,6/03/2024,25/07/2024,Resolved,1,,Moore County,Birds,Domestic,No,35.858,-101.973,domestic,FALSE,POINT (-101.97509765625 35.862343734896484),2024-03-06
127023,4247,H5N1 (HPAI non. Plt),,26/10/2023,28/02/2024,Resolved,1,,Wagoner County,Birds,Domestic,No,35.96,-95.374,domestic,FALSE,POINT (-95.372314453125 35.96022296929668),2023-10-26
108203,4247,H5N1 (HPAI non. Plt),,12/10/2022,16/02/2023,Resolved,1,,Creek County,Birds,Domestic,No,36.029,-96.092,domestic,FALSE,POINT (-96.097412109375 36.03133177633187),2022-10-12
108638,4247,H5N1 (HPAI non. Plt),,10/10/2022,16/02/2023,Resolved,1,,Tulsa County,Birds,Domestic,No,36.143,-95.979,domestic,FALSE,POINT (-95.9765625 36.14674677781437),2022-10-10
147233,4247,H5N1 (HPAI non. Plt),,29/12/2024,,Continuing,1,,Sharp County,Birds,Domestic,No,36.228,-91.606,domestic,FALSE,POINT (-91.60400390625 36.2265501474709),2024-12-29
127746,4247,H5N1 (HPAI non. Plt),,9/11/2023,19/03/2024,Resolved,1,,San Juan County,Birds,Domestic,No,36.276,-108.203,domestic,FALSE,POINT (-108.204345703125 36.27970720524017),2023-11-09
143060,4247,H5N1 (HPAI non. Plt),,29/10/2024,,Continuing,1,,Tulare County,Birds,Domestic,No,36.328,-119.314,domestic,FALSE,POINT (-119.3115234375 36.32397712011263),2024-10-29
142045,4247,H5N1 (HPAI non. Plt),,23/10/2024,28/02/2025,Resolved,1,,Tulare County,Birds,Domestic,No,36.329,-119.315,domestic,FALSE,POINT (-119.3115234375 36.3328280873792),2024-10-23
110047,4247,H5N1 (HPAI non. Plt),,1/12/2022,5/04/2023,Resolved,1,,Pawnee County,Birds,Domestic,No,36.339,-96.802,domestic,FALSE,POINT (-96.800537109375 36.34167804918316),2022-12-01
143544,4247,H5N1 (HPAI non. Plt),,30/10/2024,,Continuing,1,,Kings County,Birds,Domestic,No,36.374,-119.669,domestic,FALSE,POINT (-119.674072265625 36.37706783983681),2024-10-30
129604,4247,H5N1 (HPAI non. Plt),,15/12/2023,24/04/2024,Resolved,1,,Garfield County,Birds,Domestic,No,36.397,-97.88,domestic,FALSE,POINT (-97.877197265625 36.39475669987385),2023-12-15
108427,4247,H5N1 (HPAI non. Plt),,28/09/2022,31/12/2022,Resolved,1,,Monterey County,Larus occidentalis,Wild,No,36.678,-121.655,wild,FALSE,POINT (-121.651611328125 36.677230602346214),2022-09-28
114320,4247,H5N1 (HPAI non. Plt),,25/01/2023,30/06/2023,Resolved,1,,Monterey County,Arenaria melanocephala,Wild,No,36.678,-121.655,wild,FALSE,POINT (-121.651611328125 36.677230602346214),2023-01-25
106909,4247,H5N1 (HPAI non. Plt),,11/09/2022,22/02/2023,Resolved,1,,Fresno County,Birds,Domestic,No,36.717,-119.785,domestic,FALSE,POINT (-119.783935546875 36.721273880045004),2022-09-11
151583,4247,H5N1 (HPAI non. Plt),,16/11/2024,,Continuing,1,,Madera County,Birds,Domestic,No,36.958,-120.061,domestic,FALSE,POINT (-120.05859375 36.95867113153031),2024-11-16
108363,4247,H5N1 (HPAI non. Plt),,18/10/2022,21/02/2023,Resolved,1,,La Plata County,Birds,Domestic,No,37.278,-107.869,domestic,FALSE,POINT (-107.86376953125 37.274052809979054),2022-10-18
145480,4247,H5N1 (HPAI non. Plt),,1/12/2024,,Continuing,1,,La Plata County,Birds,Domestic,No,37.274,-107.879,domestic,FALSE,POINT (-107.874755859375 37.274052809979054),2024-12-01
108208,4247,H5N1 (HPAI non. Plt),,9/10/2022,10/02/2023,Resolved,1,,La Plata County,Birds,Domestic,No,37.283,-107.869,domestic,FALSE,POINT (-107.86376953125 37.28279464911044),2022-10-09
130095,4247,H5N1 (HPAI non. Plt),,1/01/2024,8/05/2024,Resolved,1,,Merced County,Birds,Domestic,No,37.307,-120.433,domestic,FALSE,POINT (-120.43212890625 37.30901407427592),2024-01-01
132627,4247,H5N1 (HPAI non. Plt),,8/01/2024,30/06/2024,Resolved,1,,Merced County,Bubulcus ibis,Wild,No,37.313,-120.484,wild,FALSE,POINT (-120.487060546875 37.30901407427592),2024-01-08
110191,4247,H5N1 (HPAI non. Plt),,2/12/2022,8/04/2023,Resolved,1,,Dade County,Birds,Domestic,No,37.415,-93.841,domestic,FALSE,POINT (-93.84521484375 37.413800350662896),2022-12-02
146218,4247,H5N1 (HPAI non. Plt),,16/12/2024,,Continuing,1,,Dade County ,Birds,Domestic,No,37.415,-93.841,domestic,FALSE,POINT (-93.84521484375 37.413800350662896),2024-12-16
111443,4247,H5N1 (HPAI non. Plt),,20/12/2022,5/05/2023,Resolved,1,,Elk County,Birds,Domestic,No,37.469,-96.262,domestic,FALSE,POINT (-96.26220703125 37.46613860234406),2022-12-20
151588,4247,H5N1 (HPAI non. Plt),,21/01/2025,,Continuing,1,,San Mateo County,Birds,Domestic,No,37.581,-122.329,domestic,FALSE,POINT (-122.332763671875 37.579412513438385),2025-01-21
146550,4247,H5N1 (HPAI non. Plt),,17/12/2024,,Continuing,1,,Sedgwick County,Birds,Domestic,No,37.629,-97.286,domestic,FALSE,POINT (-97.283935546875 37.63163475580643),2024-12-17
99307,4247,empty strain - H5N1 (HPAI non. Plt),,12/03/2022,22/08/2022,Resolved,1,,Sedgwick County,Birds,Domestic,No,37.674,-97.403,domestic,FALSE,POINT (-97.40478515625 37.67512527892127),2022-03-12
146545,4247,H5N1 (HPAI non. Plt),,4/12/2024,,Continuing,1,,Cedar County,Birds,Domestic,No,37.705,-93.789,domestic,FALSE,POINT (-93.790283203125 37.70120736474139),2024-12-04
107149,4247,H5N1 (HPAI non. Plt),,23/09/2022,31/12/2022,Resolved,1,,Alameda County,Larus californicus,Wild,No,37.743,-122.213,wild,FALSE,POINT (-122.2119140625 37.74465712069939),2022-09-23
132139,4247,H5N1 (HPAI non. Plt),,17/01/2024,30/06/2024,Resolved,1,,Alameda County,Calidris mauri,Wild,No,37.78,-122.264,wild,FALSE,POINT (-122.266845703125 37.779398571318765),2024-01-17
112069,4247,H5N1 (HPAI non. Plt),,24/12/2022,5/05/2023,Resolved,1,,San Joaquin County,Birds,Domestic,No,37.886,-121.282,domestic,FALSE,POINT (-121.278076171875 37.88352498087133),2022-12-24
113588,4247,H5N1 (HPAI non. Plt),,22/01/2023,2/06/2023,Resolved,1,,San Joaquin County,Birds,Domestic,No,37.954,-121.287,domestic,FALSE,POINT (-121.2890625 37.95286091815649),2023-01-22
114368,4247,H5N1 (HPAI non. Plt),,14/02/2023,16/06/2023,Resolved,1,,San Joaquin County,Birds,Domestic,No,37.95,-121.264,domestic,FALSE,POINT (-121.26708984375 37.95286091815649),2023-02-14
118931,4247,H5N1 (HPAI non. Plt),,13/05/2023,14/09/2023,Resolved,1,,Phelps County,Birds,Domestic,No,37.956,-91.774,domestic,FALSE,POINT (-91.768798828125 37.95286091815649),2023-05-13
111070,4247,H5N1 (HPAI non. Plt),,13/12/2022,31/12/2022,Resolved,1,,Finney County,Quiscalus mexicanus,Wild,No,37.969,-100.876,wild,FALSE,POINT (-100.87646484375 37.97018468810549),2022-12-13
106135,4247,H5N1 (HPAI non. Plt),,16/08/2022,24/01/2023,Resolved,1,,Contra Costa County,Birds,Domestic,No,38.01,-122.107,domestic,FALSE,POINT (-122.10205078125 38.01347623104195),2022-08-16
131881,4247,H5N1 (HPAI non. Plt),,17/01/2024,30/06/2024,Resolved,1,,Contra Costa County,Pluvialis squatarola,Wild,No,38.018,-122.134,wild,FALSE,POINT (-122.135009765625 38.022131473537456),2024-01-17
151595,4247,H5N1 (HPAI non. Plt),,30/01/2025,,Continuing,1,,Harvey County,Birds,Domestic,No,38.052,-97.344,domestic,FALSE,POINT (-97.3388671875 38.04809106745722),2025-01-30
107323,4247,H5N1 (HPAI non. Plt),,9/09/2022,28/02/2023,Resolved,1,,Calaveras County,Birds,Domestic,No,38.189,-120.674,domestic,FALSE,POINT (-120.673828125 38.186386774115505),2022-09-09
116009,4247,H5N1 (HPAI non. Plt),,10/03/2023,14/07/2023,Resolved,1,,Maries County,Birds,Domestic,No,38.185,-91.947,domestic,FALSE,POINT (-91.944580078125 38.186386774115505),2023-03-10
147247,4247,H5N1 (HPAI non. Plt),,26/12/2024,,Continuing,1,,Coffey County,Birds,Domestic,No,38.194,-95.742,domestic,FALSE,POINT (-95.745849609375 38.195021557955755),2024-12-26
98480,4247,empty strain - H5N1 (HPAI non. Plt),,27/02/2022,9/08/2022,Resolved,1,,Bates County,Birds,Domestic,No,38.256,-94.31,domestic,FALSE,POINT (-94.306640625 38.255436376379464),2022-02-27
110908,4247,H5N1 (HPAI non. Plt),,19/12/2022,21/04/2023,Resolved,1,,Bates County,Birds,Domestic,No,38.257,-94.33,domestic,FALSE,POINT (-94.32861328125 38.255436376379464),2022-12-19
117458,4247,H5N1 (HPAI non. Plt),,6/04/2023,9/08/2023,Resolved,1,,Pueblo County,Birds,Domestic,No,38.271,-104.615,domestic,FALSE,POINT (-104.61181640625 38.27268853598096),2023-04-06
147245,4247,H5N1 (HPAI non. Plt),,25/12/2024,,Continuing,1,,Anderson County,Birds,Domestic,No,38.28,-95.242,domestic,FALSE,POINT (-95.240478515625 38.281313079229676),2024-12-25
114321,4247,H5N1 (HPAI non. Plt),,25/01/2023,30/06/2023,Resolved,1,,Napa County,Tringa semipalmata,Wild,No,38.3,-122.284,wild,FALSE,POINT (-122.288818359375 38.29855909225435),2023-01-25
112353,4247,H5N1 (HPAI non. Plt),,21/12/2022,31/12/2022,Resolved,1,,Marion ,Anser erythropus,Wild,No,38.347,-97.019,wild,FALSE,POINT (-97.020263671875 38.350272538257656),2022-12-21
129193,4247,H5N1 (HPAI non. Plt),,2/12/2023,2/05/2024,Resolved,1,,Rice County,Birds,Domestic,No,38.347,-98.204,domestic,FALSE,POINT (-98.206787109375 38.350272538257656),2023-12-02
128816,4247,H5N1 (HPAI non. Plt),,1/12/2023,8/04/2024,Resolved,1,,Barton County,Birds,Domestic,No,38.366,-98.764,domestic,FALSE,POINT (-98.76708984375 38.36750215395048),2023-12-01
129250,4247,H5N1 (HPAI non. Plt),,16/12/2023,26/04/2024,Resolved,1,,Barton County ,Birds,Domestic,No,38.366,-98.765,domestic,FALSE,POINT (-98.76708984375 38.36750215395048),2023-12-16
112044,4247,H5N1 (HPAI non. Plt),,22/12/2022,10/05/2023,Resolved,1,,Sonoma County,Birds,Domestic,No,38.436,-122.714,domestic,FALSE,POINT (-122.71728515625 38.436379603000006),2022-12-22
112046,4247,H5N1 (HPAI non. Plt),,22/12/2022,10/05/2023,Resolved,1,,Sonoma County,Birds,Domestic,No,38.438,-122.715,domestic,FALSE,POINT (-122.71728515625 38.436379603000006),2022-12-22
144034,4247,H5N1 (HPAI non. Plt),,15/10/2024,,Continuing,1,,Sonoma County,Birds,Domestic,No,38.467,-122.727,domestic,FALSE,POINT (-122.728271484375 38.47079371120378),2024-10-15
127488,4247,H5N1 (HPAI non. Plt),,7/11/2023,9/03/2024,Resolved,1,,Montrose County,Birds,Domestic,No,38.487,-107.89,domestic,FALSE,POINT (-107.8857421875 38.48799460921481),2023-11-07
130020,4247,H5N1 (HPAI non. Plt),,24/12/2023,8/05/2024,Resolved,1,,Sacramento County,Birds,Domestic,No,38.542,-121.407,domestic,FALSE,POINT (-121.409912109375 38.53957267203904),2023-12-24
105964,4247,H5N1 (HPAI non. Plt),,5/08/2022,8/01/2023,Resolved,1,,Sacramento County,Birds,Domestic,No,38.606,-121.484,domestic,FALSE,POINT (-121.48681640625 38.60828592850558),2022-08-05
106513,4247,H5N1 (HPAI non. Plt),,29/08/2022,7/02/2023,Resolved,1,,Sacramento County,Birds,Domestic,No,38.607,-121.486,domestic,FALSE,POINT (-121.48681640625 38.60828592850558),2022-08-29
99299,4247,empty strain - H5N1 (HPAI non. Plt),,10/03/2022,30/06/2022,Resolved,1,,Saint Louis County,Lophodytes cucullatus,Wild,No,38.646,-90.348,wild,FALSE,POINT (-90.3515625 38.642617906345265),2022-03-10
128896,4247,H5N1 (HPAI non. Plt),,30/11/2023,11/04/2024,Resolved,1,,Saint Louis County,Birds,Domestic,No,38.649,-90.339,domestic,FALSE,POINT (-90.340576171875 38.651198332299515),2023-11-30
147236,4247,H5N1 (HPAI non. Plt),,21/12/2024,,Continuing,1,,Cass County,Birds,Domestic,No,38.659,-94.373,domestic,FALSE,POINT (-94.37255859375 38.659777730712534),2024-12-21
148266,4247,H5N1 (HPAI non. Plt),,11/01/2025,,Continuing,1,,Yolo County,Birds,Domestic,No,38.679,-121.772,domestic,FALSE,POINT (-121.7724609375 38.67693344463794),2025-01-11
112756,4247,H5N1 (HPAI non. Plt),,10/01/2023,6/06/2023,Resolved,1,,El Dorado County,Birds,Domestic,No,38.723,-120.828,domestic,FALSE,POINT (-120.82763671875 38.71980474264237),2023-01-10
106716,4247,H5N1 (HPAI non. Plt),,4/09/2022,15/02/2023,Resolved,1,,El Dorado County,Birds,Domestic,No,38.728,-120.805,domestic,FALSE,POINT (-120.8056640625 38.728375918239806),2022-09-04
116477,4247,H5N1 (HPAI non. Plt),,16/03/2023,27/07/2023,Resolved,1,,Ellsworth County,Birds,Domestic,No,38.731,-98.232,domestic,FALSE,POINT (-98.228759765625 38.728375918239806),2023-03-16
146217,4247,H5N1 (HPAI non. Plt),,10/12/2024,,Continuing,1,,El Dorado County,Birds,Domestic,No,38.728,-120.83,domestic,FALSE,POINT (-120.82763671875 38.728375918239806),2024-12-10
111941,4247,H5N1 (HPAI non. Plt),,2/01/2023,9/05/2023,Resolved,1,,Johnson County,Birds,Domestic,No,38.766,-93.741,domestic,FALSE,POINT (-93.746337890625 38.76265033833414),2023-01-02
131358,4247,H5N1 (HPAI non. Plt),,19/01/2024,23/05/2024,Resolved,1,,Placer County,Birds,Domestic,No,38.897,-121.076,domestic,FALSE,POINT (-121.080322265625 38.89958342598271),2024-01-19
113584,4247,H5N1 (HPAI non. Plt),,21/01/2023,26/06/2023,Resolved,1,,Placer County,Birds,Domestic,No,38.904,-121.081,domestic,FALSE,POINT (-121.080322265625 38.90813299596704),2023-01-21
105968,4247,H5N1 (HPAI non. Plt),,3/08/2022,31/12/2022,Resolved,1,,Douglas County,Bubo virginianus,Wild,No,38.963,-119.779,wild,FALSE,POINT (-119.783935546875 38.95940879245421),2022-08-03
115411,4247,H5N1 (HPAI non. Plt),,28/02/2023,6/07/2023,Resolved,1,,Douglas County,Birds,Domestic,No,38.956,-119.765,domestic,FALSE,POINT (-119.761962890625 38.95940879245421),2023-02-28
145328,4247,H5N1 (HPAI non. Plt),,1/12/2024,,Continuing,1,,Douglas County,Birds,Domestic,No,38.963,-95.234,domestic,FALSE,POINT (-95.2294921875 38.95940879245421),2024-12-01
107358,4247,H5N1 (HPAI non. Plt),,21/09/2022,30/01/2023,Resolved,1,,Mesa County,Birds,Domestic,No,39.054,-108.548,domestic,FALSE,POINT (-108.544921875 39.0533181067413),2022-09-21
128770,4247,H5N1 (HPAI non. Plt),,29/11/2023,8/04/2024,Resolved,1,,Shawnee County,Birds,Domestic,No,39.05,-95.671,domestic,FALSE,POINT (-95.6689453125 39.0533181067413),2023-11-29
109924,4247,H5N1 (HPAI non. Plt),,25/11/2022,1/04/2023,Resolved,1,,Jackson County,Birds,Domestic,No,39.078,-94.579,domestic,FALSE,POINT (-94.581298828125 39.078908097064755),2022-11-25
108252,4247,H5N1 (HPAI non. Plt),,6/10/2022,15/02/2023,Resolved,1,,Jackson County,Birds,Domestic,No,39.092,-94.416,domestic,FALSE,POINT (-94.41650390625 39.09596293630548),2022-10-06
104850,4247,H5N1 (HPAI non. Plt),,28/06/2022,19/12/2022,Resolved,1,,Carson City,Birds,Domestic,No,39.123,-119.772,domestic,FALSE,POINT (-119.77294921875 39.12153746241924),2022-06-28
147235,4247,H5N1 (HPAI non. Plt),,1/12/2024,,Continuing,1,,Howard County,Birds,Domestic,No,39.146,-92.683,domestic,FALSE,POINT (-92.6806640625 39.14710270770075),2024-12-01
110669,4247,H5N1 (HPAI non. Plt),,13/12/2022,17/04/2023,Resolved,1,,Mendocino County,Birds,Domestic,No,39.152,-123.213,domestic,FALSE,POINT (-123.211669921875 39.15562239342324),2022-12-13
99298,4247,empty strain - H5N1 (HPAI non. Plt),,9/03/2022,30/06/2022,Resolved,1,,Clay County,Pelecanus erythrorhynchos,Wild,No,39.187,-94.449,wild,FALSE,POINT (-94.449462890625 39.189690821096775),2022-03-09
105105,4247,H5N1 (HPAI non. Plt),,14/07/2022,31/12/2022,Resolved,1,,Colusa County,Branta canadensis,Wild,No,39.215,-122.015,wild,FALSE,POINT (-122.01416015625 39.21523130910492),2022-07-14
114055,4247,H5N1 (HPAI non. Plt),,7/02/2023,12/06/2023,Resolved,1,,Carroll County,Birds,Domestic,No,39.358,-93.497,domestic,FALSE,POINT (-93.49365234375 39.35978526868999),2023-02-07
128630,4247,H5N1 (HPAI non. Plt),,13/11/2023,4/04/2024,Resolved,1,,Pottawatomie County,Birds,Domestic,No,39.395,-96.415,domestic,FALSE,POINT (-96.416015625 39.39375459224348),2023-11-13
100286,4247,empty strain - H5N1 (HPAI non. Plt),,18/03/2022,30/06/2022,Resolved,1,,Mitchell County,Haliaeetus leucocephalus,Wild,No,39.451,-98.109,wild,FALSE,POINT (-98.10791015625 39.45316112807393),2022-03-18
117308,4247,empty strain - H5N1 (HPAI non. Plt),,7/04/2023,11/08/2023,Resolved,1,,Mitchell County,Birds,Domestic,No,39.459,-98.108,domestic,FALSE,POINT (-98.10791015625 39.46164364205549),2023-04-07
102113,4247,empty strain - H5N1 (HPAI non. Plt),,20/03/2022,25/08/2022,Resolved,1,,Mitchell County,Birds,Domestic,No,39.48,-98.103,domestic,FALSE,POINT (-98.10791015625 39.47860556892209),2022-03-20
152600,4247,H5N1 (HPAI non. Plt),,18/02/2025,,Continuing,1,,Churchill County,Birds,Domestic,No,39.476,-118.777,domestic,FALSE,POINT (-118.773193359375 39.47860556892209),2025-02-18
146554,4247,H5N1 (HPAI non. Plt),,12/12/2024,,Continuing,1,,Butte County,Birds,Domestic,No,39.514,-121.567,domestic,FALSE,POINT (-121.563720703125 39.51251701659638),2024-12-12
105966,4247,H5N1 (HPAI non. Plt),,11/08/2022,19/01/2023,Resolved,1,,Butte County,Birds,Domestic,No,39.519,-121.572,domestic,FALSE,POINT (-121.57470703125 39.520992293571965),2022-08-11
130941,4247,H5N1 (HPAI non. Plt),,20/11/2023,31/12/2023,Resolved,1,6,Washoe County,Callipepla californica,Wild,No,39.54,-119.803,wild,FALSE,POINT (-119.805908203125 39.53793974517629),2023-11-20
99305,4247,empty strain - H5N1 (HPAI non. Plt),,10/03/2022,15/08/2022,Resolved,1,,Ralls County,Birds,Domestic,No,39.578,-91.396,domestic,FALSE,POINT (-91.395263671875 39.58029027440864),2022-03-10
116478,4247,H5N1 (HPAI non. Plt),,16/03/2023,22/09/2023,Resolved,1,,Arapahoe County,Birds,Domestic,No,39.613,-105.014,domestic,FALSE,POINT (-105.018310546875 39.61415207700267),2023-03-16
130094,4247,H5N1 (HPAI non. Plt),,18/12/2023,11/05/2024,Resolved,1,,Arapahoe County,Birds,Domestic,No,39.613,-105.008,domestic,FALSE,POINT (-105.00732421875 39.61415207700267),2023-12-18
108965,4247,H5N1 (HPAI non. Plt),,16/10/2022,31/12/2022,Resolved,1,,Denver County,"Amazonetta brasiliensis, Anser cygnoides, Branta ruficollis, Bucephala islandica, Phoenicopterus chilensis, Spatula puna ",Wild,No,39.74,-104.989,wild,FALSE,POINT (-104.9853515625 39.740986355883564),2022-10-16
110911,4247,H5N1 (HPAI non. Plt),,21/10/2022,31/12/2022,Resolved,1,,Denver County,"Aythya baeri, Mergellus albellus, Mergus squamatus",Wild,No,39.739,-104.987,wild,FALSE,POINT (-104.9853515625 39.740986355883564),2022-10-21
119032,4247,H5N1 (HPAI non. Plt),,12/05/2023,30/06/2023,Resolved,1,,Denver County,Buteo regalis,Wild,No,39.739,-104.99,wild,FALSE,POINT (-104.9853515625 39.740986355883564),2023-05-12
110665,4247,H5N1 (HPAI non. Plt),,3/12/2022,17/04/2023,Resolved,1,,Butte County,Birds,Domestic,No,39.753,-121.824,domestic,FALSE,POINT (-121.827392578125 39.74943369178246),2022-12-03
147246,4247,H5N1 (HPAI non. Plt),,22/12/2024,,Continuing,1,,Phillips County,Birds,Domestic,No,39.756,-99.324,domestic,FALSE,POINT (-99.327392578125 39.75787999202174),2024-12-22
148265,4247,H5N1 (HPAI non. Plt),,5/01/2025,,Continuing,1,,Phillips County,Birds,Domestic,No,39.756,-99.323,domestic,FALSE,POINT (-99.327392578125 39.75787999202174),2025-01-05
103432,4247,empty strain - H5N1 (HPAI non. Plt),,13/05/2022,14/09/2022,Resolved,1,2,Jefferson County,Anas platyrhynchos,Wild,No,39.776,-105.185,wild,FALSE,POINT (-105.18310546875 39.77476948529548),2022-05-13
114088,4247,H5N1 (HPAI non. Plt),,31/12/2022,6/07/2023,Resolved,1,,Doniphan County,Birds,Domestic,No,39.786,-95.089,domestic,FALSE,POINT (-95.086669921875 39.78321267821704),2022-12-31
145481,4247,H5N1 (HPAI non. Plt),,6/12/2024,,Continuing,1,,Jewell County,Birds,Domestic,No,39.787,-98.209,domestic,FALSE,POINT (-98.206787109375 39.78321267821704),2024-12-06
145327,4247,H5N1 (HPAI non. Plt),,26/11/2024,,Continuing,1,,Utah County,Birds,Domestic,No,40.053,-111.674,domestic,FALSE,POINT (-111.676025390625 40.05284760182397),2024-11-26
127479,4247,H5N1 (HPAI non. Plt),,7/11/2023,17/03/2024,Resolved,1,,Utah County,Birds,Domestic,No,40.232,-111.658,domestic,FALSE,POINT (-111.654052734375 40.22921818870117),2023-11-07
109107,4247,H5N1 (HPAI non. Plt),,15/11/2022,17/03/2023,Resolved,1,,Utah County,Birds,Domestic,No,40.234,-111.659,domestic,FALSE,POINT (-111.654052734375 40.23760536584024),2022-11-15
102114,4247,empty strain - H5N1 (HPAI non. Plt),,23/03/2022,26/08/2022,Resolved,1,,Gentry County,Birds,Domestic,No,40.256,-94.331,domestic,FALSE,POINT (-94.32861328125 40.254376603726485),2022-03-23
128495,4247,H5N1 (HPAI non. Plt),,23/11/2023,28/03/2024,Resolved,1,,Morgan County,Birds,Domestic,No,40.252,-103.789,domestic,FALSE,POINT (-103.787841796875 40.254376603726485),2023-11-23
135960,4247,H5N1 (HPAI non. Plt),,24/06/2024,,Continuing,1,,Morgan County,Birds,Domestic,No,40.252,-103.788,domestic,FALSE,POINT (-103.787841796875 40.254376603726485),2024-06-24
101863,4247,empty strain - H5N1 (HPAI non. Plt),,11/04/2022,7/10/2022,Resolved,1,,Utah County,Birds,Domestic,No,40.262,-111.574,domestic,FALSE,POINT (-111.5771484375 40.262760664371825),2022-04-11
110192,4247,H5N1 (HPAI non. Plt),,25/11/2022,6/04/2023,Resolved,1,,Harrison County,Birds,Domestic,No,40.269,-94.036,domestic,FALSE,POINT (-94.031982421875 40.2711436860842),2022-11-25
103501,4247,empty strain - H5N1 (HPAI non. Plt),,18/05/2022,30/06/2022,Resolved,1,,Utah County,Spheniscidae (incognita),Wild,No,40.281,-111.576,wild,FALSE,POINT (-111.5771484375 40.27952566881291),2022-05-18
108365,4247,H5N1 (HPAI non. Plt),,1/10/2022,12/02/2023,Resolved,1,,Weld County,Birds,Domestic,No,40.393,-104.68,domestic,FALSE,POINT (-104.677734375 40.39676430557202),2022-10-01
112081,4247,H5N1 (HPAI non. Plt),,15/12/2022,31/12/2022,Resolved,1,,Lassen County,Aechmophorus occidentalis,Wild,No,40.417,-120.663,wild,FALSE,POINT (-120.662841796875 40.41349604970196),2022-12-15
129249,4247,H5N1 (HPAI non. Plt),,6/12/2023,22/04/2024,Resolved,1,,Lassen County,Birds,Domestic,No,40.417,-120.663,domestic,FALSE,POINT (-120.662841796875 40.41349604970196),2023-12-06
111940,4247,H5N1 (HPAI non. Plt),,31/12/2022,7/05/2023,Resolved,1,,Weld County,Birds,Domestic,No,40.425,-104.694,domestic,FALSE,POINT (-104.688720703125 40.42186036204518),2022-12-31
126560,4247,H5N1 (HPAI non. Plt),,7/10/2023,10/02/2024,Resolved,1,,Weld County,Birds,Domestic,No,40.425,-104.694,domestic,FALSE,POINT (-104.688720703125 40.42186036204518),2023-10-07
129064,4247,H5N1 (HPAI non. Plt),,12/12/2023,10/04/2024,Resolved,1,,Weld County,Birds,Domestic,No,40.425,-104.694,domestic,FALSE,POINT (-104.688720703125 40.42186036204518),2023-12-12
137471,4247,H5N1 (HPAI non. Plt),,10/07/2024,31/12/2024,Resolved,1,,Weld County,"Calamospiza melanocorys, Chondestes grammacus, Tyrannus verticalis",Wild,No,40.425,-104.694,wild,FALSE,POINT (-104.688720703125 40.42186036204518),2024-07-10
144057,4247,H5N1 (HPAI non. Plt),,14/11/2024,,Continuing,1,,Weld County,Birds,Domestic,No,40.424,-104.694,domestic,FALSE,POINT (-104.688720703125 40.42186036204518),2024-11-14
151600,4247,H5N1 (HPAI non. Plt),,3/02/2025,,Continuing,1,,Weld County,Birds,Domestic,No,40.424,-104.693,domestic,FALSE,POINT (-104.688720703125 40.42186036204518),2025-02-03
117831,4247,H5N1 (HPAI non. Plt),,17/04/2023,22/08/2023,Resolved,1,,Routt County,Birds,Domestic,No,40.485,-106.832,domestic,FALSE,POINT (-106.8310546875 40.48873742102282),2023-04-17
151502,4247,H5N1 (HPAI non. Plt),,22/01/2025,,Continuing,1,,Kearney County,Birds,Domestic,No,40.499,-98.949,domestic,FALSE,POINT (-98.953857421875 40.497092372695676),2025-01-22
114806,4247,H5N1 (HPAI non. Plt),,18/02/2023,28/06/2023,Resolved,1,,Moffat County,Birds,Domestic,No,40.514,-107.55,domestic,FALSE,POINT (-107.545166015625 40.513799155044126),2023-02-18
117562,4247,H5N1 (HPAI non. Plt),,12/04/2023,16/08/2023,Resolved,1,,Moffat County,Birds,Domestic,No,40.514,-107.55,domestic,FALSE,POINT (-107.545166015625 40.513799155044126),2023-04-12
108364,4247,H5N1 (HPAI non. Plt),,6/10/2022,15/02/2023,Resolved,1,,Larimer County,Birds,Domestic,No,40.581,-105.68,domestic,FALSE,POINT (-105.677490234375 40.58058466412763),2022-10-06
110031,4247,H5N1 (HPAI non. Plt),,30/11/2022,31/03/2023,Resolved,1,,Larimer County,Birds,Domestic,No,40.585,-105.073,domestic,FALSE,POINT (-105.0732421875 40.58892816969373),2022-11-30
112753,4247,H5N1 (HPAI non. Plt),,17/01/2023,25/05/2023,Resolved,1,,Larimer County,Birds,Domestic,No,40.587,-105.079,domestic,FALSE,POINT (-105.084228515625 40.58892816969373),2023-01-17
135961,4247,H5N1 (HPAI non. Plt),,18/06/2024,25/10/2024,Resolved,1,,Larimer County,Birds,Domestic,No,40.587,-105.078,domestic,FALSE,POINT (-105.0732421875 40.58892816969373),2024-06-18
151593,4247,H5N1 (HPAI non. Plt),,28/01/2025,,Continuing,1,,Larimer County,Birds,Domestic,No,40.589,-105.079,domestic,FALSE,POINT (-105.084228515625 40.58892816969373),2025-01-28
145325,4247,H5N1 (HPAI non. Plt),,17/11/2024,,Continuing,1,,Salt Lake County,Birds,Domestic,No,40.759,-111.887,domestic,FALSE,POINT (-111.884765625 40.75557964275589),2024-11-17
104464,4247,H5N1 (HPAI non. Plt),,28/05/2022,8/11/2022,Resolved,1,,Salt Lake County,Birds,Domestic,No,40.768,-111.95,domestic,FALSE,POINT (-111.95068359375 40.76390128094587),2022-05-28
98954,4247,empty strain - H5N1 (HPAI non. Plt),,6/03/2022,30/06/2022,Resolved,1,,Lancaster County,Anser rossii,Wild,No,40.7702,-96.6837,wild,FALSE,POINT (-96.6796875 40.77222187732903),2022-03-06
104849,4247,H5N1 (HPAI non. Plt),,27/06/2022,27/11/2022,Resolved,1,,Salt Lake County,Birds,Domestic,No,40.769,-111.979,domestic,FALSE,POINT (-111.983642578125 40.77222187732903),2022-06-27
103502,4247,empty strain - H5N1 (HPAI non. Plt),,12/05/2022,14/10/2022,Resolved,1,,Salt Lake County,Birds,Domestic,No,40.808,-112.056,domestic,FALSE,POINT (-112.060546875 40.80549384389414),2022-05-12
110027,4247,H5N1 (HPAI non. Plt),,18/10/2022,31/12/2022,Resolved,1,,York County,Passer domesticus,Wild,No,40.859,-97.593,wild,FALSE,POINT (-97.591552734375 40.85537053192493),2022-10-18
100291,4247,empty strain - H5N1 (HPAI non. Plt),,24/03/2022,30/06/2022,Resolved,1,,Sedgwick County,Anser caerulescens,Wild,No,40.967,-102.247,wild,FALSE,POINT (-102.249755859375 40.963307953073524),2022-03-24
128815,4247,H5N1 (HPAI non. Plt),,5/12/2023,7/04/2024,Resolved,1,,Mills County,Birds,Domestic,No,41.047,-95.743,domestic,FALSE,POINT (-95.745849609375 41.04621681452065),2023-12-05
99303,4247,empty strain - H5N1 (HPAI non. Plt),,5/03/2022,18/08/2022,Resolved,1,,Merrick County,Birds,Domestic,No,41.113,-97.98,domestic,FALSE,POINT (-97.97607421875 41.112468789180895),2022-03-05
147234,4247,H5N1 (HPAI non. Plt),,8/12/2024,,Continuing,1,,Sarpy County,Birds,Domestic,No,41.141,-96.039,domestic,FALSE,POINT (-96.04248046875 41.137296061122754),2024-12-08
108973,4247,H5N1 (HPAI non. Plt),,26/10/2022,26/02/2023,Resolved,1,,Louisa County,Birds,Domestic,No,41.179,-91.186,domestic,FALSE,POINT (-91.1865234375 41.17865397233166),2022-10-26
106299,4247,H5N1 (HPAI non. Plt),,21/08/2022,20/01/2023,Resolved,1,,Weber County,Birds,Domestic,No,41.234,-111.994,domestic,FALSE,POINT (-111.99462890625 41.2365112012462),2022-08-21
129432,4247,H5N1 (HPAI non. Plt),,11/12/2023,18/04/2024,Resolved,1,,Mahaska County,Birds,Domestic,No,41.295,-92.643,domestic,FALSE,POINT (-92.647705078125 41.29431726315258),2023-12-11
98481,4247,empty strain - H5N1 (HPAI non. Plt),,17/02/2022,4/08/2022,Resolved,1,,Pottawattamie County,Birds,Domestic,No,41.332,-95.587,domestic,FALSE,POINT (-95.592041015625 41.33557597312392),2022-02-17
99310,4247,empty strain - H5N1 (HPAI non. Plt),,15/03/2022,30/09/2022,Resolved,1,,Warren County,Birds,Domestic,No,41.356,-93.601,domestic,FALSE,POINT (-93.603515625 41.35207214451293),2022-03-15
151587,4247,H5N1 (HPAI non. Plt),,23/01/2025,,Continuing,1,,Nance County,Birds,Domestic,No,41.364,-97.967,domestic,FALSE,POINT (-97.965087890625 41.36031866306709),2025-01-23
129434,4247,H5N1 (HPAI non. Plt),,9/12/2023,23/04/2024,Resolved,1,,Dodge County,Birds,Domestic,No,41.433,-96.498,domestic,FALSE,POINT (-96.492919921875 41.43449030894922),2023-12-09
128352,4247,H5N1 (HPAI non. Plt),,22/11/2023,24/03/2024,Resolved,1,,Colfax County,Birds,Domestic,No,41.447,-97.055,domestic,FALSE,POINT (-97.05322265625 41.4509614012039),2023-11-22
117460,4247,H5N1 (HPAI non. Plt),,5/04/2023,11/08/2023,Resolved,1,,Modoc County,Birds,Domestic,No,41.483,-120.54,domestic,FALSE,POINT (-120.5419921875 41.48389104267176),2023-04-05
102685,4247,empty strain - H5N1 (HPAI non. Plt),,19/04/2022,29/09/2022,Resolved,1,,Washington County,Birds,Domestic,No,41.551,-96.097,domestic,FALSE,POINT (-96.097412109375 41.54970014513273),2022-04-19
99301,4247,empty strain - H5N1 (HPAI non. Plt),,10/03/2022,30/06/2022,Resolved,1,,Polk County,Anas platyrhynchos,Wild,No,41.559,-93.54,wild,FALSE,POINT (-93.53759765625 41.557921577804194),2022-03-10
101233,4247,empty strain - H5N1 (HPAI non. Plt),,7/03/2022,30/06/2022,Resolved,1,,Polk County,Anas platyrhynchos,Wild,No,41.609,-93.611,wild,FALSE,POINT (-93.614501953125 41.60722821271716),2022-03-07
108211,4247,H5N1 (HPAI non. Plt),,19/10/2022,14/11/2022,Resolved,1,,Dallas County,Birds,Domestic,No,41.614,-94.018,domestic,FALSE,POINT (-94.02099609375 41.615442324681084),2022-10-19
145479,4247,H5N1 (HPAI non. Plt),,7/12/2024,,Continuing,1,,Dodge County,Birds,Domestic,No,41.661,-96.666,domestic,FALSE,POINT (-96.668701171875 41.66470503009205),2024-12-07
126881,4247,H5N1 (HPAI non. Plt),,22/10/2023,29/02/2024,Resolved,1,,Guthrie County,Birds,Domestic,No,41.678,-94.502,domestic,FALSE,POINT (-94.50439453125 41.68111756290651),2023-10-22
107359,4247,H5N1 (HPAI non. Plt),,29/09/2022,28/01/2023,Resolved,1,,Cache County,Birds,Domestic,No,41.708,-111.848,domestic,FALSE,POINT (-111.851806640625 41.705728515237524),2022-09-29
144402,4247,H5N1 (HPAI non. Plt),,31/10/2024,31/12/2024,Resolved,1,,Cache County,"Melospiza melodia, Passerculus sandwichensis, Zenaida asiatica",Wild,No,41.734,-111.836,wild,FALSE,POINT (-111.8408203125 41.730330050466534),2024-10-31
107897,4247,H5N1 (HPAI non. Plt),,9/05/2022,24/05/2022,Resolved,1,,Cache County,Dromaius novaehollandiae,Wild,No,41.735,-111.835,wild,FALSE,POINT (-111.829833984375 41.73852846935915),2022-05-09
103125,4247,empty strain - H5N1 (HPAI non. Plt),,9/05/2022,11/10/2022,Resolved,1,,Cache County,Birds,Domestic,No,41.746,-111.895,domestic,FALSE,POINT (-111.895751953125 41.746725841769376),2022-05-09
117274,4247,H5N1 (HPAI non. Plt),,21/03/2023,30/06/2023,Resolved,1,,Del Norte County,Larus glaucescens,Wild,No,41.753,-124.203,wild,FALSE,POINT (-124.200439453125 41.75492216766298),2023-03-21
103346,4247,empty strain - H5N1 (HPAI non. Plt),,2/05/2022,10/10/2022,Resolved,1,,Lincoln County,Birds,Domestic,No,41.772,-110.553,domestic,FALSE,POINT (-110.555419921875 41.77131167976407),2022-05-02
101547,4247,empty strain - H5N1 (HPAI non. Plt),,29/03/2022,13/09/2022,Resolved,1,,Scotts Bluff County,Birds,Domestic,No,41.815,-103.661,domestic,FALSE,POINT (-103.656005859375 41.8122671435998),2022-03-29
112038,4247,H5N1 (HPAI non. Plt),,31/12/2022,9/05/2023,Resolved,1,,Scotts Bluff County,Birds,Domestic,No,41.828,-103.662,domestic,FALSE,POINT (-103.6669921875 41.828642001860544),2022-12-31
147249,4247,H5N1 (HPAI non. Plt),,30/12/2024,,Continuing,1,,Clinton County,Birds,Domestic,No,41.851,-90.189,domestic,FALSE,POINT (-90.186767578125 41.85319643776674),2024-12-30
146547,4247,H5N1 (HPAI non. Plt),,12/12/2024,,Continuing,1,,Monona County,Birds,Domestic,No,42.024,-96.082,domestic,FALSE,POINT (-96.08642578125 42.02481360781778),2024-12-12
151605,4247,H5N1 (HPAI non. Plt),,5/02/2025,,Continuing,1,,Platte County,Birds,Domestic,No,42.056,-104.953,domestic,FALSE,POINT (-104.952392578125 42.05745022024681),2025-02-05
107360,4247,H5N1 (HPAI non. Plt),,30/09/2022,16/02/2023,Resolved,1,,Box Butte County,Birds,Domestic,No,42.098,-102.859,domestic,FALSE,POINT (-102.85400390625 42.09822241118974),2022-09-30
145038,4247,H5N1 (HPAI non. Plt),,15/11/2024,,Continuing,1,,Franklin County,Birds,Domestic,No,42.096,-111.878,domestic,FALSE,POINT (-111.873779296875 42.09822241118974),2024-11-15
127493,4247,H5N1 (HPAI non. Plt),,8/11/2023,13/03/2024,Resolved,1,,Jones County,Birds,Domestic,No,42.109,-91.29,domestic,FALSE,POINT (-91.285400390625 42.10637370579323),2023-11-08
127578,4247,empty strain - H5N1 (HPAI non. Plt),,13/11/2023,17/03/2024,Resolved,1,,Benton County,Birds,Domestic,No,42.168,-92.024,domestic,FALSE,POINT (-92.021484375 42.171546334527505),2023-11-13
106301,4247,H5N1 (HPAI non. Plt),,22/08/2022,31/12/2022,Resolved,1,,Klamath County,Anas cyanoptera,Wild,No,42.201,-121.766,wild,FALSE,POINT (-121.761474609375 42.204107493733176),2022-08-22
116481,4247,H5N1 (HPAI non. Plt),,18/03/2023,4/08/2023,Resolved,1,,Klamath County,Birds,Domestic,No,42.222,-121.784,domestic,FALSE,POINT (-121.783447265625 42.2203817837206),2023-03-18
133211,4247,H5N1 (HPAI non. Plt),,5/03/2024,10/07/2024,Resolved,1,,Klamath County,Birds,Domestic,No,42.223,-121.784,domestic,FALSE,POINT (-121.783447265625 42.2203817837206),2024-03-05
151584,4247,H5N1 (HPAI non. Plt),,15/01/2025,,Continuing,1,,Klamath County,Birds,Domestic,No,42.223,-121.784,domestic,FALSE,POINT (-121.783447265625 42.2203817837206),2025-01-15
144055,4247,H5N1 (HPAI non. Plt),,1/11/2024,,Continuing,1,,Jackson County,Birds,Domestic,No,42.322,-122.877,domestic,FALSE,POINT (-122.882080078125 42.3179394544685),2024-11-01
111942,4247,H5N1 (HPAI non. Plt),,22/12/2022,28/04/2023,Resolved,1,,Josephine County,Birds,Domestic,No,42.443,-123.325,domestic,FALSE,POINT (-123.321533203125 42.43967417814943),2022-12-22
100281,4247,empty strain - H5N1 (HPAI non. Plt),,23/03/2022,25/08/2022,Resolved,1,,Holt County,Birds,Domestic,No,42.451,-98.629,domestic,FALSE,POINT (-98.624267578125 42.44778143462244),2022-03-23
128497,4247,H5N1 (HPAI non. Plt),,22/11/2023,5/04/2024,Resolved,1,,Woodbury County,Birds,Domestic,No,42.497,-96.406,domestic,FALSE,POINT (-96.405029296875 42.49640294093706),2023-11-22
128498,4247,H5N1 (HPAI non. Plt),,28/11/2023,5/04/2024,Resolved,1,,Woodbury County,Birds,Domestic,No,42.497,-96.406,domestic,FALSE,POINT (-96.405029296875 42.49640294093706),2023-11-28
134372,4247,H5N1 (HPAI non. Plt),,19/04/2024,22/11/2024,Resolved,1,,Cassia County,Birds,Domestic,No,42.534,-113.793,domestic,FALSE,POINT (-113.79638671875 42.53689200787315),2024-04-19
134498,4247,H5N1 (HPAI non. Plt),,29/04/2024,13/09/2024,Resolved,1,,Cassia County,Birds,Domestic,No,42.534,-113.792,domestic,FALSE,POINT (-113.79638671875 42.53689200787315),2024-04-29
106718,4247,H5N1 (HPAI non. Plt),,7/09/2022,13/02/2023,Resolved,1,,Twin Falls 01,Birds,Domestic,No,42.559,-114.47,domestic,FALSE,POINT (-114.466552734375 42.56117285531806),2022-09-07
136693,4247,H5N1 (HPAI non. Plt),,27/06/2024,11/12/2024,Resolved,1,,Twin Falls County,Birds,Domestic,No,42.561,-114.495,domestic,FALSE,POINT (-114.49951171875 42.56117285531806),2024-06-27
131969,4247,H5N1 (HPAI non. Plt),,1/02/2024,30/07/2024,Resolved,1,,Twin Falls County,Birds,Domestic,No,42.566,-114.494,domestic,FALSE,POINT (-114.488525390625 42.56926437219383),2024-02-01
146553,4247,H5N1 (HPAI non. Plt),,19/12/2024,,Continuing,1,,Twin Falls County,Birds,Domestic,No,42.59,-114.438,domestic,FALSE,POINT (-114.43359375 42.59353262564994),2024-12-19
101862,4247,empty strain - H5N1 (HPAI non. Plt),,11/04/2022,26/10/2022,Resolved,1,,Caribou County,Birds,Domestic,No,42.671,-111.573,domestic,FALSE,POINT (-111.5771484375 42.67435857693383),2022-04-11
117459,4247,H5N1 (HPAI non. Plt),,8/04/2023,13/08/2023,Resolved,1,,Sheridan County,Birds,Domestic,No,42.718,-102.46,domestic,FALSE,POINT (-102.45849609375 42.71473218539458),2023-04-08
102964,4247,empty strain - H5N1 (HPAI non. Plt),,1/05/2022,13/10/2022,Resolved,1,,Bremer County,Birds,Domestic,No,42.721,-92.497,domestic,FALSE,POINT (-92.493896484375 42.722803757327284),2022-05-01
134608,4247,H5N1 (HPAI non. Plt),,5/05/2024,22/11/2024,Resolved,1,,Jerome County,Birds,Domestic,No,42.727,-114.318,domestic,FALSE,POINT (-114.312744140625 42.73087427928485),2024-05-05
135297,4247,H5N1 (HPAI non. Plt),,31/05/2024,22/11/2024,Resolved,1,,Jerome County,Birds,Domestic,No,42.727,-114.513,domestic,FALSE,POINT (-114.510498046875 42.73087427928485),2024-05-31
151504,4247,H5N1 (HPAI non. Plt),,23/01/2025,,Continuing,1,,Jerome County,Birds,Domestic,No,42.727,-114.578,domestic,FALSE,POINT (-114.576416015625 42.73087427928485),2025-01-23
108738,4247,H5N1 (HPAI non. Plt),,1/11/2022,6/03/2023,Resolved,1,,Converse County,Birds,Domestic,No,42.745,-105.376,domestic,FALSE,POINT (-105.380859375 42.74701217318068),2022-11-01
106907,4247,H5N1 (HPAI non. Plt),,12/09/2022,16/02/2023,Resolved,1,,Dawes 01,Birds,Domestic,No,42.828,-103.018,domestic,FALSE,POINT (-103.018798828125 42.827638636242284),2022-09-12
108614,4247,H5N1 (HPAI non. Plt),,8/10/2022,9/02/2023,Resolved,1,,Fremont County,Birds,Domestic,No,42.831,-108.724,domestic,FALSE,POINT (-108.720703125 42.827638636242284),2022-10-08
101096,4247,empty strain - H5N1 (HPAI non. Plt),,28/03/2022,1/09/2022,Resolved,1,,Fremont County,Birds,Domestic,No,42.848,-108.721,domestic,FALSE,POINT (-108.720703125 42.85180609584705),2022-03-28
102702,4247,empty strain - H5N1 (HPAI non. Plt),,6/04/2022,30/06/2022,Resolved,1,,Fremont County,Branta canadensis,Wild,No,42.849,-108.721,wild,FALSE,POINT (-108.720703125 42.85180609584705),2022-04-06
104360,4247,H5N1 (HPAI non. Plt),,10/06/2022,30/06/2022,Resolved,1,,Sublette County,Podiceps nigricollis,Wild,No,42.866,-109.878,wild,FALSE,POINT (-109.874267578125 42.86791248391532),2022-06-10
104361,4247,H5N1 (HPAI non. Plt),,10/06/2022,30/06/2022,Resolved,1,,Sublette County,Podiceps auritus,Wild,No,42.864,-109.853,wild,FALSE,POINT (-109.852294921875 42.86791248391532),2022-06-10
102117,4247,empty strain - H5N1 (HPAI non. Plt),,13/04/2022,20/09/2022,Resolved,1,,Gooding County,Birds,Domestic,No,42.948,-114.699,domestic,FALSE,POINT (-114.697265625 42.94838139765312),2022-04-13
100283,4247,empty strain - H5N1 (HPAI non. Plt),,24/03/2022,1/09/2022,Resolved,1,,Bon Homme County,Birds,Domestic,No,42.986,-97.875,domestic,FALSE,POINT (-97.877197265625 42.98857645832183),2022-03-24
148260,4247,H5N1 (HPAI non. Plt),,7/01/2025,,Continuing,1,,Owyhee County,Birds,Domestic,No,42.987,-116.097,domestic,FALSE,POINT (-116.092529296875 42.98857645832183),2025-01-07
151599,4247,H5N1 (HPAI non. Plt),,3/02/2025,,Continuing,1,,Bon Homme County,Birds,Domestic,No,42.994,-97.866,domestic,FALSE,POINT (-97.8662109375 42.9966123184214),2025-02-03
136921,4247,H5N1 (HPAI non. Plt),,23/06/2024,30/06/2024,Resolved,1,,Sioux County,Hirundo rustica,Wild,No,43.008,-96.059,wild,FALSE,POINT (-96.064453125 43.00464712779444),2024-06-23
116011,4247,H5N1 (HPAI non. Plt),,6/03/2023,13/07/2023,Resolved,1,,Chickasaw County,Birds,Domestic,No,43.061,-92.315,domestic,FALSE,POINT (-92.318115234375 43.060861371343265),2023-03-06
102675,4247,empty strain - H5N1 (HPAI non. Plt),,15/04/2022,20/09/2022,Resolved,1,,Kossuth County,Birds,Domestic,No,43.08,-94.245,domestic,FALSE,POINT (-94.24072265625 43.076913126087106),2022-04-15
100289,4247,empty strain - H5N1 (HPAI non. Plt),,18/03/2022,30/06/2022,Resolved,1,,Charles Mix County,Branta canadensis,Wild,No,43.151,-98.526,wild,FALSE,POINT (-98.525390625 43.149093999201256),2022-03-18
127492,4247,H5N1 (HPAI non. Plt),,9/11/2023,13/03/2024,Resolved,1,,Cerro Gordo County,Birds,Domestic,No,43.154,-93.203,domestic,FALSE,POINT (-93.2080078125 43.1571088409533),2023-11-09
105451,4247,H5N1 (HPAI non. Plt),,25/07/2022,27/01/2023,Resolved,1,18,Coos County,Birds,Domestic,No,43.185,-124.19,domestic,FALSE,POINT (-124.189453125 43.18114705939968),2022-07-25
146546,4247,H5N1 (HPAI non. Plt),,7/12/2024,,Continuing,1,,Coos County,Birds,Domestic,No,43.185,-124.184,domestic,FALSE,POINT (-124.189453125 43.18114705939968),2024-12-07
148253,4247,H5N1 (HPAI non. Plt),,29/12/2024,,Continuing,1,,Gregory County,Birds,Domestic,No,43.182,-99.29,domestic,FALSE,POINT (-99.29443359375 43.18114705939968),2024-12-29
115409,4247,H5N1 (HPAI non. Plt),,27/02/2023,24/07/2023,Resolved,1,,Bingham County,Birds,Domestic,No,43.194,-112.346,domestic,FALSE,POINT (-112.34619140625 43.19716728250128),2023-02-27
112759,4247,H5N1 (HPAI non. Plt),,5/01/2023,11/05/2023,Resolved,1,,Douglas County,Birds,Domestic,No,43.212,-123.341,domestic,FALSE,POINT (-123.343505859375 43.213183300738876),2023-01-05
131764,4247,H5N1 (HPAI non. Plt),,5/02/2024,30/07/2024,Resolved,1,,Owyhee,Birds,Domestic,No,43.217,-116.551,domestic,FALSE,POINT (-116.553955078125 43.213183300738876),2024-02-05
107357,4247,H5N1 (HPAI non. Plt),,22/09/2022,23/03/2023,Resolved,1,,Douglas County,Birds,Domestic,No,43.219,-123.358,domestic,FALSE,POINT (-123.3544921875 43.22118973298754),2022-09-22
109609,4247,H5N1 (HPAI non. Plt),,19/11/2022,6/04/2023,Resolved,1,,Turner County,Birds,Domestic,No,43.393,-97.137,domestic,FALSE,POINT (-97.14111328125 43.38908193911749),2022-11-19
127943,4247,H5N1 (HPAI non. Plt),,15/11/2023,20/03/2024,Resolved,1,,Fall River County,Birds,Domestic,No,43.439,-103.48,domestic,FALSE,POINT (-103.480224609375 43.436965965218235),2023-11-15
117563,4247,H5N1 (HPAI non. Plt),,10/04/2023,11/09/2023,Resolved,1,,Bonneville County,Birds,Domestic,No,43.495,-112.041,domestic,FALSE,POINT (-112.03857421875 43.492782808225),2023-04-10
127490,4247,H5N1 (HPAI non. Plt),,4/11/2023,11/04/2024,Resolved,1,,Bonneville County,Birds,Domestic,No,43.496,-112.037,domestic,FALSE,POINT (-112.03857421875 43.492782808225),2023-11-04
104469,4247,H5N1 (HPAI non. Plt),,19/05/2022,30/06/2022,Resolved,1,,Ada County,Megascops kennicottii,Wild,No,43.553,-116.175,wild,FALSE,POINT (-116.180419921875 43.556510375047566),2022-05-19
128525,4247,H5N1 (HPAI non. Plt),,23/11/2023,3/04/2024,Resolved,1,,Minnehaha County,Birds,Domestic,No,43.553,-96.729,domestic,FALSE,POINT (-96.7236328125 43.556510375047566),2023-11-23
103126,4247,empty strain - H5N1 (HPAI non. Plt),,2/05/2022,19/10/2022,Resolved,1,,Ada County,Birds,Domestic,No,43.568,-116.196,domestic,FALSE,POINT (-116.19140625 43.56447158721812),2022-05-02
103431,4247,empty strain - H5N1 (HPAI non. Plt),,13/05/2022,25/10/2022,Resolved,1,,Canyon County,Birds,Domestic,No,43.594,-116.689,domestic,FALSE,POINT (-116.685791015625 43.59630591596547),2022-05-13
103436,4247,empty strain - H5N1 (HPAI non. Plt),,16/05/2022,23/10/2022,Resolved,1,,Ada County,Birds,Domestic,No,43.597,-116.132,domestic,FALSE,POINT (-116.136474609375 43.59630591596547),2022-05-16
118550,4247,H5N1 (HPAI non. Plt),,1/05/2023,7/09/2023,Resolved,1,,Nobles County,Birds,Domestic,No,43.622,-95.598,domestic,FALSE,POINT (-95.60302734375 43.62017061618988),2023-05-01
103344,4247,empty strain - H5N1 (HPAI non. Plt),,9/05/2022,19/10/2022,Resolved,1,,Ada County,Birds,Domestic,No,43.626,-116.232,domestic,FALSE,POINT (-116.2353515625 43.62812341212461),2022-05-09
103430,4247,empty strain - H5N1 (HPAI non. Plt),,13/05/2022,21/10/2022,Resolved,1,,Canyon County,Birds,Domestic,No,43.637,-116.637,domestic,FALSE,POINT (-116.641845703125 43.636075155965784),2022-05-13
146549,4247,H5N1 (HPAI non. Plt),,14/12/2024,,Continuing,1,,Houston County,Birds,Domestic,No,43.635,-91.508,domestic,FALSE,POINT (-91.505126953125 43.636075155965784),2024-12-14
104778,4247,H5N1 (HPAI non. Plt),,10/06/2022,30/06/2022,Resolved,1,,Ada County,Parabuteo unicinctus,Wild,No,43.648,-116.255,wild,FALSE,POINT (-116.25732421875 43.64402584769948),2022-06-10
127994,4247,H5N1 (HPAI non. Plt),,16/11/2023,28/03/2024,Resolved,1,,Freeborn County,Birds,Domestic,No,43.646,-93.369,domestic,FALSE,POINT (-93.372802734375 43.64402584769948),2023-11-16
103130,4247,empty strain - H5N1 (HPAI non. Plt),,6/05/2022,25/10/2022,Resolved,1,,Ada County,Birds,Domestic,No,43.65,-116.255,domestic,FALSE,POINT (-116.25732421875 43.65197548731186),2022-05-06
103132,4247,empty strain - H5N1 (HPAI non. Plt),,5/05/2022,21/10/2022,Resolved,1,,Canyon County,Birds,Domestic,No,43.65,-116.65,domestic,FALSE,POINT (-116.65283203125 43.65197548731186),2022-05-05
103352,4247,empty strain - H5N1 (HPAI non. Plt),,12/05/2022,23/10/2022,Resolved,1,,Ada County,Birds,Domestic,No,43.652,-116.255,domestic,FALSE,POINT (-116.25732421875 43.65197548731186),2022-05-12
106717,4247,H5N1 (HPAI non. Plt),,7/09/2022,10/01/2023,Resolved,1,,Freeborn County,Birds,Domestic,No,43.652,-93.369,domestic,FALSE,POINT (-93.372802734375 43.65197548731186),2022-09-07
143684,4247,H5N1 (HPAI non. Plt),,14/11/2024,,Continuing,1,,Martin County,Birds,Domestic,No,43.653,-94.464,domestic,FALSE,POINT (-94.46044921875 43.65197548731186),2024-11-14
143685,4247,H5N1 (HPAI non. Plt),,14/11/2024,,Continuing,1,,Martin County,Birds,Domestic,No,43.652,-94.467,domestic,FALSE,POINT (-94.471435546875 43.65197548731186),2024-11-14
148254,4247,H5N1 (HPAI non. Plt),,5/12/2024,,Continuing,1,,Hanson County,Birds,Domestic,No,43.655,-97.778,domestic,FALSE,POINT (-97.7783203125 43.65197548731186),2024-12-05
103428,4247,empty strain - H5N1 (HPAI non. Plt),,10/05/2022,21/10/2022,Resolved,1,,Canyon County,Birds,Domestic,No,43.67,-116.677,domestic,FALSE,POINT (-116.6748046875 43.66787161011749),2022-05-10
103429,4247,empty strain - H5N1 (HPAI non. Plt),,13/05/2022,20/10/2022,Resolved,1,,Ada County,Birds,Domestic,No,43.671,-116.332,domestic,FALSE,POINT (-116.334228515625 43.66787161011749),2022-05-13
103628,4247,empty strain - H5N1 (HPAI non. Plt),,20/05/2022,24/10/2022,Resolved,1,,Ada County,Birds,Domestic,No,43.671,-116.331,domestic,FALSE,POINT (-116.334228515625 43.66787161011749),2022-05-20
125838,4247,H5N1 (HPAI non. Plt),,26/09/2023,14/02/2024,Resolved,1,,Canyon County,Birds,Domestic,No,43.665,-116.682,domestic,FALSE,POINT (-116.685791015625 43.66787161011749),2023-09-26
128499,4247,H5N1 (HPAI non. Plt),,25/11/2023,11/04/2024,Resolved,1,,Canyon County,Birds,Domestic,No,43.666,-116.681,domestic,FALSE,POINT (-116.685791015625 43.66787161011749),2023-11-25
147239,4247,H5N1 (HPAI non. Plt),,22/12/2024,,Continuing,1,,Canyon County,Birds,Domestic,No,43.665,-116.68,domestic,FALSE,POINT (-116.6748046875 43.66787161011749),2024-12-22
147240,4247,H5N1 (HPAI non. Plt),,21/12/2024,,Continuing,1,,Canyon County,Birds,Domestic,No,43.665,-116.682,domestic,FALSE,POINT (-116.685791015625 43.66787161011749),2024-12-21
147241,4247,H5N1 (HPAI non. Plt),,29/11/2024,,Continuing,1,,Canyon County,Birds,Domestic,No,43.665,-116.681,domestic,FALSE,POINT (-116.685791015625 43.66787161011749),2024-11-29
147242,4247,H5N1 (HPAI non. Plt),,25/12/2024,,Continuing,1,,Canyon County,Birds,Domestic,No,43.664,-116.679,domestic,FALSE,POINT (-116.6748046875 43.66787161011749),2024-12-25
148258,4247,H5N1 (HPAI non. Plt),,4/01/2025,,Continuing,1,,Canyon County,Birds,Domestic,No,43.665,-116.682,domestic,FALSE,POINT (-116.685791015625 43.66787161011749),2025-01-04
100282,4247,empty strain - H5N1 (HPAI non. Plt),,25/03/2022,2/09/2022,Resolved,1,,Mower County,Birds,Domestic,No,43.674,-92.95,domestic,FALSE,POINT (-92.955322265625 43.675818093283425),2022-03-25
103351,4247,empty strain - H5N1 (HPAI non. Plt),,13/05/2022,21/10/2022,Resolved,1,,Canyon County,Birds,Domestic,No,43.679,-116.7,domestic,FALSE,POINT (-116.69677734375 43.675818093283425),2022-05-13
103435,4247,empty strain - H5N1 (HPAI non. Plt),,8/05/2022,19/10/2022,Resolved,1,,Ada County,Birds,Domestic,No,43.672,-116.236,domestic,FALSE,POINT (-116.2353515625 43.675818093283425),2022-05-08
147230,4247,H5N1 (HPAI non. Plt),,3/12/2024,,Continuing,1,,Jefferson County,Birds,Domestic,No,43.679,-111.91,domestic,FALSE,POINT (-111.90673828125 43.675818093283425),2024-12-03
109604,4247,H5N1 (HPAI non. Plt),,18/11/2022,27/03/2023,Resolved,1,,Brule County,Birds,Domestic,No,43.808,-99.334,domestic,FALSE,POINT (-99.33837890625 43.810747313446996),2022-11-18
110909,4247,H5N1 (HPAI non. Plt),,12/12/2022,18/04/2023,Resolved,1,,Gem County,Birds,Domestic,No,43.876,-116.494,domestic,FALSE,POINT (-116.4990234375 43.874138181474734),2022-12-12
104364,4247,H5N1 (HPAI non. Plt),,27/05/2022,30/06/2022,Resolved,1,,Fremont County,Buteo swainsoni,Wild,No,43.963,-111.678,wild,FALSE,POINT (-111.676025390625 43.96119063892024),2022-05-27
144056,4247,H5N1 (HPAI non. Plt),,13/11/2024,,Continuing,1,,Malheur county,Birds,Domestic,No,43.981,-117.242,domestic,FALSE,POINT (-117.24609375 43.984910114046926),2024-11-13
108441,4247,H5N1 (HPAI non. Plt),,26/10/2022,24/03/2023,Resolved,1,,Deschutes County,Birds,Domestic,No,43.992,-121.336,domestic,FALSE,POINT (-121.3330078125 43.992814500489885),2022-10-26
145322,4247,H5N1 (HPAI non. Plt),,8/11/2024,,Continuing,1,,Lake County,Birds,Domestic,No,44.005,-97.112,domestic,FALSE,POINT (-97.108154296875 44.00862011541537),2024-11-08
145902,4247,H5N1 (HPAI non. Plt),,23/11/2024,,Continuing,1,,Washakie County,Birds,Domestic,No,44.017,-107.956,domestic,FALSE,POINT (-107.95166015625 44.01652134387754),2024-11-23
147248,4247,H5N1 (HPAI non. Plt),,27/12/2024,,Continuing,1,,Olmstead County,Birds,Domestic,No,44.02,-92.466,domestic,FALSE,POINT (-92.4609375 44.01652134387754),2024-12-27
105447,4247,H5N1 (HPAI non. Plt),,19/07/2022,10/01/2023,Resolved,1,,Deschutes County,Birds,Domestic,No,44.043,-121.348,domestic,FALSE,POINT (-121.343994140625 44.04021871314214),2022-07-19
110028,4247,H5N1 (HPAI non. Plt),,17/11/2022,31/12/2022,Resolved,1,,Lane County,Fulica americana,Wild,No,44.052,-123.091,wild,FALSE,POINT (-123.0908203125 44.048115730823525),2022-11-17
146544,4247,H5N1 (HPAI non. Plt),,25/11/2024,,Continuing,1,,Deschutes County,Birds,Domestic,No,44.059,-121.323,domestic,FALSE,POINT (-121.322021484375 44.05601169578526),2024-11-25
127491,4247,H5N1 (HPAI non. Plt),,2/11/2023,4/03/2024,Resolved,1,,Deschutes County,Birds,Domestic,No,44.062,-121.311,domestic,FALSE,POINT (-121.31103515625 44.06390660801779),2023-11-02
105448,4247,H5N1 (HPAI non. Plt),,17/07/2022,10/01/2023,Resolved,1,,Deschutes County,Birds,Domestic,No,44.076,-121.303,domestic,FALSE,POINT (-121.300048828125 44.079693274257124),2022-07-17
129068,4247,H5N1 (HPAI non. Plt),,7/11/2023,11/04/2024,Resolved,1,,Waseca County,Birds,Domestic,No,44.08,-93.508,domestic,FALSE,POINT (-93.504638671875 44.079693274257124),2023-11-07
103874,4247,empty strain - H5N1 (HPAI non. Plt),,18/05/2022,30/06/2022,Resolved,1,,Lane County,Branta canadensis,Wild,No,44.1,-123.086,wild,FALSE,POINT (-123.0908203125 44.10336537791153),2022-05-18
101553,4247,empty strain - H5N1 (HPAI non. Plt),,6/04/2022,30/06/2022,Resolved,1,,Blue Earth County,Branta canadensis,Wild,No,44.186,-94.006,wild,FALSE,POINT (-94.010009765625 44.18220395771564),2022-04-06
103434,4247,empty strain - H5N1 (HPAI non. Plt),,16/05/2022,11/10/2022,Resolved,1,,Campbell County,Birds,Domestic,No,44.28,-105.493,domestic,FALSE,POINT (-105.49072265625 44.27667127377515),2022-05-16
142042,4247,H5N1 (HPAI non. Plt),,19/10/2024,,Continuing,1,,Crook County,Birds,Domestic,No,44.303,-120.844,domestic,FALSE,POINT (-120.838623046875 44.30026441158151),2024-10-19
109920,4247,H5N1 (HPAI non. Plt),,28/11/2022,6/04/2023,Resolved,1,,Brookings County ,Birds,Domestic,No,44.312,-96.809,domestic,FALSE,POINT (-96.8115234375 44.30812668488613),2022-11-28
126882,4247,H5N1 (HPAI non. Plt),,17/10/2023,26/02/2024,Resolved,1,,Brown County,Birds,Domestic,No,44.311,-94.462,domestic,FALSE,POINT (-94.46044921875 44.30812668488613),2023-10-17
102983,4247,empty strain - H5N1 (HPAI non. Plt),,15/04/2022,30/06/2022,Resolved,1,,Johnson County,Pica hudsonia,Wild,No,44.328,-106.741,wild,FALSE,POINT (-106.7431640625 44.33170718680921),2022-04-15
102672,4247,empty strain - H5N1 (HPAI non. Plt),,20/04/2022,27/09/2022,Resolved,1,,Rice County,Birds,Domestic,No,44.34,-93.293,domestic,FALSE,POINT (-93.2958984375 44.33956524809713),2022-04-20
101094,4247,empty strain - H5N1 (HPAI non. Plt),,25/03/2022,1/09/2022,Resolved,1,,Johnson County,Birds,Domestic,No,44.345,-106.72,domestic,FALSE,POINT (-106.72119140625 44.34742225636393),2022-03-25
107079,4247,H5N1 (HPAI non. Plt),,19/09/2022,23/02/2023,Resolved,1,,Kingsbury County,Birds,Domestic,No,44.3832,-97.551,domestic,FALSE,POINT (-97.547607421875 44.38669150215205),2022-09-19
110193,4247,H5N1 (HPAI non. Plt),,2/12/2022,6/04/2023,Resolved,1,,Kingsbury County,Birds,Domestic,No,44.386,-97.546,domestic,FALSE,POINT (-97.547607421875 44.38669150215205),2022-12-02
117112,4247,H5N1 (HPAI non. Plt),,28/03/2023,3/08/2023,Resolved,1,,Le Sueur County,Birds,Domestic,No,44.389,-93.732,domestic,FALSE,POINT (-93.7353515625 44.38669150215205),2023-03-28
128769,4247,H5N1 (HPAI non. Plt),,30/11/2023,3/04/2024,Resolved,1,,Kingsbury County,Birds,Domestic,No,44.386,-97.547,domestic,FALSE,POINT (-97.547607421875 44.38669150215205),2023-11-30
101551,4247,empty strain - H5N1 (HPAI non. Plt),,27/03/2022,6/09/2022,Resolved,1,,Park County,Birds,Domestic,No,44.508,-109.05,domestic,FALSE,POINT (-109.05029296875 44.504341277653936),2022-03-27
101095,4247,empty strain - H5N1 (HPAI non. Plt),,25/03/2022,1/09/2022,Resolved,1,,Park County,Birds,Domestic,No,44.511,-109.047,domestic,FALSE,POINT (-109.05029296875 44.51217617107105),2022-03-25
113592,4247,H5N1 (HPAI non. Plt),,30/01/2023,1/06/2023,Resolved,1,,Park County,Birds,Domestic,No,44.512,-109.059,domestic,FALSE,POINT (-109.061279296875 44.51217617107105),2023-01-30
108202,4247,H5N1 (HPAI non. Plt),,21/09/2022,23/02/2023,Resolved,1,,Valley County,Birds,Domestic,No,44.52,-116.053,domestic,FALSE,POINT (-116.048583984375 44.52001001133988),2022-09-21
103190,4247,empty strain - H5N1 (HPAI non. Plt),,9/05/2022,30/06/2022,Resolved,1,,Custer County,Bubo virginianus,Wild,No,44.525,-114.215,wild,FALSE,POINT (-114.2138671875 44.52784279845551),2022-05-09
109470,4247,H5N1 (HPAI non. Plt),,8/11/2022,31/12/2022,Resolved,1,,Park County,Aquila chrysaetos,Wild,No,44.525,-109.068,wild,FALSE,POINT (-109.072265625 44.52784279845551),2022-11-08
110647,4247,H5N1 (HPAI non. Plt),,3/12/2022,12/04/2023,Resolved,1,,Redwood County,Birds,Domestic,No,44.541,-95.109,domestic,FALSE,POINT (-95.108642578125 44.54350521320819),2022-12-03
107129,4247,H5N1 (HPAI non. Plt),,21/09/2022,31/01/2023,Resolved,1,,Goodhue County,Birds,Domestic,No,44.568,-92.53,domestic,FALSE,POINT (-92.52685546875 44.566990936571415),2022-09-21
129431,4247,H5N1 (HPAI non. Plt),,16/12/2023,1/05/2024,Resolved,1,,Benton County,Birds,Domestic,No,44.565,-123.262,domestic,FALSE,POINT (-123.2666015625 44.566990936571415),2023-12-16
102969,4247,empty strain - H5N1 (HPAI non. Plt),,29/04/2022,5/10/2022,Resolved,1,,Linn County,Birds,Domestic,No,44.601,-123.133,domestic,FALSE,POINT (-123.134765625 44.59829048984011),2022-04-29
104777,4247,H5N1 (HPAI non. Plt),,30/06/2022,29/12/2022,Resolved,1,,Linn County,Birds,Domestic,No,44.63,-123.104,domestic,FALSE,POINT (-123.101806640625 44.62957319195104),2022-06-30
110646,4247,H5N1 (HPAI non. Plt),,9/12/2022,26/04/2023,Resolved,1,,Linn County,Birds,Domestic,No,44.638,-123.105,domestic,FALSE,POINT (-123.101806640625 44.63739123445583),2022-12-09
111072,4247,H5N1 (HPAI non. Plt),,11/11/2022,31/12/2022,Resolved,1,,Lincoln County,Charadrius nivosus,Wild,No,44.636,-124.054,wild,FALSE,POINT (-124.0576171875 44.63739123445583),2022-11-11
102897,4247,empty strain - H5N1 (HPAI non. Plt),,26/04/2022,30/09/2022,Resolved,1,,Hamlin County,Birds,Domestic,No,44.66,-97.213,domestic,FALSE,POINT (-97.218017578125 44.66083904265619),2022-04-26
109182,4247,H5N1 (HPAI non. Plt),,6/10/2022,27/02/2023,Resolved,1,,Hamlin County,Birds,Domestic,No,44.657,-97.207,domestic,FALSE,POINT (-97.20703125 44.66083904265619),2022-10-06
101873,4247,empty strain - H5N1 (HPAI non. Plt),,29/03/2022,30/06/2022,Resolved,1,,Dakota County,Corvidae (incognita),Wild,No,44.741,-92.843,wild,FALSE,POINT (-92.845458984375 44.738929943073686),2022-03-29
102965,4247,empty strain - H5N1 (HPAI non. Plt),,30/04/2022,28/10/2022,Resolved,1,,Pierce County,Birds,Domestic,No,44.74,-92.495,domestic,FALSE,POINT (-92.493896484375 44.738929943073686),2022-04-30
102963,4247,empty strain - H5N1 (HPAI non. Plt),,2/05/2022,1/10/2022,Resolved,1,,Carver County,Birds,Domestic,No,44.762,-93.623,domestic,FALSE,POINT (-93.62548828125 44.762336674810996),2022-05-02
102120,4247,empty strain - H5N1 (HPAI non. Plt),,15/04/2022,30/06/2022,Resolved,1,,Carver County,Anser albifrons,Wild,No,44.795,-93.635,wild,FALSE,POINT (-93.636474609375 44.793530904744074),2022-04-15
102680,4247,empty strain - H5N1 (HPAI non. Plt),,26/04/2022,24/09/2022,Resolved,1,,Carver County,Birds,Domestic,No,44.793,-93.634,domestic,FALSE,POINT (-93.636474609375 44.793530904744074),2022-04-26
101226,4247,empty strain - H5N1 (HPAI non. Plt),,31/03/2022,9/09/2022,Resolved,1,,Sheridan County,Birds,Domestic,No,44.811,-106.992,domestic,FALSE,POINT (-106.995849609375 44.809121700077355),2022-03-31
102701,4247,empty strain - H5N1 (HPAI non. Plt),,20/04/2022,30/06/2022,Resolved,1,,Sheridan County,Meleagris gallopavo,Wild,No,44.811,-106.992,wild,FALSE,POINT (-106.995849609375 44.809121700077355),2022-04-20
103354,4247,empty strain - H5N1 (HPAI non. Plt),,6/05/2022,9/11/2022,Resolved,1,,Sheridan County,Birds,Domestic,No,44.812,-106.961,domestic,FALSE,POINT (-106.962890625 44.809121700077355),2022-05-06
146556,4247,H5N1 (HPAI non. Plt),,18/12/2024,,Continuing,1,,Sheridan County,Birds,Domestic,No,44.81,-106.971,domestic,FALSE,POINT (-106.973876953125 44.809121700077355),2024-12-18
108204,4247,H5N1 (HPAI non. Plt),,16/10/2022,27/02/2023,Resolved,1,,Spink County,Birds,Domestic,No,44.874,-98.524,domestic,FALSE,POINT (-98.525390625 44.8714427501659),2022-10-16
109919,4247,H5N1 (HPAI non. Plt),,29/11/2022,6/04/2023,Resolved,1,,Clark County,Birds,Domestic,No,44.88,-97.725,domestic,FALSE,POINT (-97.723388671875 44.87922814163525),2022-11-29
103347,4247,empty strain - H5N1 (HPAI non. Plt),,9/05/2022,11/11/2022,Resolved,1,,Dunn County,Birds,Domestic,No,44.896,-91.934,domestic,FALSE,POINT (-91.93359375 44.894795764697875),2022-05-09
106514,4247,H5N1 (HPAI non. Plt),,30/08/2022,30/12/2022,Resolved,1,,Hennepin County,Birds,Domestic,No,44.921,-93.309,domestic,FALSE,POINT (-93.306884765625 44.918139299585135),2022-08-30
108251,4247,H5N1 (HPAI non. Plt),,6/10/2022,31/12/2022,Resolved,1,,Marion County,Branta hutchinsii,Wild,No,44.916,-122.992,wild,FALSE,POINT (-122.991943359375 44.918139299585135),2022-10-06
110187,4247,H5N1 (HPAI non. Plt),,29/11/2022,8/04/2023,Resolved,1,,Polk County,Birds,Domestic,No,44.921,-123.315,domestic,FALSE,POINT (-123.310546875 44.918139299585135),2022-11-29
113102,4247,H5N1 (HPAI non. Plt),,20/01/2023,5/06/2023,Resolved,1,,Polk County,Birds,Domestic,No,44.921,-123.315,domestic,FALSE,POINT (-123.310546875 44.918139299585135),2023-01-20
104190,4247,H5N1 (HPAI non. Plt),,4/06/2022,21/11/2022,Resolved,1,,Polk County,Birds,Domestic,No,44.925,-123.32,domestic,FALSE,POINT (-123.321533203125 44.925918371288674),2022-06-04
110648,4247,H5N1 (HPAI non. Plt),,11/12/2022,15/04/2023,Resolved,1,,Polk County,Birds,Domestic,No,44.925,-123.315,domestic,FALSE,POINT (-123.310546875 44.925918371288674),2022-12-11
127494,4247,H5N1 (HPAI non. Plt),,1/11/2023,4/03/2024,Resolved,1,,Marion County,Birds,Domestic,No,44.94,-123.036,domestic,FALSE,POINT (-123.035888671875 44.941473354802525),2023-11-01
108639,4247,H5N1 (HPAI non. Plt),,3/10/2022,14/03/2023,Resolved,1,,St. Croix County,Birds,Domestic,No,44.964,-92.722,domestic,FALSE,POINT (-92.724609375 44.964797930331),2022-10-03
104365,4247,H5N1 (HPAI non. Plt),,26/04/2022,30/06/2022,Resolved,1,,Hennepin County,Junco hyemalis,Wild,No,44.977,-93.288,wild,FALSE,POINT (-93.284912109375 44.98034238084972),2022-04-26
127942,4247,H5N1 (HPAI non. Plt),,9/11/2023,22/03/2024,Resolved,1,,Taylor 01,Birds,Domestic,No,45.137,-90.341,domestic,FALSE,POINT (-90.340576171875 45.135555160125364),2023-11-09
144058,4247,H5N1 (HPAI non. Plt),,10/11/2024,,Continuing,1,,Lemhi County ,Birds,Domestic,No,45.179,-113.902,domestic,FALSE,POINT (-113.90625 45.182036837015886),2024-11-10
147238,4247,H5N1 (HPAI non. Plt),,19/11/2024,28/02/2025,Resolved,1,,Lemhi County,Birds,Domestic,No,45.179,-113.902,domestic,FALSE,POINT (-113.90625 45.182036837015886),2024-11-19
102970,4247,empty strain - H5N1 (HPAI non. Plt),,30/04/2022,1/10/2022,Resolved,1,,Anoka County,Birds,Domestic,No,45.213,-93.373,domestic,FALSE,POINT (-93.372802734375 45.213003555993964),2022-04-30
108366,4247,H5N1 (HPAI non. Plt),,19/10/2022,19/11/2022,Resolved,1,,Grant County,Birds,Domestic,No,45.219,-96.641,domestic,FALSE,POINT (-96.6357421875 45.220742602553656),2022-10-19
130281,4247,H5N1 (HPAI non. Plt),,1/01/2024,10/05/2024,Resolved,1,,Sherburne County,Birds,Domestic,No,45.305,-93.62,domestic,FALSE,POINT (-93.62548828125 45.305802599435765),2024-01-01
102682,4247,empty strain - H5N1 (HPAI non. Plt),,24/04/2022,4/10/2022,Resolved,1,,Swift County,Birds,Domestic,No,45.324,-95.617,domestic,FALSE,POINT (-95.614013671875 45.32125436117147),2022-04-24
126880,4247,H5N1 (HPAI non. Plt),,20/10/2023,20/02/2024,Resolved,1,,Union County,Birds,Domestic,No,45.322,-118.095,domestic,FALSE,POINT (-118.092041015625 45.32125436117147),2023-10-20
144479,4247,H5N1 (HPAI non. Plt),,13/11/2024,,Continuing,1,,Union County,Birds,Domestic,No,45.322,-118.095,domestic,FALSE,POINT (-118.092041015625 45.32125436117147),2024-11-13
110189,4247,H5N1 (HPAI non. Plt),,1/12/2022,8/04/2023,Resolved,1,,Clackamas County,Birds,Domestic,No,45.359,-122.607,domestic,FALSE,POINT (-122.607421875 45.35986533395973),2022-12-01
127993,4247,H5N1 (HPAI non. Plt),,14/11/2023,3/04/2024,Resolved,1,,Clackamas County,Birds,Domestic,No,45.358,-122.607,domestic,FALSE,POINT (-122.607421875 45.35986533395973),2023-11-14
102697,4247,empty strain - H5N1 (HPAI non. Plt),,17/04/2022,28/09/2022,Resolved,1,,Chisago County,Birds,Domestic,No,45.393,-92.823,domestic,FALSE,POINT (-92.823486328125 45.39073515424889),2022-04-17
102684,4247,empty strain - H5N1 (HPAI non. Plt),,14/04/2022,17/01/2023,Resolved,1,,Barron County,Birds,Domestic,No,45.399,-91.836,domestic,FALSE,POINT (-91.834716796875 45.39844997630408),2022-04-14
102692,4247,empty strain - H5N1 (HPAI non. Plt),,25/04/2022,29/09/2022,Resolved,1,,Chisago County,Birds,Domestic,No,45.404,-92.814,domestic,FALSE,POINT (-92.8125 45.40616374516014),2022-04-25
102693,4247,empty strain - H5N1 (HPAI non. Plt),,26/04/2022,29/09/2022,Resolved,1,,Chisago County,Birds,Domestic,No,45.407,-92.822,domestic,FALSE,POINT (-92.823486328125 45.40616374516014),2022-04-26
103129,4247,empty strain - H5N1 (HPAI non. Plt),,6/05/2022,7/10/2022,Resolved,1,,Chisago County,Birds,Domestic,No,45.404,-92.81,domestic,FALSE,POINT (-92.8125 45.40616374516014),2022-05-06
107326,4247,H5N1 (HPAI non. Plt),,12/09/2022,23/03/2023,Resolved,1,,Tillamook County,Birds,Domestic,No,45.448,-123.843,domestic,FALSE,POINT (-123.837890625 45.44471679159554),2022-09-12
102116,4247,empty strain - H5N1 (HPAI non. Plt),,18/04/2022,8/11/2022,Resolved,1,,Polk County,Birds,Domestic,No,45.459,-92.471,domestic,FALSE,POINT (-92.471923828125 45.460130637921),2022-04-18
102696,4247,empty strain - H5N1 (HPAI non. Plt),,28/04/2022,30/09/2022,Resolved,1,,Polk County,Birds,Domestic,No,45.459,-92.472,domestic,FALSE,POINT (-92.471923828125 45.460130637921),2022-04-28
107166,4247,H5N1 (HPAI non. Plt),,19/09/2022,23/03/2023,Resolved,1,,Tillamook County,Birds,Domestic,No,45.459,-123.844,domestic,FALSE,POINT (-123.848876953125 45.460130637921),2022-09-19
127995,4247,H5N1 (HPAI non. Plt),,16/11/2023,19/03/2024,Resolved,1,,Walworth County,Birds,Domestic,No,45.507,-100.034,domestic,FALSE,POINT (-100.030517578125 45.50634690108342),2023-11-16
101101,4247,empty strain - H5N1 (HPAI non. Plt),,29/03/2022,30/08/2022,Resolved,1,,Stearns County,Birds,Domestic,No,45.545,-94.147,domestic,FALSE,POINT (-94.141845703125 45.544831492424635),2022-03-29
135755,4247,H5N1 (HPAI non. Plt),,9/06/2024,19/10/2024,Resolved,1,,Stearns County,Birds,Domestic,No,45.544,-94.146,domestic,FALSE,POINT (-94.141845703125 45.544831492424635),2024-06-09
106876,4247,H5N1 (HPAI non. Plt),,5/09/2022,23/01/2023,Resolved,1,,Isanti County,Birds,Domestic,No,45.573,-93.31,domestic,FALSE,POINT (-93.306884765625 45.57560020947801),2022-09-05
132698,4247,H5N1 (HPAI non. Plt),,23/02/2024,25/06/2024,Resolved,1,,Stevens County,Birds,Domestic,No,45.587,-95.909,domestic,FALSE,POINT (-95.91064453125 45.58328975600631),2024-02-23
108434,4247,H5N1 (HPAI non. Plt),,1/10/2022,3/02/2023,Resolved,1,,Pope County,Birds,Domestic,No,45.641,-95.386,domestic,FALSE,POINT (-95.38330078125 45.64476821775193),2022-10-01
101855,4247,empty strain - H5N1 (HPAI non. Plt),,7/04/2022,12/09/2022,Resolved,1,,Benton County,Birds,Domestic,No,45.657,-93.906,domestic,FALSE,POINT (-93.9111328125 45.660127302721946),2022-04-07
126654,4247,H5N1 (HPAI non. Plt),,9/10/2023,15/02/2024,Resolved,1,,Park County,Birds,Domestic,No,45.663,-110.556,domestic,FALSE,POINT (-110.555419921875 45.660127302721946),2023-10-09
101857,4247,empty strain - H5N1 (HPAI non. Plt),,8/04/2022,12/09/2022,Resolved,1,,Benton County,Birds,Domestic,No,45.67,-93.897,domestic,FALSE,POINT (-93.900146484375 45.66780526567163),2022-04-08
102688,4247,empty strain - H5N1 (HPAI non. Plt),,25/04/2022,29/09/2022,Resolved,1,,Gallatin County,Birds,Domestic,No,45.676,-111.012,domestic,FALSE,POINT (-111.016845703125 45.675482175606476),2022-04-25
110910,4247,H5N1 (HPAI non. Plt),,15/12/2022,20/04/2023,Resolved,1,,Umatilla County,Birds,Domestic,No,45.674,-118.784,domestic,FALSE,POINT (-118.7841796875 45.675482175606476),2022-12-15
113160,4247,H5N1 (HPAI non. Plt),,6/01/2023,30/06/2023,Resolved,1,,Gallatin County,Aythya marila,Wild,No,45.672,-111.06,wild,FALSE,POINT (-111.060791015625 45.675482175606476),2023-01-06
149518,4247,H5N1 (HPAI non. Plt),,2/01/2025,,Continuing,1,,Umatilla Countty,Birds,Domestic,No,45.673,-118.783,domestic,FALSE,POINT (-118.7841796875 45.675482175606476),2025-01-02
103500,4247,empty strain - H5N1 (HPAI non. Plt),,13/05/2022,30/06/2022,Resolved,1,,Price County,Corvus corax,Wild,No,45.693,-90.377,wild,FALSE,POINT (-90.37353515625 45.690832836458156),2022-05-13
116801,4247,H5N1 (HPAI non. Plt),,17/03/2023,4/08/2023,Resolved,1,,Umatilla County,Birds,Domestic,No,45.829,-119.274,domestic,FALSE,POINT (-119.278564453125 45.82879925192134),2023-03-17
127478,4247,H5N1 (HPAI non. Plt),,3/11/2023,6/03/2024,Resolved,1,,Sweet Grass County,Birds,Domestic,No,45.831,-109.953,domestic,FALSE,POINT (-109.951171875 45.82879925192134),2023-11-03
102699,4247,empty strain - H5N1 (HPAI non. Plt),,29/04/2022,30/06/2022,Resolved,1,,Pine County,Quiscalus quiscula,Wild,No,45.851,-92.964,wild,FALSE,POINT (-92.96630859375 45.851760488172545),2022-04-29
109603,4247,H5N1 (HPAI non. Plt),,19/11/2022,24/03/2023,Resolved,1,,Columbia County,Birds,Domestic,No,45.852,-122.817,domestic,FALSE,POINT (-122.816162109375 45.851760488172545),2022-11-19
110396,4247,H5N1 (HPAI non. Plt),,28/11/2022,8/04/2023,Resolved,1,,Columbia County,Birds,Domestic,No,45.862,-122.797,domestic,FALSE,POINT (-122.794189453125 45.85941212790755),2022-11-28
107078,4247,H5N1 (HPAI non. Plt),,19/09/2022,19/02/2023,Resolved,1,,Todd County,Birds,Domestic,No,45.975,-94.865,domestic,FALSE,POINT (-94.866943359375 45.97406038956237),2022-09-19
103120,4247,empty strain - H5N1 (HPAI non. Plt),,7/05/2022,5/10/2022,Resolved,1,,Todd County,Birds,Domestic,No,45.992,-94.878,domestic,FALSE,POINT (-94.8779296875 45.98932892799954),2022-05-07
103128,4247,empty strain - H5N1 (HPAI non. Plt),,9/05/2022,11/10/2022,Resolved,1,,Grant County,Birds,Domestic,No,45.989,-95.994,domestic,FALSE,POINT (-95.99853515625 45.98932892799954),2022-05-09
102691,4247,empty strain - H5N1 (HPAI non. Plt),,30/03/2022,5/10/2022,Resolved,1,,Morrison County,Birds,Domestic,No,45.995,-94.341,domestic,FALSE,POINT (-94.339599609375 45.99696161820381),2022-03-30
127481,4247,H5N1 (HPAI non. Plt),,6/11/2023,19/03/2024,Resolved,1,,McIntosh County,Birds,Domestic,No,46.036,-99.371,domestic,FALSE,POINT (-99.371337890625 46.035109279473346),2023-11-06
130016,4247,H5N1 (HPAI non. Plt),,26/12/2023,30/04/2024,Resolved,1,,McIntosh County,Birds,Domestic,No,46.036,-99.371,domestic,FALSE,POINT (-99.371337890625 46.035109279473346),2023-12-26
106134,4247,H5N1 (HPAI non. Plt),,10/08/2022,23/01/2023,Resolved,1,,Walla Walla County,Birds,Domestic,No,46.072,-118.299,domestic,FALSE,POINT (-118.30078125 46.07323062540834),2022-08-10
106300,4247,H5N1 (HPAI non. Plt),,17/08/2022,24/01/2023,Resolved,1,,Cowlitz County,Birds,Domestic,No,46.101,-122.874,domestic,FALSE,POINT (-122.87109375 46.10370875598025),2022-08-17
126937,4247,H5N1 (HPAI non. Plt),,19/10/2023,22/02/2024,Resolved,1,,Pine County,Birds,Domestic,No,46.14,-92.865,domestic,FALSE,POINT (-92.867431640625 46.14178273759234),2023-10-19
112077,4247,H5N1 (HPAI non. Plt),,18/12/2022,31/12/2022,Resolved,1,,Clatsop County,Gavia pacifica,Wild,No,46.188,-123.835,wild,FALSE,POINT (-123.837890625 46.1874367843254),2022-12-18
112354,4247,H5N1 (HPAI non. Plt),,4/01/2023,30/06/2023,Resolved,1,,Clatsop County,Phalaropus lobatus,Wild,No,46.189,-123.834,wild,FALSE,POINT (-123.837890625 46.1874367843254),2023-01-04
129065,4247,H5N1 (HPAI non. Plt),,7/12/2023,11/04/2024,Resolved,1,,Clatsop County,Birds,Domestic,No,46.189,-123.835,domestic,FALSE,POINT (-123.837890625 46.1874367843254),2023-12-07
114094,4247,H5N1 (HPAI non. Plt),,7/02/2023,10/06/2023,Resolved,1,,Benton County,Birds,Domestic,No,46.222,-119.217,domestic,FALSE,POINT (-119.212646484375 46.225452882269394),2023-02-07
128351,4247,H5N1 (HPAI non. Plt),,22/11/2023,17/04/2024,Resolved,1,,Emmons County,Birds,Domestic,No,46.267,-100.237,domestic,FALSE,POINT (-100.2392578125 46.26344267177987),2023-11-22
117457,4247,H5N1 (HPAI non. Plt),,5/04/2023,12/08/2023,Resolved,1,,Rosebud County,Birds,Domestic,No,46.268,-106.675,domestic,FALSE,POINT (-106.67724609375 46.27103747280262),2023-04-05
101730,4247,empty strain - H5N1 (HPAI non. Plt),,10/04/2022,18/09/2022,Resolved,1,,Lamoure County,Birds,Domestic,No,46.355,-98.306,domestic,FALSE,POINT (-98.3056640625 46.35451083736524),2022-04-10
151601,4247,H5N1 (HPAI non. Plt),,5/02/2025,,Continuing,1,,Crow Wing County,Birds,Domestic,No,46.356,-94.205,domestic,FALSE,POINT (-94.207763671875 46.35451083736524),2025-02-05
104189,4247,H5N1 (HPAI non. Plt),,1/06/2022,10/11/2022,Resolved,1,,Yakima County,Birds,Domestic,No,46.572,-120.471,domestic,FALSE,POINT (-120.47607421875 46.5739667965278),2022-06-01
128496,4247,H5N1 (HPAI non. Plt),,13/11/2023,30/03/2024,Resolved,1,,Lewis and Clark County,Birds,Domestic,No,46.586,-112.036,domestic,FALSE,POINT (-112.03857421875 46.58906908309183),2023-11-13
104465,4247,H5N1 (HPAI non. Plt),,14/06/2022,16/11/2022,Resolved,1,,Yakima County,Birds,Domestic,No,46.596,-120.474,domestic,FALSE,POINT (-120.47607421875 46.59661864884464),2022-06-14
101868,4247,empty strain - H5N1 (HPAI non. Plt),,15/04/2022,30/06/2022,Resolved,1,,Lewis and Clark County,Branta canadensis,Wild,No,46.606,-112.007,wild,FALSE,POINT (-112.005615234375 46.604167162931844),2022-04-15
104773,4247,H5N1 (HPAI non. Plt),,24/06/2022,28/11/2022,Resolved,1,,Yakima County,Birds,Domestic,No,46.623,-120.556,domestic,FALSE,POINT (-120.552978515625 46.61926103617151),2022-06-24
104186,4247,H5N1 (HPAI non. Plt),,30/05/2022,10/11/2022,Resolved,1,,Yakima County,Birds,Domestic,No,46.626,-120.506,domestic,FALSE,POINT (-120.509033203125 46.6268063953552),2022-05-30
142039,4247,H5N1 (HPAI non. Plt),,15/10/2024,21/02/2025,Resolved,1,,Lewis County,Birds,Domestic,No,46.662,-122.969,domestic,FALSE,POINT (-122.969970703125 46.664517417542385),2024-10-15
102984,4247,empty strain - H5N1 (HPAI non. Plt),,3/05/2022,30/06/2022,Resolved,1,,Burleigh County,Grus canadensis,Wild,No,46.779,-100.785,wild,FALSE,POINT (-100.78857421875 46.777492763768265),2022-05-03
103627,4247,empty strain - H5N1 (HPAI non. Plt),,18/05/2022,11/11/2022,Resolved,1,,Bayfield County,Birds,Domestic,No,46.816,-90.81,domestic,FALSE,POINT (-90.81298828125 46.815098645992435),2022-05-18
103851,4247,empty strain - H5N1 (HPAI non. Plt),,19/05/2022,23/10/2022,Resolved,1,,Becker County,Birds,Domestic,No,46.814,-95.875,domestic,FALSE,POINT (-95.877685546875 46.815098645992435),2022-05-19
103191,4247,empty strain - H5N1 (HPAI non. Plt),,9/05/2022,30/06/2022,Resolved,1,,Kidder County,"Accipiter striatus, Circus cyaneus",Wild,No,46.863,-99.911,wild,FALSE,POINT (-99.90966796875 46.86019101567027),2022-05-09
106591,4247,H5N1 (HPAI non. Plt),,28/08/2022,1/02/2023,Resolved,1,,Cass County,Birds,Domestic,No,46.878,-96.84,domestic,FALSE,POINT (-96.844482421875 46.87521339672267),2022-08-28
127496,4247,H5N1 (HPAI non. Plt),,5/11/2023,7/03/2024,Resolved,1,,Missoula County,Birds,Domestic,No,46.873,-113.997,domestic,FALSE,POINT (-113.994140625 46.87521339672267),2023-11-05
129605,4247,H5N1 (HPAI non. Plt),,19/12/2023,24/04/2024,Resolved,1,,Missoula County,Birds,Domestic,No,46.873,-113.996,domestic,FALSE,POINT (-113.994140625 46.87521339672267),2023-12-19
133089,4247,H5N1 (HPAI non. Plt),,3/03/2024,8/07/2024,Resolved,1,,Clay County,Birds,Domestic,No,46.884,-96.763,domestic,FALSE,POINT (-96.767578125 46.88272301067195),2024-03-03
103353,4247,empty strain - H5N1 (HPAI non. Plt),,12/05/2022,13/10/2022,Resolved,1,,Clay County,Birds,Domestic,No,46.9,-96.751,domestic,FALSE,POINT (-96.74560546875 46.897739085507),2022-05-12
102674,4247,empty strain - H5N1 (HPAI non. Plt),,21/04/2022,21/09/2022,Resolved,1,,Missoula County,Birds,Domestic,No,46.916,-113.963,domestic,FALSE,POINT (-113.961181640625 46.912750956378915),2022-04-21
103877,4247,empty strain - H5N1 (HPAI non. Plt),,23/05/2022,30/06/2022,Resolved,1,,Stutsman County,Egretta thula,Wild,No,46.909,-98.624,wild,FALSE,POINT (-98.624267578125 46.912750956378915),2022-05-23
126562,4247,H5N1 (HPAI non. Plt),,2/10/2023,19/03/2024,Resolved,1,,Golden Valley County,Birds,Domestic,No,46.913,-104.005,domestic,FALSE,POINT (-104.007568359375 46.912750956378915),2023-10-02
103496,4247,empty strain - H5N1 (HPAI non. Plt),,3/05/2022,30/06/2022,Resolved,1,,Stutsman County,Turdus migratorius,Wild,No,46.926,-98.711,wild,FALSE,POINT (-98.712158203125 46.92775862343444),2022-05-03
101546,4247,empty strain - H5N1 (HPAI non. Plt),,1/04/2022,6/09/2022,Resolved,1,,Cass County,Birds,Domestic,No,46.932,-96.849,domestic,FALSE,POINT (-96.844482421875 46.935260880577204),2022-04-01
103875,4247,empty strain - H5N1 (HPAI non. Plt),,20/05/2022,30/06/2022,Resolved,1,,Stutsman County,Buteo platypterus,Wild,No,46.938,-98.663,wild,FALSE,POINT (-98.668212890625 46.935260880577204),2022-05-20
102972,4247,empty strain - H5N1 (HPAI non. Plt),,30/04/2022,29/09/2022,Resolved,1,,Fergus County,Birds,Domestic,No,47.028,-109.464,domestic,FALSE,POINT (-109.4677734375 47.02520600158539),2022-04-30
111939,4247,H5N1 (HPAI non. Plt),,30/12/2022,5/05/2023,Resolved,1,,Thurston County,Birds,Domestic,No,47.029,-122.914,domestic,FALSE,POINT (-122.9150390625 47.032694598521346),2022-12-30
102689,4247,empty strain - H5N1 (HPAI non. Plt),,22/04/2022,26/09/2022,Resolved,1,,Fergus County,Birds,Domestic,No,47.046,-109.491,domestic,FALSE,POINT (-109.48974609375 47.04766864046084),2022-04-22
103350,4247,empty strain - H5N1 (HPAI non. Plt),,14/05/2022,22/10/2022,Resolved,1,,Thurston County,Birds,Domestic,No,47.052,-122.837,domestic,FALSE,POINT (-122.838134765625 47.05515408550349),2022-05-14
104358,4247,H5N1 (HPAI non. Plt),,10/06/2022,30/06/2022,Resolved,1,,Cass County,Sterna hirundo,Wild,No,47.097,-94.569,wild,FALSE,POINT (-94.5703125 47.10004469402523),2022-06-10
104359,4247,H5N1 (HPAI non. Plt),,10/06/2022,30/06/2022,Resolved,1,,Cass County,Hydroprogne caspia,Wild,No,47.101,-94.586,wild,FALSE,POINT (-94.581298828125 47.10004469402523),2022-06-10
101548,4247,empty strain - H5N1 (HPAI non. Plt),,29/03/2022,13/09/2022,Resolved,1,,Judith Basin County,Birds,Domestic,No,47.15,-110.226,domestic,FALSE,POINT (-110.225830078125 47.15236927446392),2022-03-29
151598,4247,H5N1 (HPAI non. Plt),,27/01/2025,,Continuing,1,,Mason County,Birds,Domestic,No,47.216,-123.104,domestic,FALSE,POINT (-123.101806640625 47.21956811231547),2025-01-27
106298,4247,H5N1 (HPAI non. Plt),,17/08/2022,24/01/2023,Resolved,1,,Pierce County,Birds,Domestic,No,47.23,-122.46,domestic,FALSE,POINT (-122.464599609375 47.2270293988673),2022-08-17
103121,4247,empty strain - H5N1 (HPAI non. Plt),,2/05/2022,11/10/2022,Resolved,1,,Pierce County,Birds,Domestic,No,47.232,-122.461,domestic,FALSE,POINT (-122.464599609375 47.234489635299184),2022-05-02
106906,4247,H5N1 (HPAI non. Plt),,9/09/2022,14/02/2023,Resolved,1,,Pierce County,Birds,Domestic,No,47.233,-122.432,domestic,FALSE,POINT (-122.431640625 47.234489635299184),2022-09-09
108140,4247,H5N1 (HPAI non. Plt),,15/10/2022,20/02/2023,Resolved,1,,Itasca County,Birds,Domestic,No,47.236,-93.528,domestic,FALSE,POINT (-93.526611328125 47.234489635299184),2022-10-15
111447,4247,H5N1 (HPAI non. Plt),,19/12/2022,20/04/2023,Resolved,1,,Pierce County,Birds,Domestic,No,47.253,-122.445,domestic,FALSE,POINT (-122.442626953125 47.24940695788845),2022-12-19
104772,4247,H5N1 (HPAI non. Plt),,14/06/2022,2/12/2022,Resolved,1,,Pierce County,Birds,Domestic,No,47.259,-122.517,domestic,FALSE,POINT (-122.51953125 47.25686404408873),2022-06-14
128353,4247,H5N1 (HPAI non. Plt),,17/11/2023,26/03/2024,Resolved,1,,Pierce County,Birds,Domestic,No,47.254,-122.445,domestic,FALSE,POINT (-122.442626953125 47.25686404408873),2023-11-17
101554,4247,empty strain - H5N1 (HPAI non. Plt),,6/04/2022,30/06/2022,Resolved,1,,Mercer County,Haliaeetus leucocephalus,Wild,No,47.31,-101.394,wild,FALSE,POINT (-101.392822265625 47.3090342477478),2022-04-06
103122,4247,empty strain - H5N1 (HPAI non. Plt),,25/04/2022,12/10/2022,Resolved,1,,Pierce County,Birds,Domestic,No,47.31,-122.417,domestic,FALSE,POINT (-122.420654296875 47.3090342477478),2022-04-25
112002,4247,H5N1 (HPAI non. Plt),,6/12/2022,31/12/2022,Resolved,1,,Garfield County,Falco mexicanus,Wild,No,47.319,-106.91,wild,FALSE,POINT (-106.907958984375 47.31648293428333),2022-12-06
101729,4247,empty strain - H5N1 (HPAI non. Plt),,7/04/2022,18/09/2022,Resolved,1,,Sheridan County,Birds,Domestic,No,47.485,-100.448,domestic,FALSE,POINT (-100.447998046875 47.48751300895654),2022-04-07
106340,4247,H5N1 (HPAI non. Plt),,19/08/2022,17/01/2023,Resolved,1,,Kitsap County,Birds,Domestic,No,47.484,-122.708,domestic,FALSE,POINT (-122.706298828125 47.48751300895654),2022-08-19
107885,4247,H5N1 (HPAI non. Plt),,10/10/2022,14/02/2023,Resolved,1,,Traill County,Birds,Domestic,No,47.498,-97.338,domestic,FALSE,POINT (-97.3388671875 47.49493650511715),2022-10-10
104775,4247,H5N1 (HPAI non. Plt),,19/06/2022,27/11/2022,Resolved,1,,Kitsap County,Birds,Domestic,No,47.503,-122.646,domestic,FALSE,POINT (-122.6513671875 47.5023589519686),2022-06-19
130528,4247,H5N1 (HPAI non. Plt),,8/01/2024,22/05/2024,Resolved,1,,Cascade County,Birds,Domestic,No,47.501,-111.3,domestic,FALSE,POINT (-111.302490234375 47.5023589519686),2024-01-08
112041,4247,H5N1 (HPAI non. Plt),,29/12/2022,7/05/2023,Resolved,1,,Cascade County,Birds,Domestic,No,47.508,-111.23,domestic,FALSE,POINT (-111.2255859375 47.509780349534736),2022-12-29
112075,4247,H5N1 (HPAI non. Plt),,6/12/2022,31/12/2022,Resolved,1,,Cascade County,Asio otus,Wild,No,47.511,-111.303,wild,FALSE,POINT (-111.302490234375 47.509780349534736),2022-12-06
103631,4247,empty strain - H5N1 (HPAI non. Plt),,20/05/2022,25/10/2022,Resolved,1,,King County,Birds,Domestic,No,47.535,-122.334,domestic,FALSE,POINT (-122.332763671875 47.53203824675998),2022-05-20
141434,4247,H5N1 (HPAI non. Plt),,11/10/2024,15/02/2025,Resolved,1,,Kitsap County,Birds,Domestic,No,47.538,-122.639,domestic,FALSE,POINT (-122.640380859375 47.53945544742393),2024-10-11
126590,4247,H5N1 (HPAI non. Plt),,12/10/2023,5/03/2024,Resolved,1,,King County,Birds,Domestic,No,47.553,-122.048,domestic,FALSE,POINT (-122.047119140625 47.55428670127958),2023-10-12
104466,4247,H5N1 (HPAI non. Plt),,14/06/2022,18/11/2022,Resolved,1,,King County,Birds,Domestic,No,47.571,-122.32,domestic,FALSE,POINT (-122.32177734375 47.56911375866716),2022-06-14
103629,4247,empty strain - H5N1 (HPAI non. Plt),,22/05/2022,24/10/2022,Resolved,1,,King County,Birds,Domestic,No,47.574,-122.34,domestic,FALSE,POINT (-122.34375 47.57652571374621),2022-05-22
109469,4247,H5N1 (HPAI non. Plt),,7/11/2022,31/12/2022,Resolved,1,,King County,Bucephala albeola,Wild,No,47.604,-122.328,wild,FALSE,POINT (-122.332763671875 47.60616304386875),2022-11-07
103630,4247,empty strain - H5N1 (HPAI non. Plt),,21/05/2022,25/10/2022,Resolved,1,,King County,Birds,Domestic,No,47.683,-122.321,domestic,FALSE,POINT (-122.32177734375 47.68018294648414),2022-05-21
104468,4247,H5N1 (HPAI non. Plt),,14/06/2022,18/11/2022,Resolved,1,,King County,Birds,Domestic,No,47.68,-122.338,domestic,FALSE,POINT (-122.332763671875 47.68018294648414),2022-06-14
103119,4247,empty strain - H5N1 (HPAI non. Plt),,30/04/2022,4/10/2022,Resolved,1,,Spokane County,Birds,Domestic,No,47.713,-117.495,domestic,FALSE,POINT (-117.498779296875 47.70976154266637),2022-04-30
103433,4247,empty strain - H5N1 (HPAI non. Plt),,17/05/2022,17/10/2022,Resolved,1,,Polk County,Birds,Domestic,No,47.786,-96.585,domestic,FALSE,POINT (-96.580810546875 47.78363463526375),2022-05-17
126584,4247,H5N1 (HPAI non. Plt),,1/10/2023,31/12/2023,Resolved,1,,Teton County,Aythya valisineria,Wild,No,47.811,-112.182,wild,FALSE,POINT (-112.181396484375 47.813154517527664),2023-10-01
104188,4247,H5N1 (HPAI non. Plt),,2/06/2022,6/11/2022,Resolved,1,,Snohomish County,Birds,Domestic,No,47.847,-122.215,domestic,FALSE,POINT (-122.2119140625 47.85003078545827),2022-06-02
103852,4247,empty strain - H5N1 (HPAI non. Plt),,26/05/2022,28/10/2022,Resolved,1,,Snohomish County,Birds,Domestic,No,47.905,-122.212,domestic,FALSE,POINT (-122.2119140625 47.90161354142077),2022-05-26
104467,4247,H5N1 (HPAI non. Plt),,15/06/2022,18/11/2022,Resolved,1,,Snohomish County,Birds,Domestic,No,47.924,-122.211,domestic,FALSE,POINT (-122.2119140625 47.92370471774569),2022-06-15
101871,4247,empty strain - H5N1 (HPAI non. Plt),,12/04/2022,30/06/2022,Resolved,1,,Grand Forks County,Corvus brachyrhynchos,Wild,No,47.936,-97.07,wild,FALSE,POINT (-97.0751953125 47.93842692948107),2022-04-12
104187,4247,H5N1 (HPAI non. Plt),,3/06/2022,5/11/2022,Resolved,1,,Snohomish County,Birds,Domestic,No,47.967,-122.129,domestic,FALSE,POINT (-122.1240234375 47.9678587799925),2022-06-03
112752,4247,H5N1 (HPAI non. Plt),,7/01/2023,30/05/2023,Resolved,1,,Snohomish County,Birds,Domestic,No,47.977,-122.206,domestic,FALSE,POINT (-122.200927734375 47.97521412341618),2023-01-07
144054,4247,H5N1 (HPAI non. Plt),,7/11/2024,,Continuing,1,,Snohomish County,Birds,Domestic,No,47.977,-122.206,domestic,FALSE,POINT (-122.200927734375 47.97521412341618),2024-11-07
108736,4247,H5N1 (HPAI non. Plt),,31/10/2022,6/03/2023,Resolved,1,,Snohomish County,Birds,Domestic,No,47.982,-122.187,domestic,FALSE,POINT (-122.18994140625 47.98256841921403),2022-10-31
103632,4247,empty strain - H5N1 (HPAI non. Plt),,24/05/2022,26/10/2022,Resolved,1,,Snohomish County,Birds,Domestic,No,48.003,-122.17,domestic,FALSE,POINT (-122.16796875 48.004625021133904),2022-05-24
107356,4247,H5N1 (HPAI non. Plt),,16/09/2022,27/02/2023,Resolved,1,,Nelson County,Birds,Domestic,No,48.036,-98.336,domestic,FALSE,POINT (-98.338623046875 48.03401915864288),2022-09-16
103123,4247,empty strain - H5N1 (HPAI non. Plt),,7/05/2022,11/10/2022,Resolved,1,,Clallam County,Birds,Domestic,No,48.107,-123.403,domestic,FALSE,POINT (-123.3984375 48.107431188480376),2022-05-07
103876,4247,empty strain - H5N1 (HPAI non. Plt),,20/05/2022,30/06/2022,Resolved,1,,Ramsey County,Falco sparverius,Wild,No,48.114,-98.892,wild,FALSE,POINT (-98.887939453125 48.11476663187631),2022-05-20
103124,4247,empty strain - H5N1 (HPAI non. Plt),,7/05/2022,10/10/2022,Resolved,1,,Clallam County,Birds,Domestic,No,48.119,-123.47,domestic,FALSE,POINT (-123.475341796875 48.1221010281908),2022-05-07
104776,4247,H5N1 (HPAI non. Plt),,26/06/2022,10/07/2022,Resolved,1,,Jefferson County,Birds,Domestic,No,48.121,-122.776,domestic,FALSE,POINT (-122.772216796875 48.1221010281908),2022-06-26
105450,4247,H5N1 (HPAI non. Plt),,21/07/2022,22/12/2022,Resolved,1,,Jefferson County,Birds,Domestic,No,48.125,-122.764,domestic,FALSE,POINT (-122.76123046875 48.1221010281908),2022-07-21
126561,4247,H5N1 (HPAI non. Plt),,4/10/2023,19/03/2024,Resolved,1,,Williams County,Birds,Domestic,No,48.147,-103.618,domestic,FALSE,POINT (-103.623046875 48.144097934938884),2023-10-04
102687,4247,empty strain - H5N1 (HPAI non. Plt),,25/04/2022,5/06/2022,Resolved,1,,Pondera County,Birds,Domestic,No,48.18,-111.95,domestic,FALSE,POINT (-111.95068359375 48.18073850730383),2022-04-25
144036,4247,H5N1 (HPAI non. Plt),,21/10/2024,23/02/2025,Resolved,1,,Flathead County,Birds,Domestic,No,48.191,-114.311,domestic,FALSE,POINT (-114.312744140625 48.1880634812114),2024-10-21
105449,4247,H5N1 (HPAI non. Plt),,18/07/2022,20/12/2022,Resolved,1,,Flathead County,Birds,Domestic,No,48.203,-114.316,domestic,FALSE,POINT (-114.312744140625 48.202710288699706),2022-07-18
110654,4247,H5N1 (HPAI non. Plt),,9/12/2022,13/04/2023,Resolved,1,,Flathead County,Birds,Domestic,No,48.204,-114.304,domestic,FALSE,POINT (-114.3017578125 48.202710288699706),2022-12-09
126557,4247,H5N1 (HPAI non. Plt),,4/10/2023,12/02/2024,Resolved,1,,Flathead County,Birds,Domestic,No,48.203,-114.315,domestic,FALSE,POINT (-114.312744140625 48.202710288699706),2023-10-04
108976,4247,H5N1 (HPAI non. Plt),,3/11/2022,14/03/2023,Resolved,1,,Mountrail County,Birds,Domestic,No,48.32,-102.391,domestic,FALSE,POINT (-102.392578125 48.31973404047173),2022-11-03
144053,4247,H5N1 (HPAI non. Plt),,1/11/2024,,Continuing,1,,Okanogan County,Birds,Domestic,No,48.365,-119.581,domestic,FALSE,POINT (-119.586181640625 48.363548888986884),2024-11-01
103127,4247,empty strain - H5N1 (HPAI non. Plt),,9/05/2022,11/10/2022,Resolved,1,,Okanogan County,Birds,Domestic,No,48.39,-119.551,domestic,FALSE,POINT (-119.55322265625 48.39273786659243),2022-05-09
111404,4247,H5N1 (HPAI non. Plt),,21/11/2022,31/12/2022,Resolved,1,,Skagit County,Asio flammeus,Wild,No,48.418,-122.336,wild,FALSE,POINT (-122.332763671875 48.414618617493204),2022-11-21
117911,4247,H5N1 (HPAI non. Plt),,12/12/2022,31/12/2022,Resolved,1,,Skagit County,Tyto alba,Wild,No,48.418,-122.337,wild,FALSE,POINT (-122.332763671875 48.414618617493204),2022-12-12
101728,4247,empty strain - H5N1 (HPAI non. Plt),,3/04/2022,8/09/2022,Resolved,1,,Toole County,Birds,Domestic,No,48.483,-111.835,domestic,FALSE,POINT (-111.829833984375 48.48020439895515),2022-04-03
102119,4247,empty strain - H5N1 (HPAI non. Plt),,19/04/2022,30/06/2022,Resolved,1,,Towner County,Bucephala clangula,Wild,No,48.482,-99.2,wild,FALSE,POINT (-99.195556640625 48.48020439895515),2022-04-19
144052,4247,H5N1 (HPAI non. Plt),,28/10/2024,,Continuing,1,,Stevens County,Birds,Domestic,No,48.543,-117.904,domestic,FALSE,POINT (-117.9052734375 48.54570549184746),2024-10-28
102985,4247,empty strain - H5N1 (HPAI non. Plt),,6/05/2022,30/06/2022,Resolved,1,,Stevens County,Haliaeetus leucocephalus,Wild,No,48.554,-117.919,wild,FALSE,POINT (-117.916259765625 48.55297816440071),2022-05-06
108206,4247,H5N1 (HPAI non. Plt),,14/10/2022,19/02/2023,Resolved,1,,Hill County,Birds,Domestic,No,48.554,-109.672,domestic,FALSE,POINT (-109.676513671875 48.55297816440071),2022-10-14
107408,4247,H5N1 (HPAI non. Plt),,1/10/2022,6/11/2022,Resolved,1,,Glacier County,Birds,Domestic,No,48.639,-112.341,domestic,FALSE,POINT (-112.34619140625 48.64016871811907),2022-10-01
103131,4247,empty strain - H5N1 (HPAI non. Plt),,8/05/2022,10/10/2022,Resolved,1,,Whatcom County,Birds,Domestic,No,48.709,-122.477,domestic,FALSE,POINT (-122.4755859375 48.70546289579056),2022-05-08
145321,4247,H5N1 (HPAI non. Plt),,17/11/2024,,Continuing,1,,Whatcom County,Birds,Domestic,No,48.754,-122.48,domestic,FALSE,POINT (-122.4755859375 48.75618876280552),2024-11-17
101561,4247,empty strain - H5N1 (HPAI non. Plt),,17/04/2022,22/09/2022,Resolved,1,,Renville County,Birds,Domestic,No,48.769,-101.532,domestic,FALSE,POINT (-101.53564453125 48.77067246880509),2022-04-17
103349,4247,empty strain - H5N1 (HPAI non. Plt),,13/05/2022,18/10/2022,Resolved,1,,Burke County,Birds,Domestic,No,48.797,-102.242,domestic,FALSE,POINT (-102.23876953125 48.79962735079971),2022-05-13
103188,4247,empty strain - H5N1 (HPAI non. Plt),,2/05/2022,30/06/2022,Resolved,1,,Aleutians West Borough,Haliaeetus leucocephalus,Wild,No,51.762,-177.273,wild,FALSE,POINT (-177.275390625 51.761040492729535),2022-05-02
104779,4247,H5N1 (HPAI non. Plt),,14/06/2022,30/06/2022,Resolved,1,,Aleutians East Borough,Larus hyperboreus,Wild,No,55.31,-160.48,wild,FALSE,POINT (-160.477294921875 55.31039088379828),2022-06-14
109471,4247,H5N1 (HPAI non. Plt),,1/11/2022,31/12/2022,Resolved,1,,Sitka Borough,Larus thayeri,Wild,No,57.052,-135.334,wild,FALSE,POINT (-135.32958984375 57.05268197871749),2022-11-01
125437,4247,H5N1 (HPAI non. Plt),,18/08/2023,31/12/2023,Resolved,1,,Dillingham Census Area,Uria aalge,Wild,No,59.041,-158.476,wild,FALSE,POINT (-158.477783203125 59.0405546167585),2023-08-18
105967,4247,empty strain - H5N1 (HPAI non. Plt),,5/08/2022,31/12/2022,Resolved,1,,Kenai Peninsula Borough,Tachycineta bicolor,Wild,No,60.481,-151.074,wild,FALSE,POINT (-151.072998046875 60.47887883016671),2022-08-05
104780,4247,H5N1 (HPAI non. Plt),,14/06/2022,30/06/2022,Resolved,1,,Bethel,Xema sabini,Wild,No,60.761,-161.781,wild,FALSE,POINT (-161.78466796875 60.75915950226991),2022-06-14
105103,4247,H5N1 (HPAI non. Plt),,11/07/2022,31/12/2022,Resolved,1,,Bethel,Sterna paradisaea,Wild,No,60.778,-161.793,wild,FALSE,POINT (-161.795654296875 60.780618803458935),2022-07-11
105705,4247,empty strain - H5N1 (HPAI non. Plt),,29/04/2022,6/10/2022,Resolved,1,,Bethel,Birds,Domestic,No,60.778,-161.792,domestic,FALSE,POINT (-161.795654296875 60.780618803458935),2022-04-29
104784,4247,H5N1 (HPAI non. Plt),,28/06/2022,30/06/2022,Resolved,1,,Bethel,Calidris alpina,Wild,No,60.8,-161.821,wild,FALSE,POINT (-161.817626953125 60.80206374467983),2022-06-28
105104,4247,H5N1 (HPAI non. Plt),,11/07/2022,31/12/2022,Resolved,1,,Bethel,Stercorarius parasiticus,Wild,No,60.814,-161.819,wild,FALSE,POINT (-161.817626953125 60.81278083236677),2022-07-11
104783,4247,H5N1 (HPAI non. Plt),,24/06/2022,30/06/2022,Resolved,1,,Anchorage Borough,Larus brachyrhynchus,Wild,No,61.3,-148.539,wild,FALSE,POINT (-148.53515625 61.30190220337445),2022-06-24
104363,4247,H5N1 (HPAI non. Plt),,8/06/2022,30/06/2022,Resolved,1,,Valdez-Cordova,Branta bernicla,Wild,No,61.509,-145.617,wild,FALSE,POINT (-145.61279296875 61.506975778539385),2022-06-08
107402,4247,H5N1 (HPAI non. Plt),,25/09/2022,1/03/2023,Resolved,1,,Matanuska-Susitna Borough,Birds,Domestic,No,61.554,-149.247,domestic,FALSE,POINT (-149.249267578125 61.55410944492718),2022-09-25
102690,4247,empty strain - H5N1 (HPAI non. Plt),,26/04/2022,5/10/2022,Resolved,1,,Matanuska-Susitna County,Birds,Domestic,No,61.587,-149.159,domestic,FALSE,POINT (-149.161376953125 61.58549218152365),2022-04-26
127480,4247,H5N1 (HPAI non. Plt),,1/11/2023,7/03/2024,Resolved,1,,Matanuska-Susitna Borough,Birds,Domestic,No,61.587,-149.443,domestic,FALSE,POINT (-149.447021484375 61.58549218152365),2023-11-01
104781,4247,H5N1 (HPAI non. Plt),,15/06/2022,30/06/2022,Resolved,1,,Matanuska-Susitna Borough,Podiceps grisegena,Wild,No,61.589,-149.126,wild,FALSE,POINT (-149.12841796875 61.59071955121135),2022-06-15
109601,4247,H5N1 (HPAI non. Plt),,23/11/2022,16/05/2023,Resolved,1,,Matanuska-Susitna Borough,Birds,Domestic,No,61.603,-149.108,domestic,FALSE,POINT (-149.1064453125 61.60117164603747),2022-11-23
127027,4247,H5N1 (HPAI non. Plt),,24/10/2023,26/02/2024,Resolved,1,,Matanuska-Susitna Borough,Birds,Domestic,No,61.603,-149.103,domestic,FALSE,POINT (-149.1064453125 61.60117164603747),2023-10-24
145315,4247,H5N1 (HPAI non. Plt),,4/11/2024,,Continuing,1,,Matanuska-Susitna Borough,Birds,Domestic,No,61.602,-149.106,domestic,FALSE,POINT (-149.1064453125 61.60117164603747),2024-11-04
145320,4247,H5N1 (HPAI non. Plt),,11/11/2024,,Continuing,1,,Matanuska-Susitna Borough,Birds,Domestic,No,61.602,-149.105,domestic,FALSE,POINT (-149.1064453125 61.60117164603747),2024-11-11
127028,4247,H5N1 (HPAI non. Plt),,25/10/2023,26/02/2024,Resolved,1,,Matanuska-Susitna Borough,Birds,Domestic,No,61.605,-149.108,domestic,FALSE,POINT (-149.1064453125 61.60639637138627),2023-10-25
108435,4247,H5N1 (HPAI non. Plt),,3/10/2022,6/02/2023,Resolved,1,,Broward County,Birds,Domestic,No,26.081,-80.134,domestic,FALSE,POINT (-80.13427734375 26.076520559856974),2022-10-03
109108,4247,H5N1 (HPAI non. Plt),,8/11/2022,30/03/2023,Resolved,1,,Broward County,Birds,Domestic,No,26.115,-80.14,domestic,FALSE,POINT (-80.145263671875 26.115985925333533),2022-11-08
109606,4247,H5N1 (HPAI non. Plt),,18/11/2022,22/03/2023,Resolved,1,,Broward County,Birds,Domestic,No,26.118,-80.143,domestic,FALSE,POINT (-80.145263671875 26.115985925333533),2022-11-18
108590,4247,H5N1 (HPAI non. Plt),,25/10/2022,8/03/2023,Resolved,1,,Broward County,Birds,Domestic,No,26.121,-80.169,domestic,FALSE,POINT (-80.167236328125 26.12585018568035),2022-10-25
127940,4247,H5N1 (HPAI non. Plt),,15/11/2023,18/03/2024,Resolved,1,,Broward County,Birds,Domestic,No,26.124,-80.262,domestic,FALSE,POINT (-80.26611328125 26.12585018568035),2023-11-15
151586,4247,H5N1 (HPAI non. Plt),,23/01/2025,,Continuing,1,,Broward County,Birds,Domestic,No,26.122,-80.263,domestic,FALSE,POINT (-80.26611328125 26.12585018568035),2025-01-23
152603,4247,H5N1 (HPAI non. Plt),,10/02/2025,,Continuing,1,,Broward County,Birds,Domestic,No,26.123,-80.263,domestic,FALSE,POINT (-80.26611328125 26.12585018568035),2025-02-10
105541,4247,H5N1 (HPAI non. Plt),,28/07/2022,31/12/2022,Resolved,1,,Broward County,Caracara cheriway,Wild,No,26.138,-80.169,wild,FALSE,POINT (-80.167236328125 26.13571361317392),2022-07-28
111069,4247,H5N1 (HPAI non. Plt),,10/12/2022,31/12/2022,Resolved,1,,Palm Beach County,Dendrocygna bicolor,Wild,No,26.467,-80.059,wild,FALSE,POINT (-80.057373046875 26.470573022375078),2022-12-10
148256,4247,H5N1 (HPAI non. Plt),,29/12/2024,,Continuing,1,,Palm Beach County,Birds,Domestic,No,26.716,-80.055,domestic,FALSE,POINT (-80.057373046875 26.716173757934087),2024-12-29
137326,4247,H5N1 (HPAI non. Plt),,20/07/2024,21/11/2024,Resolved,1,,Hendry County,Birds,Domestic,No,26.761,-81.438,domestic,FALSE,POINT (-81.441650390625 26.76523056569748),2024-07-20
108436,4247,H5N1 (HPAI non. Plt),,2/10/2022,6/02/2023,Resolved,1,,Martin County,Birds,Domestic,No,27.176,-80.253,domestic,FALSE,POINT (-80.255126953125 27.176469131898898),2022-10-02
108249,4247,H5N1 (HPAI non. Plt),,17/10/2022,22/02/2023,Resolved,1,,Martin County,Birds,Domestic,No,27.191,-80.253,domestic,FALSE,POINT (-80.255126953125 27.186242185608734),2022-10-17
131135,4247,H5N1 (HPAI non. Plt),,8/01/2024,10/06/2024,Resolved,1,,DeSoto County,Birds,Domestic,No,27.215,-81.858,domestic,FALSE,POINT (-81.859130859375 27.215556209029685),2024-01-08
108167,4247,H5N1 (HPAI non. Plt),,14/10/2022,16/02/2023,Resolved,1,,Okeechobee County,Birds,Domestic,No,27.244,-80.83,domestic,FALSE,POINT (-80.826416015625 27.244862521497282),2022-10-14
108207,4247,H5N1 (HPAI non. Plt),,6/10/2022,22/02/2023,Resolved,1,,Saint Lucie County,Birds,Domestic,No,27.447,-80.35,domestic,FALSE,POINT (-80.35400390625 27.44979032978422),2022-10-06
108246,4247,H5N1 (HPAI non. Plt),,13/10/2022,16/02/2023,Resolved,1,,Indian River County,Birds,Domestic,No,27.632,-80.389,domestic,FALSE,POINT (-80.386962890625 27.634873791342528),2022-10-13
108248,4247,H5N1 (HPAI non. Plt),,10/10/2022,27/02/2023,Resolved,1,,Indian River County,Birds,Domestic,No,27.639,-80.43,domestic,FALSE,POINT (-80.430908203125 27.634873791342528),2022-10-10
112352,4247,H5N1 (HPAI non. Plt),,25/10/2022,31/12/2022,Resolved,1,,Indian River County,Alopochen aegyptiaca,Wild,No,27.638,-80.38,wild,FALSE,POINT (-80.3759765625 27.634873791342528),2022-10-25
108215,4247,H5N1 (HPAI non. Plt),,13/10/2022,22/02/2023,Resolved,1,,Indian River County,Birds,Domestic,No,27.64,-80.397,domestic,FALSE,POINT (-80.39794921875 27.64460638194332),2022-10-13
100287,4247,empty strain - H5N1 (HPAI non. Plt),,18/03/2022,30/06/2022,Resolved,1,,Polk County,Larus delawarensis,Wild,No,27.839,-81.781,wild,FALSE,POINT (-81.7822265625 27.83907609477781),2022-03-18
108358,4247,H5N1 (HPAI non. Plt),,10/10/2022,7/03/2023,Resolved,1,,Hillsborough County,Birds,Domestic,No,27.886,-82.389,domestic,FALSE,POINT (-82.386474609375 27.88763921713651),2022-10-10
109007,4247,H5N1 (HPAI non. Plt),,1/11/2022,22/03/2023,Resolved,1,,Hillsborough County,Birds,Domestic,No,27.95,-82.451,domestic,FALSE,POINT (-82.452392578125 27.945886221761967),2022-11-01
114093,4247,H5N1 (HPAI non. Plt),,7/02/2023,22/06/2023,Resolved,1,,Hillsborough County,Birds,Domestic,No,27.949,-82.455,domestic,FALSE,POINT (-82.452392578125 27.945886221761967),2023-02-07
111071,4247,H5N1 (HPAI non. Plt),,9/12/2022,31/12/2022,Resolved,1,,Brevard County,Thalasseus sandvicensis,Wild,No,28.247,-80.738,wild,FALSE,POINT (-80.738525390625 28.246327971048842),2022-12-09
107886,4247,empty strain - H5N1 (HPAI non. Plt),,8/10/2022,28/02/2023,Resolved,1,,Osceola County,Birds,Domestic,No,28.293,-81.396,domestic,FALSE,POINT (-81.397705078125 28.294707428421205),2022-10-08
105965,4247,H5N1 (HPAI non. Plt),,10/08/2022,9/01/2023,Resolved,1,,Osceola County,Birds,Domestic,No,28.312,-81.41,domestic,FALSE,POINT (-81.40869140625 28.31405305806959),2022-08-10
108362,4247,H5N1 (HPAI non. Plt),,13/10/2022,2/03/2023,Resolved,1,,Pasco County,Birds,Domestic,No,28.369,-82.186,domestic,FALSE,POINT (-82.188720703125 28.37206882963163),2022-10-13
115740,4247,H5N1 (HPAI non. Plt),,23/01/2023,30/06/2023,Resolved,1,,Brevard County,Melanitta nigra,Wild,No,28.405,-80.706,wild,FALSE,POINT (-80.70556640625 28.401064827220893),2023-01-23
101232,4247,empty strain - H5N1 (HPAI non. Plt),,10/03/2022,30/06/2022,Resolved,1,,Orange County,"Coragyps atratus, Haliaeetus leucocephalus",Wild,No,28.487,-81.359,wild,FALSE,POINT (-81.353759765625 28.488005204159478),2022-03-10
132868,4247,H5N1 (HPAI non. Plt),,26/02/2024,30/06/2024,Resolved,1,2,Orange County ,Cygnus melancoryphus,Wild,No,28.548,-81.378,wild,FALSE,POINT (-81.375732421875 28.54592572323348),2024-02-26
98073,4247,empty strain - H5N1 (HPAI non. Plt),,17/02/2022,30/06/2022,Resolved,1,,Brevard County,Coragyps atratus,Wild,No,28.554,-80.846,wild,FALSE,POINT (-80.848388671875 28.555576049185973),2022-02-17
102981,4247,empty strain - H5N1 (HPAI non. Plt),,8/04/2022,30/06/2022,Resolved,1,,Brevard County,Thalasseus maximus,Wild,No,28.579,-80.838,wild,FALSE,POINT (-80.83740234375 28.57487404744697),2022-04-08
148257,4247,H5N1 (HPAI non. Plt),,17/01/2025,,Continuing,1,,Orange County,Birds,Domestic,No,28.598,-81.378,domestic,FALSE,POINT (-81.375732421875 28.594168506232606),2025-01-17
100288,4247,empty strain - H5N1 (HPAI non. Plt),,18/03/2022,30/06/2022,Resolved,1,,Brevard County,"Ardea herodias, Bubo virginianus",Wild,No,28.599,-80.846,wild,FALSE,POINT (-80.848388671875 28.603814407841327),2022-03-18
104782,4247,H5N1 (HPAI non. Plt),,21/06/2022,30/06/2022,Resolved,1,,Brevard County,Mycteria americana,Wild,No,28.599,-80.846,wild,FALSE,POINT (-80.848388671875 28.603814407841327),2022-06-21
105445,4247,H5N1 (HPAI non. Plt),,15/07/2022,4/01/2023,Resolved,1,,Seminole County,Birds,Domestic,No,28.777,-81.28,domestic,FALSE,POINT (-81.27685546875 28.777289039997626),2022-07-15
108231,4247,H5N1 (HPAI non. Plt),,16/10/2022,20/02/2023,Resolved,1,,Lake County,Birds,Domestic,No,28.81,-81.733,domestic,FALSE,POINT (-81.73828125 28.806173508854783),2022-10-16
101557,4247,empty strain - H5N1 (HPAI non. Plt),,21/03/2022,30/06/2022,Resolved,1,,Volusia County,Thalasseus maximus,Wild,No,29.009,-81.299,wild,FALSE,POINT (-81.298828125 29.008140362978153),2022-03-21
102703,4247,empty strain - H5N1 (HPAI non. Plt),,1/04/2022,30/06/2022,Resolved,1,,Dixie County,"Gavia immer, Larus atricilla",Wild,No,29.649,-83.122,wild,FALSE,POINT (-83.12255859375 29.649868677972307),2022-04-01
134426,4247,H5N1 (HPAI non. Plt),,17/04/2024,23/08/2024,Resolved,1,,Clay County,Birds,Domestic,No,30.003,-81.686,domestic,FALSE,POINT (-81.683349609375 30.00251693857068),2024-04-17
99296,4247,empty strain - H5N1 (HPAI non. Plt),,9/03/2022,30/06/2022,Resolved,1,,Duval County,Pelecanus occidentalis,Wild,No,30.264,-81.663,wild,FALSE,POINT (-81.661376953125 30.26855624904772),2022-03-09
102700,4247,empty strain - H5N1 (HPAI non. Plt),,20/04/2022,30/06/2022,Resolved,1,,Duval County,Cairina moschata,Wild,No,30.268,-81.721,wild,FALSE,POINT (-81.71630859375 30.26855624904772),2022-04-20
108974,4247,H5N1 (HPAI non. Plt),,1/11/2022,15/03/2023,Resolved,1,,Duval County,Birds,Domestic,No,30.33,-81.664,domestic,FALSE,POINT (-81.661376953125 30.32547125932811),2022-11-01
110663,4247,H5N1 (HPAI non. Plt),,12/12/2022,14/04/2023,Resolved,1,,Duval County,Birds,Domestic,No,30.324,-81.666,domestic,FALSE,POINT (-81.661376953125 30.32547125932811),2022-12-12
127575,4247,empty strain - H5N1 (HPAI non. Plt),,13/11/2023,28/03/2024,Resolved,1,,Duval County,Birds,Domestic,No,30.33,-81.664,domestic,FALSE,POINT (-81.661376953125 30.32547125932811),2023-11-13
103853,4247,empty strain - H5N1 (HPAI non. Plt),,26/05/2022,4/11/2022,Resolved,1,,Toombs County,Birds,Domestic,No,32.219,-82.316,domestic,FALSE,POINT (-82.320556640625 32.222095840502334),2022-05-26
108631,4247,H5N1 (HPAI non. Plt),,17/10/2022,14/03/2023,Resolved,1,,Beaufort County,Birds,Domestic,No,32.43,-80.67,domestic,FALSE,POINT (-80.672607421875 32.42634016154638),2022-10-17
95459,4247,empty strain - H5 (HPAI non. Plt),,30/12/2021,31/12/2021,Resolved,1,4,Colleton County,"Anas americana, Anas discors",Wild,No,32.596,-80.459,wild,FALSE,POINT (-80.4638671875 32.59310597426537),2021-12-30
112078,4247,H5N1 (HPAI non. Plt),,16/12/2022,31/12/2022,Resolved,1,,Colleton County,Anas fulvigula,Wild,No,32.903,-80.668,wild,FALSE,POINT (-80.672607421875 32.90726224488304),2022-12-16
145901,4247,H5N1 (HPAI non. Plt),,11/12/2024,,Continuing,1,,Pickens County,Birds,Domestic,No,33.262,-88.095,domestic,FALSE,POINT (-88.099365234375 33.26624989076275),2024-12-11
106297,4247,H5N1 (HPAI non. Plt),,19/08/2022,27/01/2023,Resolved,1,,Henry 01,Birds,Domestic,No,33.447,-84.129,domestic,FALSE,POINT (-84.13330078125 33.44977658311845),2022-08-19
130577,4247,H5N1 (HPAI non. Plt),,18/01/2024,17/05/2024,Resolved,1,,Orangeburg County,Birds,Domestic,No,33.492,-80.863,domestic,FALSE,POINT (-80.859375 33.495597744865705),2024-01-18
108975,4247,H5N1 (HPAI non. Plt),,3/11/2022,13/03/2023,Resolved,1,,Lowndes County,Birds,Domestic,No,33.506,-88.432,domestic,FALSE,POINT (-88.428955078125 33.50475906922608),2022-11-03
148263,4247,H5N1 (HPAI non. Plt),,25/12/2024,,Continuing,1,,Clayton County,Birds,Domestic,No,33.507,-84.357,domestic,FALSE,POINT (-84.35302734375 33.50475906922608),2024-12-25
116031,4247,H5N1 (HPAI non. Plt),,11/03/2023,14/07/2023,Resolved,1,,Monroe County,Birds,Domestic,No,33.825,-88.545,domestic,FALSE,POINT (-88.5498046875 33.82479361826489),2023-03-11
130536,4247,H5N1 (HPAI non. Plt),,11/01/2024,10/05/2024,Resolved,1,,Horry County,Birds,Domestic,No,33.833,-79.048,domestic,FALSE,POINT (-79.046630859375 33.8339199536547),2024-01-11
135296,4247,H5N1 (HPAI non. Plt),,29/05/2024,18/10/2024,Resolved,1,,Richland County,Birds,Domestic,No,34.008,-81.037,domestic,FALSE,POINT (-81.03515625 34.00713506435885),2024-05-29
129063,4247,H5N1 (HPAI non. Plt),,7/12/2023,7/04/2024,Resolved,1,,Etowah County,Birds,Domestic,No,34.016,-86.012,domestic,FALSE,POINT (-86.011962890625 34.016241889667015),2023-12-07
110045,4247,H5N1 (HPAI non. Plt),,26/11/2022,4/04/2023,Resolved,1,,Lawrence County,Birds,Domestic,No,34.48,-87.293,domestic,FALSE,POINT (-87.29736328125 34.4793919710481),2022-11-26
98072,4247,empty strain - H5N1 (HPAI non. Plt),,17/02/2022,30/06/2022,Resolved,1,,Carteret County,Aythya americana,Wild,No,34.735,-76.646,wild,FALSE,POINT (-76.640625 34.73258420612362),2022-02-17
98110,4247,empty strain - H5N1 (HPAI non. Plt),,23/02/2022,30/06/2022,Resolved,1,,Limestone County,Anas americana,Wild,No,34.749,-86.938,wild,FALSE,POINT (-86.934814453125 34.7506398050501),2022-02-23
110186,4247,H5N1 (HPAI non. Plt),,5/12/2022,10/04/2023,Resolved,1,,Onslow County,Birds,Domestic,No,34.781,-77.486,domestic,FALSE,POINT (-77.486572265625 34.77771580360469),2022-12-05
109109,4247,H5N1 (HPAI non. Plt),,17/11/2022,22/03/2023,Resolved,1,,Union County,Birds,Domestic,No,34.983,-80.55,domestic,FALSE,POINT (-80.5517578125 34.985003130171066),2022-11-17
109921,4247,H5N1 (HPAI non. Plt),,30/11/2022,3/04/2023,Resolved,1,,Union County,Birds,Domestic,No,34.985,-80.55,domestic,FALSE,POINT (-80.5517578125 34.985003130171066),2022-11-30
99294,4247,empty strain - H5N1 (HPAI non. Plt),,16/02/2022,30/06/2022,Resolved,1,,Craven County,Aix sponsa,Wild,No,35.125,-77.071,wild,FALSE,POINT (-77.069091796875 35.12889434101051),2022-02-16
96627,4247,empty strain - H5N1 (HPAI non. Plt),,20/01/2022,30/06/2022,Resolved,1,,Pamlico County,"Anas acuta, Anas carolinensis, Anas platyrhynchos, Anas strepera",Wild,No,35.145,-76.758,wild,FALSE,POINT (-76.761474609375 35.1468629067563),2022-01-20
127152,4247,H5N1 (HPAI non. Plt),,16/10/2023,5/04/2024,Resolved,1,,Lincoln County,Birds,Domestic,No,35.152,-86.57,domestic,FALSE,POINT (-86.572265625 35.15584570226544),2023-10-16
96626,4247,empty strain - H5N1 (HPAI non. Plt),,20/01/2022,30/06/2022,Resolved,1,,Hyde County,"Anas clypeata, Anser caerulescens",Wild,No,35.393,-76.328,wild,FALSE,POINT (-76.3330078125 35.38904996691167),2022-01-20
108438,4247,H5N1 (HPAI non. Plt),,22/10/2022,1/03/2023,Resolved,1,,Tipton County,Birds,Domestic,No,35.565,-89.649,domestic,FALSE,POINT (-89.6484375 35.56798045801209),2022-10-22
147244,4247,H5N1 (HPAI non. Plt),,23/12/2024,,Continuing,1,,Tipton County,Birds,Domestic,No,35.564,-89.646,domestic,FALSE,POINT (-89.6484375 35.56798045801209),2024-12-23
113104,4247,H5N1 (HPAI non. Plt),,20/01/2023,25/05/2023,Resolved,1,,Rowan County,Birds,Domestic,No,35.668,-80.471,domestic,FALSE,POINT (-80.474853515625 35.666222341034796),2023-01-20
118928,4247,H5N1 (HPAI non. Plt),,1/05/2023,19/09/2023,Resolved,1,,Rowan County,Birds,Domestic,No,35.668,-80.464,domestic,FALSE,POINT (-80.4638671875 35.666222341034796),2023-05-01
98956,4247,empty strain - H5N1 (HPAI non. Plt),,4/03/2022,30/06/2022,Resolved,1,,Wake County,Buteo lineatus,Wild,No,35.677,-78.746,wild,FALSE,POINT (-78.75 35.67514743608467),2022-03-04
98958,4247,empty strain - H5N1 (HPAI non. Plt),,4/03/2022,30/06/2022,Resolved,1,,Dare County,Haliaeetus leucocephalus,Wild,No,35.789,-75.772,wild,FALSE,POINT (-75.772705078125 35.79108281624994),2022-03-04
108217,4247,H5N1 (HPAI non. Plt),,19/10/2022,18/02/2023,Resolved,1,,Wake County,Birds,Domestic,No,35.8029,-78.6935,domestic,FALSE,POINT (-78.695068359375 35.799993929885275),2022-10-19
109922,4247,empty strain - H5N1 (HPAI non. Plt),,27/11/2022,30/03/2023,Resolved,1,,Knox County,Birds,Domestic,No,35.96,-83.915,domestic,FALSE,POINT (-83.91357421875 35.96022296929668),2022-11-27
109602,4247,H5N1 (HPAI non. Plt),,22/11/2022,28/03/2023,Resolved,1,,Durham County,Birds,Domestic,No,35.994,-78.901,domestic,FALSE,POINT (-78.90380859375 35.99578538642032),2022-11-22
133692,4247,empty strain - H5N1 (HPAI non. Plt),,21/03/2024,5/08/2024,Resolved,1,,Guilford County,Birds,Domestic,No,36.072,-79.794,domestic,FALSE,POINT (-79.793701171875 36.075742215627),2024-03-21
109598,4247,H5N1 (HPAI non. Plt),,15/11/2022,23/03/2023,Resolved,1,,Davidson County,Birds,Domestic,No,36.168,-86.777,domestic,FALSE,POINT (-86.781005859375 36.16448788632064),2022-11-15
148267,4247,H5N1 (HPAI non. Plt),,5/01/2025,,Continuing,1,,Greene County,Birds,Domestic,No,36.164,-82.833,domestic,FALSE,POINT (-82.8369140625 36.16448788632064),2025-01-05
147237,4247,H5N1 (HPAI non. Plt),,15/12/2024,,Continuing,1,,Pemiscot County,Birds,Domestic,No,36.19,-89.657,domestic,FALSE,POINT (-89.659423828125 36.191092021824545),2024-12-15
100284,4247,empty strain - H5N1 (HPAI non. Plt),,1/03/2022,30/06/2022,Resolved,1,,Obion County,Aix sponsa,Wild,No,36.419,-89.002,wild,FALSE,POINT (-89.000244140625 36.4212824436495),2022-03-01
108044,4247,H5N1 (HPAI non. Plt),,17/10/2022,3/03/2023,Resolved,1,,Southampton County,Birds,Domestic,No,36.718,-77.069,domestic,FALSE,POINT (-77.069091796875 36.721273880045004),2022-10-17
151590,4247,H5N1 (HPAI non. Plt),,29/01/2025,,Continuing,1,,Virginia Beach,Birds,Domestic,No,36.753,-76.062,domestic,FALSE,POINT (-76.058349609375 36.75649032950518),2025-01-29
109181,4247,H5N1 (HPAI non. Plt),,3/10/2022,11/02/2023,Resolved,1,,Logan County,Birds,Domestic,No,36.845,-86.89,domestic,FALSE,POINT (-86.890869140625 36.84446074079564),2022-10-03
108045,4247,H5N1 (HPAI non. Plt),,19/10/2022,2/03/2023,Resolved,1,,Virginia Beach,Birds,Domestic,No,36.858,-75.984,domestic,FALSE,POINT (-75.9814453125 36.86204269508728),2022-10-19
99259,4247,empty strain - H5N1 (HPAI non. Plt),,1/02/2022,30/06/2022,Resolved,1,,City of Virginia Beach,Anas carolinensis,Wild,No,36.898,-76.031,wild,FALSE,POINT (-76.036376953125 36.89719446989035),2022-02-01
98071,4247,empty strain - H5N1 (HPAI non. Plt),,17/02/2022,30/06/2022,Resolved,1,,Ballard County,Anser caerulescens,Wild,No,36.969,-89.071,wild,FALSE,POINT (-89.066162109375 36.967449464169334),2022-02-17
107580,4247,H5N1 (HPAI non. Plt),,2/10/2022,2/02/2023,Resolved,1,,Hampton County,Birds,Domestic,No,37.04,-76.395,domestic,FALSE,POINT (-76.39892578125 37.03763967977139),2022-10-02
108737,4247,empty strain - H5N1 (HPAI non. Plt),,3/11/2022,6/03/2023,Resolved,1,,Gloucester County,Birds,Domestic,No,37.399,-76.525,domestic,FALSE,POINT (-76.519775390625 37.396346133189226),2022-11-03
148255,4247,H5N1 (HPAI non. Plt),,27/12/2024,,Continuing,1,,Perry County,Birds,Domestic,No,37.729,-89.862,domestic,FALSE,POINT (-89.857177734375 37.72728027686003),2024-12-27
118233,4247,H5N1 (HPAI non. Plt),,2/05/2023,1/09/2023,Resolved,1,,Posey County,Birds,Domestic,No,37.932,-87.895,domestic,FALSE,POINT (-87.890625 37.93553306183642),2023-05-02
106593,4247,H5N1 (HPAI non. Plt),,26/08/2022,3/03/2023,Resolved,1,,Caroline County,Birds,Domestic,No,38.041,-77.352,domestic,FALSE,POINT (-77.354736328125 38.03943889182176),2022-08-26
110744,4247,H5N1 (HPAI non. Plt),,16/12/2022,31/12/2022,Resolved,1,,Pocahontas County,Branta canadensis,Wild,No,38.224,-80.096,wild,FALSE,POINT (-80.101318359375 38.2209197668312),2022-12-16
132138,4247,H5N1 (HPAI non. Plt),,6/02/2024,17/06/2024,Resolved,1,,Kanawha County,Birds,Domestic,No,38.351,-81.639,domestic,FALSE,POINT (-81.639404296875 38.350272538257656),2024-02-06
115410,4247,H5N1 (HPAI non. Plt),,3/03/2023,4/07/2023,Resolved,1,,Rockingham County,Birds,Domestic,No,38.384,-78.989,domestic,FALSE,POINT (-78.99169921875 38.38472766885084),2023-03-03
99295,4247,empty strain - H5N1 (HPAI non. Plt),,8/03/2022,30/06/2022,Resolved,1,,Dubois County,Aythya americana,Wild,No,38.392,-86.941,wild,FALSE,POINT (-86.94580078125 38.393338888322376),2022-03-08
111444,4247,H5N1 (HPAI non. Plt),,18/12/2022,25/04/2023,Resolved,1,,St. Clair County,Birds,Domestic,No,38.533,-89.984,domestic,FALSE,POINT (-89.989013671875 38.53097889440025),2022-12-18
132564,4247,H5N1 (HPAI non. Plt),,15/02/2024,20/06/2024,Resolved,1,,Charles County ,Birds,Domestic,No,38.53,-76.978,domestic,FALSE,POINT (-76.981201171875 38.53097889440025),2024-02-15
151602,4247,H5N1 (HPAI non. Plt),,6/02/2025,,Continuing,1,,Sussex County,Birds,Domestic,No,38.69,-75.386,domestic,FALSE,POINT (-75.38818359375 38.694085047568336),2025-02-06
97454,4247,empty strain - H5N1 (HPAI non. Plt),,8/02/2022,17/05/2022,Resolved,1,,Fauquier County,Birds,Domestic,No,38.736,-77.798,domestic,FALSE,POINT (-77.794189453125 38.736946065675994),2022-02-08
115310,4247,H5N1 (HPAI non. Plt),,19/10/2022,31/12/2022,Resolved,1,,District of Columbia,Parulidae (incognita),Wild,No,38.875,-77.012,wild,FALSE,POINT (-77.01416015625 38.87392853923629),2022-10-19
104357,4247,H5N1 (HPAI non. Plt),,3/06/2022,30/06/2022,Resolved,1,,District of Columbia,Anas platyrhynchos,Wild,No,38.879,-77.039,wild,FALSE,POINT (-77.0361328125 38.88248119755082),2022-06-03
107088,4247,H5N1 (HPAI non. Plt),,12/09/2022,24/02/2023,Resolved,1,,Anne Arundel County,Birds,Domestic,No,38.977,-76.485,domestic,FALSE,POINT (-76.48681640625 38.97649248553938),2022-09-12
151589,4247,H5N1 (HPAI non. Plt),,27/01/2025,,Continuing,1,,Montgomery County,Birds,Domestic,No,39.084,-77.152,domestic,FALSE,POINT (-77.156982421875 39.08743603215885),2025-01-27
98111,4247,empty strain - H5N1 (HPAI non. Plt),,23/02/2022,30/06/2022,Resolved,1,,Cape May County,Anas platyrhynchos,Wild,No,39.095,-74.809,wild,FALSE,POINT (-74.805908203125 39.09596293630548),2022-02-23
107089,4247,H5N1 (HPAI non. Plt),,20/09/2022,28/02/2023,Resolved,1,,Kent County,Birds,Domestic,No,39.168,-75.522,domestic,FALSE,POINT (-75.52001953125 39.16414104768742),2022-09-20
107090,4247,H5N1 (HPAI non. Plt),,17/09/2022,28/02/2023,Resolved,1,,Kent County,Birds,Domestic,No,39.175,-75.53,domestic,FALSE,POINT (-75.531005859375 39.17265867042994),2022-09-17
97457,4247,empty strain - H5N1 (HPAI non. Plt),,9/02/2022,30/06/2022,Resolved,1,,Kent County,Anas americana,Wild,No,39.179,-75.533,wild,FALSE,POINT (-75.531005859375 39.1811752615875),2022-02-09
97455,4247,empty strain - H5N1 (HPAI non. Plt),,2/02/2022,30/06/2022,Resolved,1,,Kent County,Aythya affinis,Wild,No,39.231,-76.084,wild,FALSE,POINT (-76.080322265625 39.23225314171489),2022-02-02
102677,4247,empty strain - H5N1 (HPAI non. Plt),,21/04/2022,24/09/2022,Resolved,1,,Johnson County,Birds,Domestic,No,39.467,-86.046,domestic,FALSE,POINT (-86.044921875 39.47012512235818),2022-04-21
151585,4247,H5N1 (HPAI non. Plt),,18/01/2025,,Continuing,1,,Shelby County,Birds,Domestic,No,39.521,-85.778,domestic,FALSE,POINT (-85.78125 39.520992293571965),2025-01-18
152605,4247,H5N1 (HPAI non. Plt),,21/02/2025,,Continuing,1,,Union County,Birds,Domestic,No,39.635,-84.931,domestic,FALSE,POINT (-84.935302734375 39.631076770083666),2025-02-21
151591,4247,H5N1 (HPAI non. Plt),,31/01/2025,,Continuing,1,,Adams County,Birds,Domestic,No,39.83,-77.231,domestic,FALSE,POINT (-77.23388671875 39.83385008019448),2025-01-31
101097,4247,empty strain - H5N1 (HPAI non. Plt),,27/03/2022,5/09/2022,Resolved,1,,Franklin County,Birds,Domestic,No,39.887,-83.01,domestic,FALSE,POINT (-83.0126953125 39.8844501782344),2022-03-27
100290,4247,empty strain - H5N1 (HPAI non. Plt),,24/03/2022,30/06/2022,Resolved,1,,Chester County,Haliaeetus leucocephalus,Wild,No,39.955,-75.591,wild,FALSE,POINT (-75.5859375 39.95185892663005),2022-03-24
132562,4247,H5N1 (HPAI non. Plt),,17/02/2024,21/06/2024,Resolved,1,,Franklin County,Birds,Domestic,No,39.954,-82.999,domestic,FALSE,POINT (-83.001708984375 39.95185892663005),2024-02-17
108368,4247,H5N1 (HPAI non. Plt),,20/10/2022,22/02/2023,Resolved,1,,Ocean County,Birds,Domestic,No,39.964,-74.206,domestic,FALSE,POINT (-74.20166015625 39.96028035429569),2022-10-20
107354,4247,H5N1 (HPAI non. Plt),,22/09/2022,1/03/2023,Resolved,1,,Lancaster County,Birds,Domestic,No,40.0178,-76.3011,domestic,FALSE,POINT (-76.300048828125 40.019201307686785),2022-09-22
112355,4247,H5N1 (HPAI non. Plt),,30/12/2022,16/05/2023,Resolved,1,,Licking County,Birds,Domestic,No,40.057,-82.404,domestic,FALSE,POINT (-82.408447265625 40.05284760182397),2022-12-30
151023,4247,H5N1 (HPAI non. Plt),,24/01/2025,,Continuing,1,,Randolph County,Birds,Domestic,No,40.172,-84.982,domestic,FALSE,POINT (-84.979248046875 40.17047886718112),2025-01-24
108635,4247,H5N1 (HPAI non. Plt),,2/11/2022,9/04/2023,Resolved,1,,Dauphin County,Birds,Domestic,No,40.297,-76.826,domestic,FALSE,POINT (-76.827392578125 40.296286517117125),2022-11-02
107403,4247,H5N1 (HPAI non. Plt),,2/09/2022,14/02/2023,Resolved,1,,Westmoreland County,Birds,Domestic,No,40.302,-79.539,domestic,FALSE,POINT (-79.541015625 40.304665382591764),2022-09-02
107404,4247,H5N1 (HPAI non. Plt),,2/10/2022,3/02/2023,Resolved,1,,Berks County,Birds,Domestic,No,40.325,-75.934,domestic,FALSE,POINT (-75.9375 40.32141999593438),2022-10-02
109105,4247,H5N1 (HPAI non. Plt),,9/11/2022,16/04/2023,Resolved,1,,Berks County,Birds,Domestic,No,40.328,-75.93,domestic,FALSE,POINT (-75.926513671875 40.32979574370208),2022-11-09
108591,4247,H5N1 (HPAI non. Plt),,31/10/2022,4/03/2023,Resolved,1,,Allegheny County,Birds,Domestic,No,40.44,-80.009,domestic,FALSE,POINT (-80.013427734375 40.438585867043315),2022-10-31
113843,4247,H5N1 (HPAI non. Plt),,27/01/2023,21/06/2023,Resolved,1,,Allegheny County,Birds,Domestic,No,40.44,-79.995,domestic,FALSE,POINT (-79.991455078125 40.438585867043315),2023-01-27
98929,4247,empty strain - H5N1 (HPAI non. Plt),,6/03/2022,9/08/2022,Resolved,1,,McLean County,Birds,Domestic,No,40.501,-88.922,domestic,FALSE,POINT (-88.92333984375 40.497092372695676),2022-03-06
116010,4247,H5N1 (HPAI non. Plt),,28/02/2023,14/07/2023,Resolved,1,,Mifflin County,Birds,Domestic,No,40.597,-77.577,domestic,FALSE,POINT (-77.574462890625 40.597270634420255),2023-02-28
131968,4247,H5N1 (HPAI non. Plt),,2/02/2024,8/06/2024,Resolved,1,,Schuylkill County,Birds,Domestic,No,40.688,-76.198,domestic,FALSE,POINT (-76.201171875 40.68896903762433),2024-02-02
106870,4247,empty strain - H5N1 (HPAI non. Plt),,7/09/2022,21/02/2023,Resolved,1,,Allen County,Birds,Domestic,No,40.749,-84.097,domestic,FALSE,POINT (-84.100341796875 40.747256962804215),2022-09-07
107150,4247,H5N1 (HPAI non. Plt),,20/09/2022,31/12/2022,Resolved,1,,Nassau County,Rynchops niger,Wild,No,40.757,-73.621,wild,FALSE,POINT (-73.619384765625 40.75557964275589),2022-09-20
152599,4247,H5N1 (HPAI non. Plt),,11/02/2025,,Continuing,1,,Stark County,Birds,Domestic,No,40.799,-81.375,domestic,FALSE,POINT (-81.375732421875 40.79717741518766),2025-02-11
108978,4247,H5N1 (HPAI non. Plt),,27/10/2022,31/12/2022,Resolved,1,,Suffolk County,"Estrildidae (incognita), Psittacidae (incognita)",Wild,No,40.82,-73.222,wild,FALSE,POINT (-73.223876953125 40.822123575169456),2022-10-27
113101,4247,H5N1 (HPAI non. Plt),,16/01/2023,27/06/2023,Resolved,1,,Suffolk County,Birds,Domestic,No,40.826,-73.232,domestic,FALSE,POINT (-73.23486328125 40.822123575169456),2023-01-16
109164,4247,H5N1 (HPAI non. Plt),,9/10/2022,13/02/2023,Resolved,1,,Warren County,Birds,Domestic,No,40.827,-75.076,domestic,FALSE,POINT (-75.08056640625 40.83043687764922),2022-10-09
152598,4247,H5N1 (HPAI non. Plt),,18/02/2025,,Continuing,1,,Butler County,Birds,Domestic,No,40.859,-79.897,domestic,FALSE,POINT (-79.892578125 40.85537053192493),2025-02-18
106592,4247,H5N1 (HPAI non. Plt),,1/08/2022,14/02/2023,Resolved,1,,Ashland County,Birds,Domestic,No,40.891,-82.305,domestic,FALSE,POINT (-82.3095703125 40.88860081193033),2022-08-01
108623,4247,H5N1 (HPAI non. Plt),,26/10/2022,3/03/2023,Resolved,1,,Bergen County,Birds,Domestic,No,40.903,-74.03,domestic,FALSE,POINT (-74.02587890625 40.90520969727359),2022-10-26
97908,4247,empty strain - H5N1 (HPAI non. Plt),,13/02/2022,1/08/2022,Resolved,1,,Suffolk County,Birds,Domestic,No,40.937,-72.702,domestic,FALSE,POINT (-72.696533203125 40.93841495689796),2022-02-13
151606,4247,H5N1 (HPAI non. Plt),,19/02/2025,,Continuing,1,,Jasper County,Birds,Domestic,No,40.936,-87.151,domestic,FALSE,POINT (-87.154541015625 40.93841495689796),2025-02-19
101872,4247,empty strain - H5N1 (HPAI non. Plt),,25/03/2022,30/06/2022,Resolved,1,,Suffolk County,Phasianidae (incognita),Wild,No,40.961,-72.709,wild,FALSE,POINT (-72.70751953125 40.963307953073524),2022-03-25
99258,4247,empty strain - H5N1 (HPAI non. Plt),,26/02/2022,30/06/2022,Resolved,1,,Suffolk County,Calidris alba,Wild,No,40.974,-72.67,wild,FALSE,POINT (-72.674560546875 40.971603532799094),2022-02-26
102982,4247,empty strain - H5N1 (HPAI non. Plt),,8/04/2022,30/06/2022,Resolved,1,,Suffolk County,Corvus ossifragus,Wild,No,40.97,-72.653,wild,FALSE,POINT (-72.652587890625 40.971603532799094),2022-04-08
107405,4247,H5N1 (HPAI non. Plt),,29/09/2022,17/02/2023,Resolved,1,,Monroe County,Birds,Domestic,No,40.983,-75.192,domestic,FALSE,POINT (-75.1904296875 40.979898069620134),2022-09-29
151503,4247,H5N1 (HPAI non. Plt),,27/01/2025,,Continuing,1,,Monroe County,Birds,Domestic,No,40.987,-75.195,domestic,FALSE,POINT (-75.1904296875 40.98819156349393),2025-01-27
104185,4247,H5N1 (HPAI non. Plt),,1/06/2022,31/10/2022,Resolved,1,,Allen County,Birds,Domestic,No,41.067,-85.161,domestic,FALSE,POINT (-85.166015625 41.07106913080642),2022-06-01
103355,4247,empty strain - H5N1 (HPAI non. Plt),,10/05/2022,9/10/2022,Resolved,1,,Allen County,Birds,Domestic,No,41.081,-85.094,domestic,FALSE,POINT (-85.089111328125 41.07935114946898),2022-05-10
106873,4247,H5N1 (HPAI non. Plt),,9/09/2022,14/02/2023,Resolved,1,,Summit County,Birds,Domestic,No,41.083,-81.52,domestic,FALSE,POINT (-81.5185546875 41.07935114946898),2022-09-09
132567,4247,H5N1 (HPAI non. Plt),,19/02/2024,22/06/2024,Resolved,1,,Allen County,Birds,Domestic,No,41.08,-85.138,domestic,FALSE,POINT (-85.133056640625 41.07935114946898),2024-02-19
132700,4247,H5N1 (HPAI non. Plt),,17/02/2024,25/06/2024,Resolved,1,,Mahoning County,Birds,Domestic,No,41.099,-80.651,domestic,FALSE,POINT (-80.650634765625 41.09591205639546),2024-02-17
107399,4247,H5N1 (HPAI non. Plt),,28/09/2022,6/03/2023,Resolved,1,,Portage County,Birds,Domestic,No,41.157,-81.22,domestic,FALSE,POINT (-81.221923828125 41.153842357114485),2022-09-28
152597,4247,H5N1 (HPAI non. Plt),,12/02/2025,,Continuing,1,,Luzerne County,Birds,Domestic,No,41.252,-75.88,domestic,FALSE,POINT (-75.882568359375 41.253032440653186),2025-02-12
105540,4247,H5N1 (HPAI non. Plt),,1/06/2022,30/06/2022,Resolved,1,,Nantucket County,Pandion haliaetus,Wild,No,41.295,-69.979,wild,FALSE,POINT (-69.98291015625 41.29431726315258),2022-06-01
149529,4247,H5N1 (HPAI non. Plt),,19/01/2025,,Continuing,1,,New Haven,Birds,Domestic,No,41.307,-72.926,domestic,FALSE,POINT (-72.92724609375 41.31082388091818),2025-01-19
107406,4247,H5N1 (HPAI non. Plt),,28/09/2022,6/02/2023,Resolved,1,,New Haven County,Birds,Domestic,No,41.325,-72.903,domestic,FALSE,POINT (-72.9052734375 41.32732632036621),2022-09-28
101234,4247,empty strain - H5N1 (HPAI non. Plt),,2/03/2022,30/06/2022,Resolved,1,,Sandusky County,Haliaeetus leucocephalus,Wild,No,41.35,-83.112,wild,FALSE,POINT (-83.111572265625 41.35207214451293),2022-03-02
148264,4247,H5N1 (HPAI non. Plt),,12/01/2025,,Continuing,1,,New London,Birds,Domestic,No,41.355,-72.1,domestic,FALSE,POINT (-72.103271484375 41.35207214451293),2025-01-12
151597,4247,H5N1 (HPAI non. Plt),,30/01/2025,,Continuing,1,,New London County,Birds,Domestic,No,41.355,-72.1,domestic,FALSE,POINT (-72.103271484375 41.35207214451293),2025-01-30
98479,4247,empty strain - H5N1 (HPAI non. Plt),,23/02/2022,12/08/2022,Resolved,1,,New London County,Birds,Domestic,No,41.363,-72.116,domestic,FALSE,POINT (-72.1142578125 41.36031866306709),2022-02-23
142380,4247,H5N1 (HPAI non. Plt),,22/10/2024,,Continuing,1,,Venango County,Birds,Domestic,No,41.397,-79.827,domestic,FALSE,POINT (-79.82666015625 41.39329428878486),2024-10-22
149531,4247,H5N1 (HPAI non. Plt),,15/01/2025,,Continuing,1,,Putnam County,Birds,Domestic,No,41.426,-73.678,domestic,FALSE,POINT (-73.67431640625 41.42625319507269),2025-01-15
99300,4247,empty strain - H5N1 (HPAI non. Plt),,10/03/2022,30/06/2022,Resolved,1,,Erie County,Larus argentatus,Wild,No,41.444,-82.778,wild,FALSE,POINT (-82.781982421875 41.44272637767213),2022-03-10
104785,4247,H5N1 (HPAI non. Plt),,6/07/2022,31/12/2022,Resolved,1,,Washington County,Larus marinus,Wild,No,41.451,-71.514,wild,FALSE,POINT (-71.510009765625 41.4509614012039),2022-07-06
149525,4247,H5N1 (HPAI non. Plt),,19/01/2025,,Continuing,1,,Washington County,Birds,Domestic,No,41.448,-71.47,domestic,FALSE,POINT (-71.466064453125 41.4509614012039),2025-01-19
106867,4247,H5N1 (HPAI non. Plt),,3/09/2022,12/02/2023,Resolved,1,,Williams County,Birds,Domestic,No,41.474,-84.551,domestic,FALSE,POINT (-84.55078125 41.47566020027821),2022-09-03
103189,4247,empty strain - H5N1 (HPAI non. Plt),,4/05/2022,30/06/2022,Resolved,1,,Cuyahoga County,Falco peregrinus,Wild,No,41.494,-81.685,wild,FALSE,POINT (-81.683349609375 41.49212083968777),2022-05-04
108158,4247,H5N1 (HPAI non. Plt),,16/10/2022,21/02/2023,Resolved,1,,Newport County,Birds,Domestic,No,41.506,-71.291,domestic,FALSE,POINT (-71.290283203125 41.50857729743936),2022-10-16
99297,4247,empty strain - H5N1 (HPAI non. Plt),,9/03/2022,30/06/2022,Resolved,1,,Will County,Branta canadensis,Wild,No,41.513,-88.09,wild,FALSE,POINT (-88.08837890625 41.51680395810118),2022-03-09
97917,4247,empty strain - H5N1 (HPAI non. Plt),,16/02/2022,30/06/2022,Resolved,1,,Middlesex County,Anas platyrhynchos,Wild,No,41.555,-72.575,wild,FALSE,POINT (-72.57568359375 41.557921577804194),2022-02-16
131575,4247,H5N1 (HPAI non. Plt),,29/01/2024,4/06/2024,Resolved,1,,Wayne County,Birds,Domestic,No,41.575,-75.254,domestic,FALSE,POINT (-75.25634765625 41.57436130598913),2024-01-29
108634,4247,H5N1 (HPAI non. Plt),,31/10/2022,3/04/2023,Resolved,1,,Sullivan County,Birds,Domestic,No,41.663,-74.677,domestic,FALSE,POINT (-74.674072265625 41.66470503009205),2022-10-31
98116,4247,empty strain - H5N1 (HPAI non. Plt),,7/02/2022,1/08/2022,Resolved,1,,Dutchess County,Phasianidae (incognita),Wild,No,41.673,-73.894,wild,FALSE,POINT (-73.89404296875 41.67291181960209),2022-02-07
100285,4247,empty strain - H5N1 (HPAI non. Plt),,16/03/2022,30/06/2022,Resolved,1,,Barnstable County,Buteo jamaicensis,Wild,No,41.676,-70.345,wild,FALSE,POINT (-70.345458984375 41.67291181960209),2022-03-16
105539,4247,H5N1 (HPAI non. Plt),,1/06/2022,30/06/2022,Resolved,1,,Barnstable County,Morus bassanus,Wild,No,41.676,-70.343,wild,FALSE,POINT (-70.345458984375 41.67291181960209),2022-06-01
105538,4247,H5N1 (HPAI non. Plt),,6/07/2022,31/12/2022,Resolved,1,,Barnstable County,Somateria mollissima,Wild,No,41.68,-70.417,wild,FALSE,POINT (-70.42236328125 41.68111756290651),2022-07-06
98478,4247,empty strain - H5N1 (HPAI non. Plt),,1/03/2022,30/06/2022,Resolved,1,,Barnstable County,Branta canadensis,Wild,No,41.687,-70.3,wild,FALSE,POINT (-70.301513671875 41.68932225997045),2022-03-01
102122,4247,empty strain - H5N1 (HPAI non. Plt),,14/04/2022,30/06/2022,Resolved,1,,Cook County,Phalacrocoracidae (incognita),Wild,No,41.694,-87.567,wild,FALSE,POINT (-87.572021484375 41.697525910759026),2022-04-14
130332,4247,H5N1 (HPAI non. Plt),,1/01/2024,21/05/2024,Resolved,1,,Barnstable 01,Birds,Domestic,No,41.7,-70.303,domestic,FALSE,POINT (-70.301513671875 41.697525910759026),2024-01-01
114305,4247,empty strain - H5N1 (HPAI non. Plt),,6/02/2023,19/06/2023,Resolved,1,,Tioga County,Birds,Domestic,No,41.747,-77.302,domestic,FALSE,POINT (-77.2998046875 41.746725841769376),2023-02-06
102896,4247,empty strain - H5N1 (HPAI non. Plt),,21/04/2022,23/10/2022,Resolved,1,,Kane County,Birds,Domestic,No,41.894,-88.345,domestic,FALSE,POINT (-88.341064453125 41.894099558113965),2022-04-21
106904,4247,H5N1 (HPAI non. Plt),,11/09/2022,17/02/2023,Resolved,1,,Bristol County,Birds,Domestic,No,41.902,-71.093,domestic,FALSE,POINT (-71.092529296875 41.902277040963696),2022-09-11
100489,4247,empty strain - H5N1 (HPAI non. Plt),,17/03/2022,30/06/2022,Resolved,1,,Monroe County,Strix varia,Wild,No,41.908,-83.375,wild,FALSE,POINT (-83.375244140625 41.9104534766642),2022-03-17
127576,4247,H5N1 (HPAI non. Plt),,11/11/2023,14/03/2024,Resolved,1,,Cass County,Birds,Domestic,No,41.912,-86.012,domestic,FALSE,POINT (-86.011962890625 41.9104534766642),2023-11-11
151603,4247,H5N1 (HPAI non. Plt),,7/02/2025,,Continuing,1,,Monroe County,Birds,Domestic,No,41.914,-83.397,domestic,FALSE,POINT (-83.397216796875 41.9104534766642),2025-02-07
98117,4247,empty strain - H5N1 (HPAI non. Plt),,19/02/2022,1/08/2022,Resolved,1,,Ulster County,Birds,Domestic,No,41.944,-73.97,domestic,FALSE,POINT (-73.970947265625 41.94314874732697),2022-02-19
149520,4247,H5N1 (HPAI non. Plt),,15/01/2025,,Continuing,1,,Plymouth County,Birds,Domestic,No,41.94,-70.65,domestic,FALSE,POINT (-70.653076171875 41.94314874732697),2025-01-15
102694,4247,empty strain - H5N1 (HPAI non. Plt),,24/04/2022,3/10/2022,Resolved,1,,Branch County,Birds,Domestic,No,41.955,-85.033,domestic,FALSE,POINT (-85.0341796875 41.95131994679696),2022-04-24
101100,4247,empty strain - H5N1 (HPAI non. Plt),,26/03/2022,7/09/2022,Resolved,1,,Carroll County,Birds,Domestic,No,42.086,-89.977,domestic,FALSE,POINT (-89.97802734375 42.090070068683985),2022-03-26
112079,4247,H5N1 (HPAI non. Plt),,19/12/2022,31/12/2022,Resolved,1,,Erie County,Melanitta fusca,Wild,No,42.129,-80.085,wild,FALSE,POINT (-80.09033203125 42.13082130188812),2022-12-19
146555,4247,H5N1 (HPAI non. Plt),,23/12/2024,,Continuing,1,,Jackson County,Birds,Domestic,No,42.231,-84.426,domestic,FALSE,POINT (-84.429931640625 42.22851735620853),2024-12-23
98119,4247,empty strain - H5N1 (HPAI non. Plt),,22/02/2022,3/08/2022,Resolved,1,,Kalamazoo County,Birds,Domestic,No,42.256,-85.535,domestic,FALSE,POINT (-85.53955078125 42.25291778330197),2022-02-22
103348,4247,empty strain - H5N1 (HPAI non. Plt),,8/05/2022,13/10/2022,Resolved,1,,Boone County,Birds,Domestic,No,42.268,-88.874,domestic,FALSE,POINT (-88.87939453125 42.26917949243506),2022-05-08
101556,4247,empty strain - H5N1 (HPAI non. Plt),,9/03/2022,30/06/2022,Resolved,1,,Kalamazoo County,Cygnus atratus,Wild,No,42.279,-85.585,wild,FALSE,POINT (-85.58349609375 42.2773087742371),2022-03-09
152604,4247,H5N1 (HPAI non. Plt),,15/02/2025,,Continuing,1,,Delaware County,Birds,Domestic,No,42.278,-74.917,domestic,FALSE,POINT (-74.915771484375 42.2773087742371),2025-02-15
148252,4247,H5N1 (HPAI non. Plt),,9/01/2025,,Continuing,1,,Wayne County,Birds,Domestic,No,42.33,-83.043,domestic,FALSE,POINT (-83.045654296875 42.32606244456201),2025-01-09
108619,4247,H5N1 (HPAI non. Plt),,26/10/2022,6/03/2023,Resolved,1,,Middlesex County,Birds,Domestic,No,42.398,-71.142,domestic,FALSE,POINT (-71.1474609375 42.39912215986001),2022-10-26
101085,4247,empty strain - H5N1 (HPAI non. Plt),,18/03/2022,31/08/2022,Resolved,1,,Berkshire County,Birds,Domestic,No,42.465,-73.288,domestic,FALSE,POINT (-73.289794921875 42.463992800170615),2022-03-18
115794,4247,H5N1 (HPAI non. Plt),,8/03/2023,20/07/2023,Resolved,1,,Eaton County,Birds,Domestic,No,42.582,-84.847,domestic,FALSE,POINT (-84.847412109375 42.58544425738492),2023-03-08
100279,4247,empty strain - H5N1 (HPAI non. Plt),,20/03/2022,23/08/2022,Resolved,1,,Macomb County,Birds,Domestic,No,42.597,-82.866,domestic,FALSE,POINT (-82.869873046875 42.59353262564994),2022-03-20
101864,4247,empty strain - H5N1 (HPAI non. Plt),,10/04/2022,13/09/2022,Resolved,1,,Macomb County,Birds,Domestic,No,42.593,-82.864,domestic,FALSE,POINT (-82.85888671875 42.59353262564994),2022-04-10
106908,4247,H5N1 (HPAI non. Plt),,12/09/2022,15/02/2023,Resolved,1,,Macomb County,Birds,Domestic,No,42.597,-82.881,domestic,FALSE,POINT (-82.880859375 42.59353262564994),2022-09-12
101865,4247,empty strain - H5N1 (HPAI non. Plt),,11/04/2022,22/09/2022,Resolved,1,,Livingston County,Birds,Domestic,No,42.602,-83.95,domestic,FALSE,POINT (-83.946533203125 42.60161994432798),2022-04-11
134756,4247,H5N1 (HPAI non. Plt),,16/02/2024,30/06/2024,Resolved,1,,Essex County,Melanitta perspicillata,Wild,No,42.613,-70.661,wild,FALSE,POINT (-70.6640625 42.60970621339408),2024-02-16
148251,4247,H5N1 (HPAI non. Plt),,3/01/2025,,Continuing,1,,Oakland County ,Birds,Domestic,No,42.634,-83.327,domestic,FALSE,POINT (-83.331298828125 42.63395872267313),2025-01-03
109467,4247,H5N1 (HPAI non. Plt),,17/10/2022,31/12/2022,Resolved,1,,Albany County,Falco columbarius,Wild,No,42.652,-73.756,wild,FALSE,POINT (-73.751220703125 42.650121813680215),2022-10-17
101102,4247,empty strain - H5N1 (HPAI non. Plt),,25/03/2022,8/12/2022,Resolved,1,,Rock County,Birds,Domestic,No,42.67,-89.022,domestic,FALSE,POINT (-89.022216796875 42.666280705649285),2022-03-25
102973,4247,empty strain - H5N1 (HPAI non. Plt),,26/04/2022,4/10/2022,Resolved,1,,Oakland County,Birds,Domestic,No,42.676,-83.269,domestic,FALSE,POINT (-83.265380859375 42.67435857693383),2022-04-26
139296,4247,H5N1 (HPAI non. Plt),,30/11/2023,30/12/2023,Resolved,1,,Saint Clair County,Clangula hyemalis,Wild,No,42.7,-82.506,wild,FALSE,POINT (-82.50732421875 42.69858589169843),2023-11-30
131577,4247,H5N1 (HPAI non. Plt),,30/01/2024,11/06/2024,Resolved,1,,Essex County,Birds,Domestic,No,42.801,-70.874,domestic,FALSE,POINT (-70.872802734375 42.80346172417077),2024-01-30
105536,4247,H5N1 (HPAI non. Plt),,25/07/2022,31/12/2022,Resolved,1,,Seneca County,Megascops asio,Wild,No,42.905,-76.862,wild,FALSE,POINT (-76.8603515625 42.90816007196054),2022-07-25
110397,4247,H5N1 (HPAI non. Plt),,12/09/2022,31/12/2022,Resolved,1,,Seneca County,Podilymbus podiceps,Wild,No,42.908,-76.844,wild,FALSE,POINT (-76.849365234375 42.90816007196054),2022-09-12
101552,4247,empty strain - H5N1 (HPAI non. Plt),,5/04/2022,30/06/2022,Resolved,1,,Cayuga County,Accipiter cooperii,Wild,No,42.928,-76.558,wild,FALSE,POINT (-76.552734375 42.92425175387069),2022-04-05
103498,4247,empty strain - H5N1 (HPAI non. Plt),,4/05/2022,30/06/2022,Resolved,1,,Milwaukee County,Phalacrocorax auritus,Wild,No,42.936,-87.897,wild,FALSE,POINT (-87.901611328125 42.93229601903059),2022-05-04
101229,4247,empty strain - H5N1 (HPAI non. Plt),,15/03/2022,30/06/2022,Resolved,1,,Rockingham County,Bubo scandiacus,Wild,No,42.983,-71.045,wild,FALSE,POINT (-71.048583984375 42.98053954751643),2022-03-15
134607,4247,H5N1 (HPAI non. Plt),,3/05/2024,17/09/2024,Resolved,1,,Ionia 04,Birds,Domestic,No,42.983,-85.057,domestic,FALSE,POINT (-85.05615234375 42.98053954751643),2024-05-03
135295,4247,H5N1 (HPAI non. Plt),,16/05/2024,30/06/2024,Resolved,1,,Ionia County,Sturnus vulgaris,Wild,No,42.983,-85.056,wild,FALSE,POINT (-85.05615234375 42.98053954751643),2024-05-16
101231,4247,empty strain - H5N1 (HPAI non. Plt),,24/03/2022,30/06/2022,Resolved,1,,Saint Clair County,Cygnus columbianus,Wild,No,42.998,-82.441,wild,FALSE,POINT (-82.44140625 42.9966123184214),2022-03-24
97456,4247,empty strain - H5N1 (HPAI non. Plt),,9/02/2022,30/06/2022,Resolved,1,,Rockingham County,Anas platyrhynchos,Wild,No,43.013,-71.057,wild,FALSE,POINT (-71.0595703125 43.012680886420355),2022-02-09
101550,4247,empty strain - H5N1 (HPAI non. Plt),,31/03/2022,9/09/2022,Resolved,1,,Fulton County,Birds,Domestic,No,43.015,-74.384,domestic,FALSE,POINT (-74.388427734375 43.012680886420355),2022-03-31
102123,4247,empty strain - H5N1 (HPAI non. Plt),,23/03/2022,30/06/2022,Resolved,1,,Onondaga County,Anas formosa,Wild,No,43.016,-76.115,wild,FALSE,POINT (-76.11328125 43.012680886420355),2022-03-23
108213,4247,H5N1 (HPAI non. Plt),,30/09/2022,9/02/2023,Resolved,1,,Genesee County,Birds,Domestic,No,43.01,-83.58,domestic,FALSE,POINT (-83.583984375 43.012680886420355),2022-09-30
108628,4247,H5N1 (HPAI non. Plt),,31/10/2022,5/04/2023,Resolved,1,,Waukesha County,Birds,Domestic,No,43.012,-88.228,domestic,FALSE,POINT (-88.231201171875 43.012680886420355),2022-10-31
99304,4247,empty strain - H5N1 (HPAI non. Plt),,13/03/2022,16/08/2022,Resolved,1,,Rockingham County,Birds,Domestic,No,43.017,-71.05,domestic,FALSE,POINT (-71.048583984375 43.02071359427862),2022-03-13
132626,4247,H5N1 (HPAI non. Plt),,16/02/2024,5/07/2024,Resolved,1,,Onondaga County,Birds,Domestic,No,43.047,-76.148,domestic,FALSE,POINT (-76.146240234375 43.04480541304369),2024-02-16
108437,4247,H5N1 (HPAI non. Plt),,23/10/2022,16/03/2023,Resolved,1,,Wayne County,Birds,Domestic,No,43.06,-76.992,domestic,FALSE,POINT (-76.9921875 43.060861371343265),2022-10-23
101567,4247,empty strain - H5N1 (HPAI non. Plt),,21/03/2022,30/06/2022,Resolved,1,,Onondaga County,Anatidae (incognita),Wild,No,43.066,-76.184,wild,FALSE,POINT (-76.17919921875 43.06888777416961),2022-03-21
151604,4247,H5N1 (HPAI non. Plt),,6/02/2025,,Continuing,1,,Madison County,Birds,Domestic,No,43.08,-75.705,domestic,FALSE,POINT (-75.706787109375 43.076913126087106),2025-02-06
132699,4247,H5N1 (HPAI non. Plt),,19/02/2024,29/06/2024,Resolved,1,,Monroe County,Birds,Domestic,No,43.154,-77.612,domestic,FALSE,POINT (-77.607421875 43.1571088409533),2024-02-19
116480,4247,H5N1 (HPAI non. Plt),,13/03/2023,24/07/2023,Resolved,1,,Washington County,Birds,Domestic,No,43.287,-73.588,domestic,FALSE,POINT (-73.58642578125 43.28520334369384),2023-03-13
111445,4247,H5N1 (HPAI non. Plt),,5/12/2022,2/05/2023,Resolved,1,,Sanilac County,Birds,Domestic,No,43.421,-82.831,domestic,FALSE,POINT (-82.825927734375 43.421008829947255),2022-12-05
102676,4247,empty strain - H5N1 (HPAI non. Plt),,22/04/2022,27/09/2022,Resolved,1,,Saginaw County,Birds,Domestic,No,43.434,-83.913,domestic,FALSE,POINT (-83.91357421875 43.436965965218235),2022-04-22
102698,4247,empty strain - H5N1 (HPAI non. Plt),,28/04/2022,3/10/2022,Resolved,1,,Sauk County,Birds,Domestic,No,43.464,-89.712,domestic,FALSE,POINT (-89.71435546875 43.460893780082586),2022-04-28
99309,4247,empty strain - H5N1 (HPAI non. Plt),,16/03/2022,17/08/2022,Resolved,1,,York County,Birds,Domestic,No,43.465,-70.754,domestic,FALSE,POINT (-70.751953125 43.468867614829264),2022-03-16
130282,4247,H5N1 (HPAI non. Plt),,4/01/2024,10/05/2024,Resolved,1,,York County,Birds,Domestic,No,43.474,-70.715,domestic,FALSE,POINT (-70.718994140625 43.47684039777894),2024-01-04
99302,4247,empty strain - H5N1 (HPAI non. Plt),,7/03/2022,14/08/2022,Resolved,1,,York County,Birds,Domestic,No,43.489,-70.712,domestic,FALSE,POINT (-70.7080078125 43.492782808225),2022-03-07
112760,4247,H5N1 (HPAI non. Plt),,18/01/2023,29/08/2023,Resolved,1,,Belknap County,Birds,Domestic,No,43.542,-71.485,domestic,FALSE,POINT (-71.488037109375 43.54058479482876),2023-01-18
101858,4247,empty strain - H5N1 (HPAI non. Plt),,10/04/2022,21/09/2022,Resolved,1,42,Columbia County,Birds,Domestic,No,43.555,-89.469,domestic,FALSE,POINT (-89.47265625 43.556510375047566),2022-04-10
102121,4247,empty strain - H5N1 (HPAI non. Plt),,15/04/2022,30/06/2022,Resolved,1,,Columbia County,Cygnus buccinator,Wild,No,43.556,-89.47,wild,FALSE,POINT (-89.47265625 43.556510375047566),2022-04-15
128520,4247,H5N1 (HPAI non. Plt),,15/11/2023,1/04/2024,Resolved,1,,Bay County,Birds,Domestic,No,43.603,-83.886,domestic,FALSE,POINT (-83.880615234375 43.60426186809619),2023-11-15
149524,4247,H5N1 (HPAI non. Plt),,15/01/2025,,Continuing,1,,Windosr County,Birds,Domestic,No,43.649,-72.318,domestic,FALSE,POINT (-72.322998046875 43.65197548731186),2025-01-15
104774,4247,H5N1 (HPAI non. Plt),,22/06/2022,26/11/2022,Resolved,1,,Cumberland County,Birds,Domestic,No,43.656,-70.285,domestic,FALSE,POINT (-70.279541015625 43.6599240747891),2022-06-22
152602,4247,H5N1 (HPAI non. Plt),,11/02/2025,,Continuing,1,,Cumberland County,Birds,Domestic,No,43.659,-70.254,domestic,FALSE,POINT (-70.257568359375 43.6599240747891),2025-02-11
101860,4247,empty strain - H5N1 (HPAI non. Plt),,1/04/2022,22/09/2022,Resolved,1,,Sheboygan County,Birds,Domestic,No,43.719,-87.708,domestic,FALSE,POINT (-87.703857421875 43.71553472620511),2022-04-01
102695,4247,empty strain - H5N1 (HPAI non. Plt),,20/04/2022,6/10/2022,Resolved,1,,Fond du Lac County,Birds,Domestic,No,43.737,-88.444,domestic,FALSE,POINT (-88.43994140625 43.73935207915471),2022-04-20
109468,4247,H5N1 (HPAI non. Plt),,27/10/2022,31/12/2022,Resolved,1,,Jefferson County,Bonasa umbellus,Wild,No,43.975,-75.911,wild,FALSE,POINT (-75.91552734375 43.97700467496409),2022-10-27
101099,4247,empty strain - H5N1 (HPAI non. Plt),,27/03/2022,28/08/2022,Resolved,1,,Lincoln County,Birds,Domestic,No,44.012,-69.696,domestic,FALSE,POINT (-69.697265625 44.00862011541537),2022-03-27
98951,4247,empty strain - H5N1 (HPAI non. Plt),,7/03/2022,11/08/2022,Resolved,1,,Lincoln County,Birds,Domestic,No,44.063,-69.49,domestic,FALSE,POINT (-69.488525390625 44.06390660801779),2022-03-07
99306,4247,empty strain - H5N1 (HPAI non. Plt),,14/03/2022,16/08/2022,Resolved,1,,Lincoln County,Birds,Domestic,No,44.065,-69.701,domestic,FALSE,POINT (-69.697265625 44.06390660801779),2022-03-14
98118,4247,empty strain - H5N1 (HPAI non. Plt),,19/02/2022,26/07/2022,Resolved,1,,Knox County,Birds,Domestic,No,44.097,-69.131,domestic,FALSE,POINT (-69.1259765625 44.095475729466386),2022-02-19
107345,4247,H5N1 (HPAI non. Plt),,6/09/2022,31/12/2022,Resolved,1,,Manitowoc County,Ardea alba,Wild,No,44.104,-87.689,wild,FALSE,POINT (-87.69287109375 44.10336537791153),2022-09-06
133389,4247,H5N1 (HPAI non. Plt),,8/03/2024,16/07/2024,Resolved,1,,Knox County,Birds,Domestic,No,44.103,-69.111,domestic,FALSE,POINT (-69.114990234375 44.10336537791153),2024-03-08
101098,4247,empty strain - H5N1 (HPAI non. Plt),,21/03/2022,27/08/2022,Resolved,1,,Knox County,Birds,Domestic,No,44.111,-69.135,domestic,FALSE,POINT (-69.136962890625 44.111253973571564),2022-03-21
97910,4247,empty strain - H5N1 (HPAI non. Plt),,14/02/2022,21/07/2022,Resolved,1,,Knox County,Birds,Domestic,No,44.129,-69.151,domestic,FALSE,POINT (-69.14794921875 44.12702800650004),2022-02-14
103499,4247,empty strain - H5N1 (HPAI non. Plt),,12/05/2022,30/06/2022,Resolved,1,,Manitowoc County,Oxyura jamaicensis,Wild,No,44.129,-87.693,wild,FALSE,POINT (-87.69287109375 44.12702800650004),2022-05-12
99308,4247,empty strain - H5N1 (HPAI non. Plt),,15/03/2022,19/08/2022,Resolved,1,,Knox County,Birds,Domestic,No,44.15,-69.17,domestic,FALSE,POINT (-69.169921875 44.15068115978093),2022-03-15
102118,4247,empty strain - H5N1 (HPAI non. Plt),,19/04/2022,30/06/2022,Resolved,1,,Washington County,Cathartes aura,Wild,No,44.247,-72.533,wild,FALSE,POINT (-72.53173828125 44.24519901522129),2022-04-19
113580,4247,H5N1 (HPAI non. Plt),,27/01/2023,4/06/2023,Resolved,1,,Kennebec County,Birds,Domestic,No,44.313,-69.778,domestic,FALSE,POINT (-69.774169921875 44.31598790519692),2023-01-27
131134,4247,H5N1 (HPAI non. Plt),,19/01/2024,25/05/2024,Resolved,1,,Kennebec County,Birds,Domestic,No,44.315,-69.777,domestic,FALSE,POINT (-69.774169921875 44.31598790519692),2024-01-19
101549,4247,empty strain - H5N1 (HPAI non. Plt),,30/03/2022,4/09/2022,Resolved,1,,Waldo County,Birds,Domestic,No,44.444,-69.066,domestic,FALSE,POINT (-69.071044921875 44.44162421758804),2022-03-30
102683,4247,empty strain - H5N1 (HPAI non. Plt),,18/04/2022,25/09/2022,Resolved,1,,Caledonia County,Birds,Domestic,No,44.447,-71.944,domestic,FALSE,POINT (-71.949462890625 44.44946753600692),2022-04-18
101869,4247,empty strain - H5N1 (HPAI non. Plt),,14/04/2022,30/06/2022,Resolved,1,,Brown County,Cygnus olor,Wild,No,44.5,-88.023,wild,FALSE,POINT (-88.0224609375 44.49650533109349),2022-04-14
113103,4247,H5N1 (HPAI non. Plt),,19/01/2023,28/05/2023,Resolved,1,,Hancock County,Birds,Domestic,No,44.543,-68.427,domestic,FALSE,POINT (-68.4228515625 44.54350521320819),2023-01-19
113581,4247,H5N1 (HPAI non. Plt),,11/01/2023,7/06/2023,Resolved,1,,Hancock County,Birds,Domestic,No,44.543,-68.425,domestic,FALSE,POINT (-68.4228515625 44.54350521320819),2023-01-11
110029,4247,H5N1 (HPAI non. Plt),,2/12/2022,8/04/2023,Resolved,1,,Lamoille County,Birds,Domestic,No,44.594,-72.618,domestic,FALSE,POINT (-72.61962890625 44.59046718130884),2022-12-02
98109,4247,empty strain - H5N1 (HPAI non. Plt),,23/02/2022,30/06/2022,Resolved,1,,Washington County,Anas rubripes,Wild,No,44.687,-67.483,wild,FALSE,POINT (-67.47802734375 44.68427737181224),2022-02-23
102115,4247,empty strain - H5N1 (HPAI non. Plt),,15/03/2022,26/08/2022,Resolved,1,,Washington County,Birds,Domestic,No,44.703,-67.487,domestic,FALSE,POINT (-67.489013671875 44.69989765840319),2022-03-15
109160,4247,H5N1 (HPAI non. Plt),,11/11/2022,20/03/2023,Resolved,1,,Washington County,Birds,Domestic,No,44.714,-67.464,domestic,FALSE,POINT (-67.467041015625 44.71551373202135),2022-11-11
101870,4247,empty strain - H5N1 (HPAI non. Plt),,7/04/2022,30/06/2022,Resolved,1,,Franklin County,Haliaeetus leucocephalus,Wild,No,44.808,-73.091,wild,FALSE,POINT (-73.092041015625 44.809121700077355),2022-04-07
147243,4247,H5N1 (HPAI non. Plt),,18/12/2024,,Continuing,1,,Franklin County,Birds,Domestic,No,44.811,-73.083,domestic,FALSE,POINT (-73.0810546875 44.809121700077355),2024-12-18
102686,4247,empty strain - H5N1 (HPAI non. Plt),,24/04/2022,8/11/2022,Resolved,1,,Oconto County,Birds,Domestic,No,44.885,-87.886,domestic,FALSE,POINT (-87.890625 44.887012479812995),2022-04-24
128771,4247,H5N1 (HPAI non. Plt),,2/12/2023,10/04/2024,Resolved,1,,Orleans County,Birds,Domestic,No,44.935,-72.211,domestic,FALSE,POINT (-72.213134765625 44.93369638969469),2023-12-02
108629,4247,H5N1 (HPAI non. Plt),,28/10/2022,3/04/2023,Resolved,1,,Marathon County,Birds,Domestic,No,44.957,-89.625,domestic,FALSE,POINT (-89.62646484375 44.957024125121166),2022-10-28
104362,4247,H5N1 (HPAI non. Plt),,8/06/2022,30/06/2022,Resolved,1,,Alpena County,Agelaius phoeniceus,Wild,No,45.065,-83.459,wild,FALSE,POINT (-83.463134765625 45.06576154770312),2022-06-08
151592,4247,H5N1 (HPAI non. Plt),,12/01/2025,,Continuing,1,,Alpena County,Birds,Domestic,No,45.069,-83.44,domestic,FALSE,POINT (-83.441162109375 45.06576154770312),2025-01-12
103345,4247,empty strain - H5N1 (HPAI non. Plt),,10/05/2022,8/11/2022,Resolved,1,,Marinette County,Birds,Domestic,No,45.1,-87.639,domestic,FALSE,POINT (-87.637939453125 45.0967914639474),2022-05-10
101563,4247,empty strain - H5N1 (HPAI non. Plt),,5/04/2022,12/09/2022,Resolved,1,,Menominee County,Birds,Domestic,No,45.135,-87.632,domestic,FALSE,POINT (-87.626953125 45.135555160125364),2022-04-05
102673,4247,empty strain - H5N1 (HPAI non. Plt),,21/04/2022,23/09/2022,Resolved,1,,Menominee County,Birds,Domestic,No,45.138,-87.631,domestic,FALSE,POINT (-87.626953125 45.135555160125364),2022-04-21
101866,4247,empty strain - H5N1 (HPAI non. Plt),,9/04/2022,16/09/2022,Resolved,1,,Menominee County,Birds,Domestic,No,45.143,-87.612,domestic,FALSE,POINT (-87.615966796875 45.143304739488315),2022-04-09
103873,4247,empty strain - H5N1 (HPAI non. Plt),,9/05/2022,30/06/2022,Resolved,1,,Charlevoix County,Buteo lagopus,Wild,No,45.325,-85.241,wild,FALSE,POINT (-85.242919921875 45.32125436117147),2022-05-09
